Capturing on 'wlo1'
Capture interface: wlo1
Starting Sentinel Live Capture (File Streaming Mode)...
Writer thread started. Writing to live_data/stream.jsonl...
{'timestamp': 1771771414.6978097, 'protocols': 'eth:ethertype:ip:tcp', 'src_ip': '192.168.1.12', 'dst_ip': '192.168.1.20', 'src_port': '1716', 'dst_port': '59812', 'packet_size': '66', 'payload_len': '0', 'info': '1716 → 59812 [ACK] Seq=1 Ack=1 Win=61 Len=0 TSval=293270604 TSecr=4226645070', 'tcp_seq': '1', 'tcp_flags_syn': 'False', 'tcp_flags_ack': 'True', 'tcp_flags_fin': 'False', 'tcp_flags_rst': 'False', 'tcp_flags_psh': 'False', 'tcp_flags_urg': 'False', 'tcp_retransmission': '', 'tcp_window_size': '61', 'ttl_hop_limit': '64', 'fragmentation': 'No'}
{'timestamp': 1771771414.8258328, 'protocols': 'eth:ethertype:ip:tcp', 'src_ip': '192.168.1.20', 'dst_ip': '192.168.1.12', 'src_port': '59812', 'dst_port': '1716', 'packet_size': '66', 'payload_len': '0', 'info': '[TCP ACKed unseen segment] 59812 → 1716 [ACK] Seq=1 Ack=2 Win=390 Len=0 TSval=4226655622 TSecr=293260104', 'tcp_seq': '1', 'tcp_flags_syn': 'False', 'tcp_flags_ack': 'True', 'tcp_flags_fin': 'False', 'tcp_flags_rst': 'False', 'tcp_flags_psh': 'False', 'tcp_flags_urg': 'False', 'tcp_retransmission': '', 'tcp_window_size': '390', 'ttl_hop_limit': '64', 'fragmentation': 'No'}
{'timestamp': 1771771415.2433436, 'protocols': 'eth:ethertype:ip:udp:dns', 'src_ip': '192.168.1.12', 'dst_ip': '192.168.1.1', 'src_port': '45452', 'dst_port': '53', 'packet_size': '95', 'payload_len': '61', 'info': 'Standard query 0x33ac AAAA antigravity-unleash.goog OPT', 'tcp_seq': '0', 'tcp_flags_syn': '', 'tcp_flags_ack': '', 'tcp_flags_fin': '', 'tcp_flags_rst': '', 'tcp_flags_psh': '', 'tcp_flags_urg': '', 'tcp_retransmission': '', 'tcp_window_size': '0', 'ttl_hop_limit': '64', 'fragmentation': 'No'}
{'timestamp': 1771771415.3070183, 'protocols': 'eth:ethertype:ip:udp:dns', 'src_ip': '192.168.1.1', 'dst_ip': '192.168.1.12', 'src_port': '53', 'dst_port': '45452', 'packet_size': '180', 'payload_len': '146', 'info': 'Standard query response 0x33ac AAAA antigravity-unleash.goog SOA ns1.googledomains.com OPT', 'tcp_seq': '0', 'tcp_flags_syn': '', 'tcp_flags_ack': '', 'tcp_flags_fin': '', 'tcp_flags_rst': '', 'tcp_flags_psh': '', 'tcp_flags_urg': '', 'tcp_retransmission': '', 'tcp_window_size': '0', 'ttl_hop_limit': '64', 'fragmentation': 'No'}
{'timestamp': 1771771415.3073626, 'protocols': 'eth:ethertype:ip:tcp', 'src_ip': '192.168.1.12', 'dst_ip': '34.54.84.110', 'src_port': '48766', 'dst_port': '443', 'packet_size': '74', 'payload_len': '0', 'info': '48766 → 443 [SYN] Seq=0 Win=64240 Len=0 MSS=1460 SACK_PERM TSval=3938487933 TSecr=0 WS=1024', 'tcp_seq': '0', 'tcp_flags_syn': 'True', 'tcp_flags_ack': 'False', 'tcp_flags_fin': 'False', 'tcp_flags_rst': 'False', 'tcp_flags_psh': 'False', 'tcp_flags_urg': 'False', 'tcp_retransmission': '', 'tcp_window_size': '64240', 'ttl_hop_limit': '64', 'fragmentation': 'No'}
{'timestamp': 1771771415.307395, 'protocols': 'eth:ethertype:ip:tcp', 'src_ip': '192.168.1.12', 'dst_ip': '34.54.84.110', 'src_port': '48770', 'dst_port': '443', 'packet_size': '74', 'payload_len': '0', 'info': '48770 → 443 [SYN] Seq=0 Win=64240 Len=0 MSS=1460 SACK_PERM TSval=3938487933 TSecr=0 WS=1024', 'tcp_seq': '0', 'tcp_flags_syn': 'True', 'tcp_flags_ack': 'False', 'tcp_flags_fin': 'False', 'tcp_flags_rst': 'False', 'tcp_flags_psh': 'False', 'tcp_flags_urg': 'False', 'tcp_retransmission': '', 'tcp_window_size': '64240', 'ttl_hop_limit': '64', 'fragmentation': 'No'}
{'timestamp': 1771771415.3474343, 'protocols': 'eth:ethertype:ip:tcp', 'src_ip': '34.54.84.110', 'dst_ip': '192.168.1.12', 'src_port': '443', 'dst_port': '48766', 'packet_size': '74', 'payload_len': '0', 'info': '443 → 48766 [SYN, ACK] Seq=0 Ack=1 Win=65535 Len=0 MSS=1250 SACK_PERM TSval=2324301034 TSecr=3938487933 WS=256', 'tcp_seq': '0', 'tcp_flags_syn': 'True', 'tcp_flags_ack': 'True', 'tcp_flags_fin': 'False', 'tcp_flags_rst': 'False', 'tcp_flags_psh': 'False', 'tcp_flags_urg': 'False', 'tcp_retransmission': '', 'tcp_window_size': '65535', 'ttl_hop_limit': '122', 'fragmentation': 'No'}
{'timestamp': 1771771415.3474662, 'protocols': 'eth:ethertype:ip:tcp', 'src_ip': '192.168.1.12', 'dst_ip': '34.54.84.110', 'src_port': '48766', 'dst_port': '443', 'packet_size': '66', 'payload_len': '0', 'info': '48766 → 443 [ACK] Seq=1 Ack=1 Win=64512 Len=0 TSval=3938487973 TSecr=2324301034', 'tcp_seq': '1', 'tcp_flags_syn': 'False', 'tcp_flags_ack': 'True', 'tcp_flags_fin': 'False', 'tcp_flags_rst': 'False', 'tcp_flags_psh': 'False', 'tcp_flags_urg': 'False', 'tcp_retransmission': '', 'tcp_window_size': '63', 'ttl_hop_limit': '64', 'fragmentation': 'No'}
{'timestamp': 1771771415.3478775, 'protocols': 'eth:ethertype:ip:tcp:tls', 'src_ip': '192.168.1.12', 'dst_ip': '34.54.84.110', 'src_port': '48766', 'dst_port': '443', 'packet_size': '1304', 'payload_len': '1238', 'info': '[TCP segment of a reassembled PDU]', 'tcp_seq': '1', 'tcp_flags_syn': 'False', 'tcp_flags_ack': 'True', 'tcp_flags_fin': 'False', 'tcp_flags_rst': 'False', 'tcp_flags_psh': 'False', 'tcp_flags_urg': 'False', 'tcp_retransmission': '', 'tcp_window_size': '63', 'ttl_hop_limit': '64', 'fragmentation': 'No'}
{'timestamp': 1771771415.3478832, 'protocols': 'eth:ethertype:ip:tcp:tls', 'src_ip': '192.168.1.12', 'dst_ip': '34.54.84.110', 'src_port': '48766', 'dst_port': '443', 'packet_size': '362', 'payload_len': '296', 'info': 'Client Hello (SNI=antigravity-unleash.goog)', 'tcp_seq': '1239', 'tcp_flags_syn': 'False', 'tcp_flags_ack': 'True', 'tcp_flags_fin': 'False', 'tcp_flags_rst': 'False', 'tcp_flags_psh': 'True', 'tcp_flags_urg': 'False', 'tcp_retransmission': '', 'tcp_window_size': '63', 'ttl_hop_limit': '64', 'fragmentation': 'No'}
{'timestamp': 1771771415.3508484, 'protocols': 'eth:ethertype:ip:tcp', 'src_ip': '34.54.84.110', 'dst_ip': '192.168.1.12', 'src_port': '443', 'dst_port': '48770', 'packet_size': '74', 'payload_len': '0', 'info': '443 → 48770 [SYN, ACK] Seq=0 Ack=1 Win=65535 Len=0 MSS=1250 SACK_PERM TSval=84728326 TSecr=3938487933 WS=256', 'tcp_seq': '0', 'tcp_flags_syn': 'True', 'tcp_flags_ack': 'True', 'tcp_flags_fin': 'False', 'tcp_flags_rst': 'False', 'tcp_flags_psh': 'False', 'tcp_flags_urg': 'False', 'tcp_retransmission': '', 'tcp_window_size': '65535', 'ttl_hop_limit': '122', 'fragmentation': 'No'}
{'timestamp': 1771771415.3508656, 'protocols': 'eth:ethertype:ip:tcp', 'src_ip': '192.168.1.12', 'dst_ip': '34.54.84.110', 'src_port': '48770', 'dst_port': '443', 'packet_size': '66', 'payload_len': '0', 'info': '48770 → 443 [ACK] Seq=1 Ack=1 Win=64512 Len=0 TSval=3938487977 TSecr=84728326', 'tcp_seq': '1', 'tcp_flags_syn': 'False', 'tcp_flags_ack': 'True', 'tcp_flags_fin': 'False', 'tcp_flags_rst': 'False', 'tcp_flags_psh': 'False', 'tcp_flags_urg': 'False', 'tcp_retransmission': '', 'tcp_window_size': '63', 'ttl_hop_limit': '64', 'fragmentation': 'No'}
{'timestamp': 1771771415.3511133, 'protocols': 'eth:ethertype:ip:tcp:tls', 'src_ip': '192.168.1.12', 'dst_ip': '34.54.84.110', 'src_port': '48770', 'dst_port': '443', 'packet_size': '1304', 'payload_len': '1238', 'info': '[TCP segment of a reassembled PDU]', 'tcp_seq': '1', 'tcp_flags_syn': 'False', 'tcp_flags_ack': 'True', 'tcp_flags_fin': 'False', 'tcp_flags_rst': 'False', 'tcp_flags_psh': 'False', 'tcp_flags_urg': 'False', 'tcp_retransmission': '', 'tcp_window_size': '63', 'ttl_hop_limit': '64', 'fragmentation': 'No'}
{'timestamp': 1771771415.3511167, 'protocols': 'eth:ethertype:ip:tcp:tls', 'src_ip': '192.168.1.12', 'dst_ip': '34.54.84.110', 'src_port': '48770', 'dst_port': '443', 'packet_size': '362', 'payload_len': '296', 'info': 'Client Hello (SNI=antigravity-unleash.goog)', 'tcp_seq': '1239', 'tcp_flags_syn': 'False', 'tcp_flags_ack': 'True', 'tcp_flags_fin': 'False', 'tcp_flags_rst': 'False', 'tcp_flags_psh': 'True', 'tcp_flags_urg': 'False', 'tcp_retransmission': '', 'tcp_window_size': '63', 'ttl_hop_limit': '64', 'fragmentation': 'No'}
{'timestamp': 1771771415.406908, 'protocols': 'eth:ethertype:ip:tcp', 'src_ip': '34.54.84.110', 'dst_ip': '192.168.1.12', 'src_port': '443', 'dst_port': '48766', 'packet_size': '66', 'payload_len': '0', 'info': '443 → 48766 [ACK] Seq=1 Ack=1535 Win=267520 Len=0 TSval=2324301089 TSecr=3938487974', 'tcp_seq': '1', 'tcp_flags_syn': 'False', 'tcp_flags_ack': 'True', 'tcp_flags_fin': 'False', 'tcp_flags_rst': 'False', 'tcp_flags_psh': 'False', 'tcp_flags_urg': 'False', 'tcp_retransmission': '', 'tcp_window_size': '1045', 'ttl_hop_limit': '122', 'fragmentation': 'No'}
{'timestamp': 1771771415.4069085, 'protocols': 'eth:ethertype:ip:tcp', 'src_ip': '34.54.84.110', 'dst_ip': '192.168.1.12', 'src_port': '443', 'dst_port': '48770', 'packet_size': '66', 'payload_len': '0', 'info': '443 → 48770 [ACK] Seq=1 Ack=1239 Win=267776 Len=0 TSval=84728380 TSecr=3938487977', 'tcp_seq': '1', 'tcp_flags_syn': 'False', 'tcp_flags_ack': 'True', 'tcp_flags_fin': 'False', 'tcp_flags_rst': 'False', 'tcp_flags_psh': 'False', 'tcp_flags_urg': 'False', 'tcp_retransmission': '', 'tcp_window_size': '1046', 'ttl_hop_limit': '122', 'fragmentation': 'No'}
{'timestamp': 1771771415.4069085, 'protocols': 'eth:ethertype:ip:tcp:tls', 'src_ip': '34.54.84.110', 'dst_ip': '192.168.1.12', 'src_port': '443', 'dst_port': '48766', 'packet_size': '2542', 'payload_len': '2476', 'info': 'Server Hello, Change Cipher Spec', 'tcp_seq': '1', 'tcp_flags_syn': 'False', 'tcp_flags_ack': 'True', 'tcp_flags_fin': 'False', 'tcp_flags_rst': 'False', 'tcp_flags_psh': 'True', 'tcp_flags_urg': 'False', 'tcp_retransmission': '', 'tcp_window_size': '1045', 'ttl_hop_limit': '122', 'fragmentation': 'No'}
{'timestamp': 1771771415.4069088, 'protocols': 'eth:ethertype:ip:tcp', 'src_ip': '34.54.84.110', 'dst_ip': '192.168.1.12', 'src_port': '443', 'dst_port': '48770', 'packet_size': '66', 'payload_len': '0', 'info': '443 → 48770 [ACK] Seq=1 Ack=1535 Win=267520 Len=0 TSval=84728380 TSecr=3938487977', 'tcp_seq': '1', 'tcp_flags_syn': 'False', 'tcp_flags_ack': 'True', 'tcp_flags_fin': 'False', 'tcp_flags_rst': 'False', 'tcp_flags_psh': 'False', 'tcp_flags_urg': 'False', 'tcp_retransmission': '', 'tcp_window_size': '1045', 'ttl_hop_limit': '122', 'fragmentation': 'No'}
{'timestamp': 1771771415.4069088, 'protocols': 'eth:ethertype:ip:tcp', 'src_ip': '34.54.84.110', 'dst_ip': '192.168.1.12', 'src_port': '443', 'dst_port': '48766', 'packet_size': '1304', 'payload_len': '1238', 'info': '443 → 48766 [ACK] Seq=2477 Ack=1535 Win=267520 Len=1238 TSval=2324301091 TSecr=3938487974 [TCP segment of a reassembled PDU]', 'tcp_seq': '2477', 'tcp_flags_syn': 'False', 'tcp_flags_ack': 'True', 'tcp_flags_fin': 'False', 'tcp_flags_rst': 'False', 'tcp_flags_psh': 'False', 'tcp_flags_urg': 'False', 'tcp_retransmission': '', 'tcp_window_size': '1045', 'ttl_hop_limit': '122', 'fragmentation': 'No'}
{'timestamp': 1771771415.4069483, 'protocols': 'eth:ethertype:ip:tcp', 'src_ip': '192.168.1.12', 'dst_ip': '34.54.84.110', 'src_port': '48766', 'dst_port': '443', 'packet_size': '66', 'payload_len': '0', 'info': '48766 → 443 [ACK] Seq=1535 Ack=2477 Win=69632 Len=0 TSval=3938488033 TSecr=2324301091', 'tcp_seq': '1535', 'tcp_flags_syn': 'False', 'tcp_flags_ack': 'True', 'tcp_flags_fin': 'False', 'tcp_flags_rst': 'False', 'tcp_flags_psh': 'False', 'tcp_flags_urg': 'False', 'tcp_retransmission': '', 'tcp_window_size': '68', 'ttl_hop_limit': '64', 'fragmentation': 'No'}
{'timestamp': 1771771415.4069607, 'protocols': 'eth:ethertype:ip:tcp', 'src_ip': '192.168.1.12', 'dst_ip': '34.54.84.110', 'src_port': '48766', 'dst_port': '443', 'packet_size': '66', 'payload_len': '0', 'info': '48766 → 443 [ACK] Seq=1535 Ack=3715 Win=70656 Len=0 TSval=3938488033 TSecr=2324301091', 'tcp_seq': '1535', 'tcp_flags_syn': 'False', 'tcp_flags_ack': 'True', 'tcp_flags_fin': 'False', 'tcp_flags_rst': 'False', 'tcp_flags_psh': 'False', 'tcp_flags_urg': 'False', 'tcp_retransmission': '', 'tcp_window_size': '69', 'ttl_hop_limit': '64', 'fragmentation': 'No'}
{'timestamp': 1771771415.4085493, 'protocols': 'eth:ethertype:ip:tcp:tls', 'src_ip': '34.54.84.110', 'dst_ip': '192.168.1.12', 'src_port': '443', 'dst_port': '48766', 'packet_size': '868', 'payload_len': '802', 'info': 'Application Data', 'tcp_seq': '3715', 'tcp_flags_syn': 'False', 'tcp_flags_ack': 'True', 'tcp_flags_fin': 'False', 'tcp_flags_rst': 'False', 'tcp_flags_psh': 'True', 'tcp_flags_urg': 'False', 'tcp_retransmission': '', 'tcp_window_size': '1045', 'ttl_hop_limit': '122', 'fragmentation': 'No'}
{'timestamp': 1771771415.4085493, 'protocols': 'eth:ethertype:ip:tcp:tls', 'src_ip': '34.54.84.110', 'dst_ip': '192.168.1.12', 'src_port': '443', 'dst_port': '48770', 'packet_size': '1304', 'payload_len': '1238', 'info': 'Server Hello, Change Cipher Spec', 'tcp_seq': '1', 'tcp_flags_syn': 'False', 'tcp_flags_ack': 'True', 'tcp_flags_fin': 'False', 'tcp_flags_rst': 'False', 'tcp_flags_psh': 'False', 'tcp_flags_urg': 'False', 'tcp_retransmission': '', 'tcp_window_size': '1045', 'ttl_hop_limit': '122', 'fragmentation': 'No'}
{'timestamp': 1771771415.4085593, 'protocols': 'eth:ethertype:ip:tcp', 'src_ip': '192.168.1.12', 'dst_ip': '34.54.84.110', 'src_port': '48766', 'dst_port': '443', 'packet_size': '66', 'payload_len': '0', 'info': '48766 → 443 [ACK] Seq=1535 Ack=4517 Win=73728 Len=0 TSval=3938488034 TSecr=2324301091', 'tcp_seq': '1535', 'tcp_flags_syn': 'False', 'tcp_flags_ack': 'True', 'tcp_flags_fin': 'False', 'tcp_flags_rst': 'False', 'tcp_flags_psh': 'False', 'tcp_flags_urg': 'False', 'tcp_retransmission': '', 'tcp_window_size': '72', 'ttl_hop_limit': '64', 'fragmentation': 'No'}
{'timestamp': 1771771415.4085667, 'protocols': 'eth:ethertype:ip:tcp', 'src_ip': '192.168.1.12', 'dst_ip': '34.54.84.110', 'src_port': '48770', 'dst_port': '443', 'packet_size': '66', 'payload_len': '0', 'info': '48770 → 443 [ACK] Seq=1535 Ack=1239 Win=67584 Len=0 TSval=3938488034 TSecr=84728384', 'tcp_seq': '1535', 'tcp_flags_syn': 'False', 'tcp_flags_ack': 'True', 'tcp_flags_fin': 'False', 'tcp_flags_rst': 'False', 'tcp_flags_psh': 'False', 'tcp_flags_urg': 'False', 'tcp_retransmission': '', 'tcp_window_size': '66', 'ttl_hop_limit': '64', 'fragmentation': 'No'}
{'timestamp': 1771771415.4085808, 'protocols': 'eth:ethertype:ip:tcp', 'src_ip': '34.54.84.110', 'dst_ip': '192.168.1.12', 'src_port': '443', 'dst_port': '48770', 'packet_size': '1304', 'payload_len': '1238', 'info': '443 → 48770 [PSH, ACK] Seq=1239 Ack=1535 Win=267520 Len=1238 TSval=84728384 TSecr=3938487977 [TCP segment of a reassembled PDU]', 'tcp_seq': '1239', 'tcp_flags_syn': 'False', 'tcp_flags_ack': 'True', 'tcp_flags_fin': 'False', 'tcp_flags_rst': 'False', 'tcp_flags_psh': 'True', 'tcp_flags_urg': 'False', 'tcp_retransmission': '', 'tcp_window_size': '1045', 'ttl_hop_limit': '122', 'fragmentation': 'No'}
{'timestamp': 1771771415.4085808, 'protocols': 'eth:ethertype:ip:tcp:tls', 'src_ip': '34.54.84.110', 'dst_ip': '192.168.1.12', 'src_port': '443', 'dst_port': '48770', 'packet_size': '2106', 'payload_len': '2040', 'info': 'Application Data', 'tcp_seq': '2477', 'tcp_flags_syn': 'False', 'tcp_flags_ack': 'True', 'tcp_flags_fin': 'False', 'tcp_flags_rst': 'False', 'tcp_flags_psh': 'True', 'tcp_flags_urg': 'False', 'tcp_retransmission': '', 'tcp_window_size': '1045', 'ttl_hop_limit': '122', 'fragmentation': 'No'}
{'timestamp': 1771771415.408588, 'protocols': 'eth:ethertype:ip:tcp', 'src_ip': '192.168.1.12', 'dst_ip': '34.54.84.110', 'src_port': '48770', 'dst_port': '443', 'packet_size': '66', 'payload_len': '0', 'info': '48770 → 443 [ACK] Seq=1535 Ack=2477 Win=68608 Len=0 TSval=3938488034 TSecr=84728384', 'tcp_seq': '1535', 'tcp_flags_syn': 'False', 'tcp_flags_ack': 'True', 'tcp_flags_fin': 'False', 'tcp_flags_rst': 'False', 'tcp_flags_psh': 'False', 'tcp_flags_urg': 'False', 'tcp_retransmission': '', 'tcp_window_size': '67', 'ttl_hop_limit': '64', 'fragmentation': 'No'}
{'timestamp': 1771771415.4085963, 'protocols': 'eth:ethertype:ip:tcp', 'src_ip': '192.168.1.12', 'dst_ip': '34.54.84.110', 'src_port': '48770', 'dst_port': '443', 'packet_size': '66', 'payload_len': '0', 'info': '48770 → 443 [ACK] Seq=1535 Ack=4517 Win=67584 Len=0 TSval=3938488034 TSecr=84728384', 'tcp_seq': '1535', 'tcp_flags_syn': 'False', 'tcp_flags_ack': 'True', 'tcp_flags_fin': 'False', 'tcp_flags_rst': 'False', 'tcp_flags_psh': 'False', 'tcp_flags_urg': 'False', 'tcp_retransmission': '', 'tcp_window_size': '66', 'ttl_hop_limit': '64', 'fragmentation': 'No'}
{'timestamp': 1771771415.4091043, 'protocols': 'eth:ethertype:ip:tcp:tls', 'src_ip': '192.168.1.12', 'dst_ip': '34.54.84.110', 'src_port': '48770', 'dst_port': '443', 'packet_size': '130', 'payload_len': '64', 'info': 'Change Cipher Spec, Application Data', 'tcp_seq': '1535', 'tcp_flags_syn': 'False', 'tcp_flags_ack': 'True', 'tcp_flags_fin': 'False', 'tcp_flags_rst': 'False', 'tcp_flags_psh': 'True', 'tcp_flags_urg': 'False', 'tcp_retransmission': '', 'tcp_window_size': '67', 'ttl_hop_limit': '64', 'fragmentation': 'No'}
{'timestamp': 1771771415.4091518, 'protocols': 'eth:ethertype:ip:tcp:tls', 'src_ip': '192.168.1.12', 'dst_ip': '34.54.84.110', 'src_port': '48770', 'dst_port': '443', 'packet_size': '158', 'payload_len': '92', 'info': 'Application Data', 'tcp_seq': '1599', 'tcp_flags_syn': 'False', 'tcp_flags_ack': 'True', 'tcp_flags_fin': 'False', 'tcp_flags_rst': 'False', 'tcp_flags_psh': 'True', 'tcp_flags_urg': 'False', 'tcp_retransmission': '', 'tcp_window_size': '67', 'ttl_hop_limit': '64', 'fragmentation': 'No'}
{'timestamp': 1771771415.409228, 'protocols': 'eth:ethertype:ip:tcp:tls', 'src_ip': '192.168.1.12', 'dst_ip': '34.54.84.110', 'src_port': '48766', 'dst_port': '443', 'packet_size': '130', 'payload_len': '64', 'info': 'Change Cipher Spec, Application Data', 'tcp_seq': '1535', 'tcp_flags_syn': 'False', 'tcp_flags_ack': 'True', 'tcp_flags_fin': 'False', 'tcp_flags_rst': 'False', 'tcp_flags_psh': 'True', 'tcp_flags_urg': 'False', 'tcp_retransmission': '', 'tcp_window_size': '72', 'ttl_hop_limit': '64', 'fragmentation': 'No'}
{'timestamp': 1771771415.4092798, 'protocols': 'eth:ethertype:ip:tcp:tls', 'src_ip': '192.168.1.12', 'dst_ip': '34.54.84.110', 'src_port': '48766', 'dst_port': '443', 'packet_size': '90', 'payload_len': '24', 'info': 'Application Data', 'tcp_seq': '1599', 'tcp_flags_syn': 'False', 'tcp_flags_ack': 'True', 'tcp_flags_fin': 'True', 'tcp_flags_rst': 'False', 'tcp_flags_psh': 'True', 'tcp_flags_urg': 'False', 'tcp_retransmission': '', 'tcp_window_size': '72', 'ttl_hop_limit': '64', 'fragmentation': 'No'}
{'timestamp': 1771771415.4092858, 'protocols': 'eth:ethertype:ip:tcp:tls', 'src_ip': '192.168.1.12', 'dst_ip': '34.54.84.110', 'src_port': '48770', 'dst_port': '443', 'packet_size': '1304', 'payload_len': '1238', 'info': 'Application Data', 'tcp_seq': '1691', 'tcp_flags_syn': 'False', 'tcp_flags_ack': 'True', 'tcp_flags_fin': 'False', 'tcp_flags_rst': 'False', 'tcp_flags_psh': 'False', 'tcp_flags_urg': 'False', 'tcp_retransmission': '', 'tcp_window_size': '67', 'ttl_hop_limit': '64', 'fragmentation': 'No'}
{'timestamp': 1771771415.4092906, 'protocols': 'eth:ethertype:ip:tcp', 'src_ip': '192.168.1.12', 'dst_ip': '34.54.84.110', 'src_port': '48770', 'dst_port': '443', 'packet_size': '1304', 'payload_len': '1238', 'info': '48770 → 443 [ACK] Seq=2929 Ack=4517 Win=68608 Len=1238 TSval=3938488035 TSecr=84728384 [TCP segment of a reassembled PDU]', 'tcp_seq': '2929', 'tcp_flags_syn': 'False', 'tcp_flags_ack': 'True', 'tcp_flags_fin': 'False', 'tcp_flags_rst': 'False', 'tcp_flags_psh': 'False', 'tcp_flags_urg': 'False', 'tcp_retransmission': '', 'tcp_window_size': '67', 'ttl_hop_limit': '64', 'fragmentation': 'No'}
{'timestamp': 1771771415.4092925, 'protocols': 'eth:ethertype:ip:tcp', 'src_ip': '192.168.1.12', 'dst_ip': '34.54.84.110', 'src_port': '48770', 'dst_port': '443', 'packet_size': '1304', 'payload_len': '1238', 'info': '48770 → 443 [PSH, ACK] Seq=4167 Ack=4517 Win=68608 Len=1238 TSval=3938488035 TSecr=84728384 [TCP segment of a reassembled PDU]', 'tcp_seq': '4167', 'tcp_flags_syn': 'False', 'tcp_flags_ack': 'True', 'tcp_flags_fin': 'False', 'tcp_flags_rst': 'False', 'tcp_flags_psh': 'True', 'tcp_flags_urg': 'False', 'tcp_retransmission': '', 'tcp_window_size': '67', 'ttl_hop_limit': '64', 'fragmentation': 'No'}
{'timestamp': 1771771415.4118576, 'protocols': 'eth:ethertype:ip:tcp:tls:tls', 'src_ip': '192.168.1.12', 'dst_ip': '34.54.84.110', 'src_port': '48770', 'dst_port': '443', 'packet_size': '1304', 'payload_len': '1238', 'info': 'Application Data', 'tcp_seq': '5405', 'tcp_flags_syn': 'False', 'tcp_flags_ack': 'True', 'tcp_flags_fin': 'False', 'tcp_flags_rst': 'False', 'tcp_flags_psh': 'False', 'tcp_flags_urg': 'False', 'tcp_retransmission': '', 'tcp_window_size': '67', 'ttl_hop_limit': '64', 'fragmentation': 'No'}
{'timestamp': 1771771415.4118621, 'protocols': 'eth:ethertype:ip:tcp', 'src_ip': '192.168.1.12', 'dst_ip': '34.54.84.110', 'src_port': '48770', 'dst_port': '443', 'packet_size': '1304', 'payload_len': '1238', 'info': '48770 → 443 [ACK] Seq=6643 Ack=4517 Win=68608 Len=1238 TSval=3938488038 TSecr=84728384 [TCP segment of a reassembled PDU]', 'tcp_seq': '6643', 'tcp_flags_syn': 'False', 'tcp_flags_ack': 'True', 'tcp_flags_fin': 'False', 'tcp_flags_rst': 'False', 'tcp_flags_psh': 'False', 'tcp_flags_urg': 'False', 'tcp_retransmission': '', 'tcp_window_size': '67', 'ttl_hop_limit': '64', 'fragmentation': 'No'}
{'timestamp': 1771771415.4118638, 'protocols': 'eth:ethertype:ip:tcp', 'src_ip': '192.168.1.12', 'dst_ip': '34.54.84.110', 'src_port': '48770', 'dst_port': '443', 'packet_size': '1304', 'payload_len': '1238', 'info': '48770 → 443 [PSH, ACK] Seq=7881 Ack=4517 Win=68608 Len=1238 TSval=3938488038 TSecr=84728384 [TCP segment of a reassembled PDU]', 'tcp_seq': '7881', 'tcp_flags_syn': 'False', 'tcp_flags_ack': 'True', 'tcp_flags_fin': 'False', 'tcp_flags_rst': 'False', 'tcp_flags_psh': 'True', 'tcp_flags_urg': 'False', 'tcp_retransmission': '', 'tcp_window_size': '67', 'ttl_hop_limit': '64', 'fragmentation': 'No'}
{'timestamp': 1771771415.4239526, 'protocols': 'eth:ethertype:ip:tcp:tls:tls', 'src_ip': '192.168.1.12', 'dst_ip': '34.54.84.110', 'src_port': '48770', 'dst_port': '443', 'packet_size': '1153', 'payload_len': '1087', 'info': 'Application Data, Application Data', 'tcp_seq': '9119', 'tcp_flags_syn': 'False', 'tcp_flags_ack': 'True', 'tcp_flags_fin': 'False', 'tcp_flags_rst': 'False', 'tcp_flags_psh': 'True', 'tcp_flags_urg': 'False', 'tcp_retransmission': '', 'tcp_window_size': '67', 'ttl_hop_limit': '64', 'fragmentation': 'No'}
{'timestamp': 1771771415.4604244, 'protocols': 'eth:ethertype:ip:tcp', 'src_ip': '34.54.84.110', 'dst_ip': '192.168.1.12', 'src_port': '443', 'dst_port': '48770', 'packet_size': '66', 'payload_len': '0', 'info': '443 → 48770 [ACK] Seq=4517 Ack=2929 Win=266240 Len=0 TSval=84728440 TSecr=3938488035', 'tcp_seq': '4517', 'tcp_flags_syn': 'False', 'tcp_flags_ack': 'True', 'tcp_flags_fin': 'False', 'tcp_flags_rst': 'False', 'tcp_flags_psh': 'False', 'tcp_flags_urg': 'False', 'tcp_retransmission': '', 'tcp_window_size': '1040', 'ttl_hop_limit': '122', 'fragmentation': 'No'}
{'timestamp': 1771771415.460425, 'protocols': 'eth:ethertype:ip:tcp:tls', 'src_ip': '34.54.84.110', 'dst_ip': '192.168.1.12', 'src_port': '443', 'dst_port': '48770', 'packet_size': '128', 'payload_len': '62', 'info': 'Application Data', 'tcp_seq': '4517', 'tcp_flags_syn': 'False', 'tcp_flags_ack': 'True', 'tcp_flags_fin': 'False', 'tcp_flags_rst': 'False', 'tcp_flags_psh': 'True', 'tcp_flags_urg': 'False', 'tcp_retransmission': '', 'tcp_window_size': '1036', 'ttl_hop_limit': '122', 'fragmentation': 'No'}
{'timestamp': 1771771415.460425, 'protocols': 'eth:ethertype:ip:tcp:tls', 'src_ip': '34.54.84.110', 'dst_ip': '192.168.1.12', 'src_port': '443', 'dst_port': '48770', 'packet_size': '97', 'payload_len': '31', 'info': 'Application Data', 'tcp_seq': '4579', 'tcp_flags_syn': 'False', 'tcp_flags_ack': 'True', 'tcp_flags_fin': 'False', 'tcp_flags_rst': 'False', 'tcp_flags_psh': 'True', 'tcp_flags_urg': 'False', 'tcp_retransmission': '', 'tcp_window_size': '1039', 'ttl_hop_limit': '122', 'fragmentation': 'No'}
{'timestamp': 1771771415.460425, 'protocols': 'eth:ethertype:ip:tcp', 'src_ip': '34.54.84.110', 'dst_ip': '192.168.1.12', 'src_port': '443', 'dst_port': '48766', 'packet_size': '66', 'payload_len': '0', 'info': '[TCP Previous segment not captured] 443 → 48766 [FIN, ACK] Seq=4579 Ack=1624 Win=267520 Len=0 TSval=2324301149 TSecr=3938488035', 'tcp_seq': '4579', 'tcp_flags_syn': 'False', 'tcp_flags_ack': 'True', 'tcp_flags_fin': 'True', 'tcp_flags_rst': 'False', 'tcp_flags_psh': 'False', 'tcp_flags_urg': 'False', 'tcp_retransmission': '', 'tcp_window_size': '1045', 'ttl_hop_limit': '122', 'fragmentation': 'No'}
{'timestamp': 1771771415.4604251, 'protocols': 'eth:ethertype:ip:tcp', 'src_ip': '34.54.84.110', 'dst_ip': '192.168.1.12', 'src_port': '443', 'dst_port': '48766', 'packet_size': '128', 'payload_len': '62', 'info': '[TCP Out-Of-Order] 443 → 48766 [PSH, ACK] Seq=4517 Ack=1624 Win=267520 Len=62 TSval=2324301149 TSecr=3938488035', 'tcp_seq': '4517', 'tcp_flags_syn': 'False', 'tcp_flags_ack': 'True', 'tcp_flags_fin': 'False', 'tcp_flags_rst': 'False', 'tcp_flags_psh': 'True', 'tcp_flags_urg': 'False', 'tcp_retransmission': '', 'tcp_window_size': '1045', 'ttl_hop_limit': '122', 'fragmentation': 'No'}
{'timestamp': 1771771415.4605026, 'protocols': 'eth:ethertype:ip:tcp', 'src_ip': '192.168.1.12', 'dst_ip': '34.54.84.110', 'src_port': '48770', 'dst_port': '443', 'packet_size': '66', 'payload_len': '0', 'info': '48770 → 443 [ACK] Seq=10206 Ack=4610 Win=68608 Len=0 TSval=3938488086 TSecr=84728440', 'tcp_seq': '10206', 'tcp_flags_syn': 'False', 'tcp_flags_ack': 'True', 'tcp_flags_fin': 'False', 'tcp_flags_rst': 'False', 'tcp_flags_psh': 'False', 'tcp_flags_urg': 'False', 'tcp_retransmission': '', 'tcp_window_size': '67', 'ttl_hop_limit': '64', 'fragmentation': 'No'}
{'timestamp': 1771771415.4605134, 'protocols': 'eth:ethertype:ip:tcp', 'src_ip': '192.168.1.12', 'dst_ip': '34.54.84.110', 'src_port': '48766', 'dst_port': '443', 'packet_size': '54', 'payload_len': '0', 'info': '48766 → 443 [RST] Seq=1624 Win=0 Len=0', 'tcp_seq': '1624', 'tcp_flags_syn': 'False', 'tcp_flags_ack': 'False', 'tcp_flags_fin': 'False', 'tcp_flags_rst': 'True', 'tcp_flags_psh': 'False', 'tcp_flags_urg': 'False', 'tcp_retransmission': '', 'tcp_window_size': '0', 'ttl_hop_limit': '64', 'fragmentation': 'No'}
{'timestamp': 1771771415.4605217, 'protocols': 'eth:ethertype:ip:tcp', 'src_ip': '192.168.1.12', 'dst_ip': '34.54.84.110', 'src_port': '48766', 'dst_port': '443', 'packet_size': '54', 'payload_len': '0', 'info': '48766 → 443 [RST] Seq=1624 Win=0 Len=0', 'tcp_seq': '1624', 'tcp_flags_syn': 'False', 'tcp_flags_ack': 'False', 'tcp_flags_fin': 'False', 'tcp_flags_rst': 'True', 'tcp_flags_psh': 'False', 'tcp_flags_urg': 'False', 'tcp_retransmission': '', 'tcp_window_size': '0', 'ttl_hop_limit': '64', 'fragmentation': 'No'}
{'timestamp': 1771771415.4605758, 'protocols': 'eth:ethertype:ip:tcp:tls', 'src_ip': '192.168.1.12', 'dst_ip': '34.54.84.110', 'src_port': '48770', 'dst_port': '443', 'packet_size': '97', 'payload_len': '31', 'info': 'Application Data', 'tcp_seq': '10206', 'tcp_flags_syn': 'False', 'tcp_flags_ack': 'True', 'tcp_flags_fin': 'False', 'tcp_flags_rst': 'False', 'tcp_flags_psh': 'True', 'tcp_flags_urg': 'False', 'tcp_retransmission': '', 'tcp_window_size': '67', 'ttl_hop_limit': '64', 'fragmentation': 'No'}
{'timestamp': 1771771415.4724386, 'protocols': 'eth:ethertype:ip:tcp', 'src_ip': '34.54.84.110', 'dst_ip': '192.168.1.12', 'src_port': '443', 'dst_port': '48770', 'packet_size': '66', 'payload_len': '0', 'info': '443 → 48770 [ACK] Seq=4610 Ack=7881 Win=262400 Len=0 TSval=84728451 TSecr=3938488035', 'tcp_seq': '4610', 'tcp_flags_syn': 'False', 'tcp_flags_ack': 'True', 'tcp_flags_fin': 'False', 'tcp_flags_rst': 'False', 'tcp_flags_psh': 'False', 'tcp_flags_urg': 'False', 'tcp_retransmission': '', 'tcp_window_size': '1025', 'ttl_hop_limit': '122', 'fragmentation': 'No'}
{'timestamp': 1771771415.4724388, 'protocols': 'eth:ethertype:ip:tcp', 'src_ip': '34.54.84.110', 'dst_ip': '192.168.1.12', 'src_port': '443', 'dst_port': '48770', 'packet_size': '66', 'payload_len': '0', 'info': '443 → 48770 [ACK] Seq=4610 Ack=10206 Win=260352 Len=0 TSval=84728451 TSecr=3938488038', 'tcp_seq': '4610', 'tcp_flags_syn': 'False', 'tcp_flags_ack': 'True', 'tcp_flags_fin': 'False', 'tcp_flags_rst': 'False', 'tcp_flags_psh': 'False', 'tcp_flags_urg': 'False', 'tcp_retransmission': '', 'tcp_window_size': '1017', 'ttl_hop_limit': '122', 'fragmentation': 'No'}
{'timestamp': 1771771415.5165093, 'protocols': 'eth:ethertype:ip:tcp', 'src_ip': '34.54.84.110', 'dst_ip': '192.168.1.12', 'src_port': '443', 'dst_port': '48770', 'packet_size': '66', 'payload_len': '0', 'info': '443 → 48770 [ACK] Seq=4610 Ack=10237 Win=265984 Len=0 TSval=84728495 TSecr=3938488086', 'tcp_seq': '4610', 'tcp_flags_syn': 'False', 'tcp_flags_ack': 'True', 'tcp_flags_fin': 'False', 'tcp_flags_rst': 'False', 'tcp_flags_psh': 'False', 'tcp_flags_urg': 'False', 'tcp_retransmission': '', 'tcp_window_size': '1039', 'ttl_hop_limit': '122', 'fragmentation': 'No'}
{'timestamp': 1771771415.685717, 'protocols': 'eth:ethertype:ipv6:icmpv6', 'src_ip': '2401:4900:88cd:ee23:be51:5fff:fe24:dae3', 'dst_ip': '2401:4900:88cd:ee23:5ada:36cd:567b:b5fe', 'src_port': '0', 'dst_port': '0', 'packet_size': '86', 'payload_len': '0', 'info': 'Neighbor Solicitation for 2401:4900:88cd:ee23:5ada:36cd:567b:b5fe from bc:51:5f:24:da:e3', 'tcp_seq': '0', 'tcp_flags_syn': '', 'tcp_flags_ack': '', 'tcp_flags_fin': '', 'tcp_flags_rst': '', 'tcp_flags_psh': '', 'tcp_flags_urg': '', 'tcp_retransmission': '', 'tcp_window_size': '0', 'ttl_hop_limit': '255', 'fragmentation': 'No'}
{'timestamp': 1771771415.6857424, 'protocols': 'eth:ethertype:ipv6:icmpv6', 'src_ip': '2401:4900:88cd:ee23:5ada:36cd:567b:b5fe', 'dst_ip': '2401:4900:88cd:ee23:be51:5fff:fe24:dae3', 'src_port': '0', 'dst_port': '0', 'packet_size': '78', 'payload_len': '0', 'info': 'Neighbor Advertisement 2401:4900:88cd:ee23:5ada:36cd:567b:b5fe (sol)', 'tcp_seq': '0', 'tcp_flags_syn': '', 'tcp_flags_ack': '', 'tcp_flags_fin': '', 'tcp_flags_rst': '', 'tcp_flags_psh': '', 'tcp_flags_urg': '', 'tcp_retransmission': '', 'tcp_window_size': '0', 'ttl_hop_limit': '255', 'fragmentation': 'No'}
{'timestamp': 1771771415.721811, 'protocols': 'eth:ethertype:ipv6:tcp', 'src_ip': '2401:4900:88cd:ee23:5ada:36cd:567b:b5fe', 'dst_ip': '2404:6800:4007:838::2001', 'src_port': '35204', 'dst_port': '443', 'packet_size': '86', 'payload_len': '0', 'info': '35204 → 443 [ACK] Seq=1 Ack=1 Win=70 Len=0 TSval=1867546220 TSecr=2275631692', 'tcp_seq': '1', 'tcp_flags_syn': 'False', 'tcp_flags_ack': 'True', 'tcp_flags_fin': 'False', 'tcp_flags_rst': 'False', 'tcp_flags_psh': 'False', 'tcp_flags_urg': 'False', 'tcp_retransmission': '', 'tcp_window_size': '70', 'ttl_hop_limit': '64', 'fragmentation': 'No'}
{'timestamp': 1771771415.7682078, 'protocols': 'eth:ethertype:ip:tcp:tls', 'src_ip': '34.54.84.110', 'dst_ip': '192.168.1.12', 'src_port': '443', 'dst_port': '48770', 'packet_size': '245', 'payload_len': '179', 'info': 'Application Data', 'tcp_seq': '4610', 'tcp_flags_syn': 'False', 'tcp_flags_ack': 'True', 'tcp_flags_fin': 'False', 'tcp_flags_rst': 'False', 'tcp_flags_psh': 'True', 'tcp_flags_urg': 'False', 'tcp_retransmission': '', 'tcp_window_size': '1039', 'ttl_hop_limit': '122', 'fragmentation': 'No'}
{'timestamp': 1771771415.7683277, 'protocols': 'eth:ethertype:ip:tcp:tls', 'src_ip': '192.168.1.12', 'dst_ip': '34.54.84.110', 'src_port': '48770', 'dst_port': '443', 'packet_size': '105', 'payload_len': '39', 'info': 'Application Data', 'tcp_seq': '10237', 'tcp_flags_syn': 'False', 'tcp_flags_ack': 'True', 'tcp_flags_fin': 'False', 'tcp_flags_rst': 'False', 'tcp_flags_psh': 'True', 'tcp_flags_urg': 'False', 'tcp_retransmission': '', 'tcp_window_size': '68', 'ttl_hop_limit': '64', 'fragmentation': 'No'}
{'timestamp': 1771771415.7928278, 'protocols': 'eth:ethertype:ipv6:tcp', 'src_ip': '2404:6800:4007:838::2001', 'dst_ip': '2401:4900:88cd:ee23:5ada:36cd:567b:b5fe', 'src_port': '443', 'dst_port': '35204', 'packet_size': '86', 'payload_len': '0', 'info': '[TCP ACKed unseen segment] 443 → 35204 [ACK] Seq=1 Ack=2 Win=1049 Len=0 TSval=2275661773 TSecr=1867486075', 'tcp_seq': '1', 'tcp_flags_syn': 'False', 'tcp_flags_ack': 'True', 'tcp_flags_fin': 'False', 'tcp_flags_rst': 'False', 'tcp_flags_psh': 'False', 'tcp_flags_urg': 'False', 'tcp_retransmission': '', 'tcp_window_size': '1049', 'ttl_hop_limit': '121', 'fragmentation': 'No'}
{'timestamp': 1771771415.8123753, 'protocols': 'eth:ethertype:ip:tcp', 'src_ip': '34.54.84.110', 'dst_ip': '192.168.1.12', 'src_port': '443', 'dst_port': '48770', 'packet_size': '66', 'payload_len': '0', 'info': '443 → 48770 [ACK] Seq=4789 Ack=10276 Win=265984 Len=0 TSval=84728791 TSecr=3938488394', 'tcp_seq': '4789', 'tcp_flags_syn': 'False', 'tcp_flags_ack': 'True', 'tcp_flags_fin': 'False', 'tcp_flags_rst': 'False', 'tcp_flags_psh': 'False', 'tcp_flags_urg': 'False', 'tcp_retransmission': '', 'tcp_window_size': '1039', 'ttl_hop_limit': '122', 'fragmentation': 'No'}
{'timestamp': 1771771415.850757, 'protocols': 'eth:ethertype:ip:tcp:tls', 'src_ip': '192.168.1.12', 'dst_ip': '34.54.84.110', 'src_port': '48770', 'dst_port': '443', 'packet_size': '561', 'payload_len': '495', 'info': 'Application Data', 'tcp_seq': '10276', 'tcp_flags_syn': 'False', 'tcp_flags_ack': 'True', 'tcp_flags_fin': 'False', 'tcp_flags_rst': 'False', 'tcp_flags_psh': 'True', 'tcp_flags_urg': 'False', 'tcp_retransmission': '', 'tcp_window_size': '68', 'ttl_hop_limit': '64', 'fragmentation': 'No'}
{'timestamp': 1771771415.8508196, 'protocols': 'eth:ethertype:ip:tcp:tls', 'src_ip': '192.168.1.12', 'dst_ip': '34.54.84.110', 'src_port': '48770', 'dst_port': '443', 'packet_size': '742', 'payload_len': '676', 'info': 'Application Data', 'tcp_seq': '10771', 'tcp_flags_syn': 'False', 'tcp_flags_ack': 'True', 'tcp_flags_fin': 'False', 'tcp_flags_rst': 'False', 'tcp_flags_psh': 'True', 'tcp_flags_urg': 'False', 'tcp_retransmission': '', 'tcp_window_size': '68', 'ttl_hop_limit': '64', 'fragmentation': 'No'}
{'timestamp': 1771771415.852135, 'protocols': 'eth:ethertype:ip:tcp:tls', 'src_ip': '192.168.1.12', 'dst_ip': '34.54.84.110', 'src_port': '48770', 'dst_port': '443', 'packet_size': '97', 'payload_len': '31', 'info': 'Application Data', 'tcp_seq': '11447', 'tcp_flags_syn': 'False', 'tcp_flags_ack': 'True', 'tcp_flags_fin': 'False', 'tcp_flags_rst': 'False', 'tcp_flags_psh': 'True', 'tcp_flags_urg': 'False', 'tcp_retransmission': '', 'tcp_window_size': '68', 'ttl_hop_limit': '64', 'fragmentation': 'No'}
{'timestamp': 1771771415.9259527, 'protocols': 'eth:ethertype:ip:tcp', 'src_ip': '34.54.84.110', 'dst_ip': '192.168.1.12', 'src_port': '443', 'dst_port': '48770', 'packet_size': '66', 'payload_len': '0', 'info': '443 → 48770 [ACK] Seq=4789 Ack=10771 Win=265728 Len=0 TSval=84728900 TSecr=3938488476', 'tcp_seq': '4789', 'tcp_flags_syn': 'False', 'tcp_flags_ack': 'True', 'tcp_flags_fin': 'False', 'tcp_flags_rst': 'False', 'tcp_flags_psh': 'False', 'tcp_flags_urg': 'False', 'tcp_retransmission': '', 'tcp_window_size': '1038', 'ttl_hop_limit': '122', 'fragmentation': 'No'}
{'timestamp': 1771771415.925953, 'protocols': 'eth:ethertype:ip:tcp', 'src_ip': '34.54.84.110', 'dst_ip': '192.168.1.12', 'src_port': '443', 'dst_port': '48770', 'packet_size': '66', 'payload_len': '0', 'info': '443 → 48770 [ACK] Seq=4789 Ack=11447 Win=265216 Len=0 TSval=84728900 TSecr=3938488477', 'tcp_seq': '4789', 'tcp_flags_syn': 'False', 'tcp_flags_ack': 'True', 'tcp_flags_fin': 'False', 'tcp_flags_rst': 'False', 'tcp_flags_psh': 'False', 'tcp_flags_urg': 'False', 'tcp_retransmission': '', 'tcp_window_size': '1036', 'ttl_hop_limit': '122', 'fragmentation': 'No'}
{'timestamp': 1771771415.9259531, 'protocols': 'eth:ethertype:ip:tcp', 'src_ip': '34.54.84.110', 'dst_ip': '192.168.1.12', 'src_port': '443', 'dst_port': '48770', 'packet_size': '66', 'payload_len': '0', 'info': '443 → 48770 [ACK] Seq=4789 Ack=11478 Win=265216 Len=0 TSval=84728900 TSecr=3938488478', 'tcp_seq': '4789', 'tcp_flags_syn': 'False', 'tcp_flags_ack': 'True', 'tcp_flags_fin': 'False', 'tcp_flags_rst': 'False', 'tcp_flags_psh': 'False', 'tcp_flags_urg': 'False', 'tcp_retransmission': '', 'tcp_window_size': '1036', 'ttl_hop_limit': '122', 'fragmentation': 'No'}
{'timestamp': 1771771416.0238302, 'protocols': 'eth:llc:stp', 'src_ip': '', 'dst_ip': '', 'src_port': '0', 'dst_port': '0', 'packet_size': '52', 'payload_len': '0', 'info': 'Conf. Root = 28672/4095/bc:51:5f:24:da:e3  Cost = 0  Port = 0x8007', 'tcp_seq': '0', 'tcp_flags_syn': '', 'tcp_flags_ack': '', 'tcp_flags_fin': '', 'tcp_flags_rst': '', 'tcp_flags_psh': '', 'tcp_flags_urg': '', 'tcp_retransmission': '', 'tcp_window_size': '0', 'ttl_hop_limit': '', 'fragmentation': 'No'}
{'timestamp': 1771771416.1738243, 'protocols': 'eth:ethertype:ip:tcp:tls', 'src_ip': '34.54.84.110', 'dst_ip': '192.168.1.12', 'src_port': '443', 'dst_port': '48770', 'packet_size': '209', 'payload_len': '143', 'info': 'Application Data', 'tcp_seq': '4789', 'tcp_flags_syn': 'False', 'tcp_flags_ack': 'True', 'tcp_flags_fin': 'False', 'tcp_flags_rst': 'False', 'tcp_flags_psh': 'True', 'tcp_flags_urg': 'False', 'tcp_retransmission': '', 'tcp_window_size': '1039', 'ttl_hop_limit': '122', 'fragmentation': 'No'}
{'timestamp': 1771771416.1982327, 'protocols': 'eth:ethertype:ip:tcp:tls', 'src_ip': '34.54.84.110', 'dst_ip': '192.168.1.12', 'src_port': '443', 'dst_port': '48770', 'packet_size': '1304', 'payload_len': '1238', 'info': 'Application Data', 'tcp_seq': '4932', 'tcp_flags_syn': 'False', 'tcp_flags_ack': 'True', 'tcp_flags_fin': 'False', 'tcp_flags_rst': 'False', 'tcp_flags_psh': 'True', 'tcp_flags_urg': 'False', 'tcp_retransmission': '', 'tcp_window_size': '1039', 'ttl_hop_limit': '122', 'fragmentation': 'No'}
{'timestamp': 1771771416.198233, 'protocols': 'eth:ethertype:ip:tcp:tls', 'src_ip': '34.54.84.110', 'dst_ip': '192.168.1.12', 'src_port': '443', 'dst_port': '48770', 'packet_size': '1304', 'payload_len': '1238', 'info': 'Application Data', 'tcp_seq': '6170', 'tcp_flags_syn': 'False', 'tcp_flags_ack': 'True', 'tcp_flags_fin': 'False', 'tcp_flags_rst': 'False', 'tcp_flags_psh': 'True', 'tcp_flags_urg': 'False', 'tcp_retransmission': '', 'tcp_window_size': '1039', 'ttl_hop_limit': '122', 'fragmentation': 'No'}
{'timestamp': 1771771416.1982684, 'protocols': 'eth:ethertype:ip:tcp', 'src_ip': '192.168.1.12', 'dst_ip': '34.54.84.110', 'src_port': '48770', 'dst_port': '443', 'packet_size': '66', 'payload_len': '0', 'info': '48770 → 443 [ACK] Seq=11478 Ack=6170 Win=69632 Len=0 TSval=3938488824 TSecr=84729150', 'tcp_seq': '11478', 'tcp_flags_syn': 'False', 'tcp_flags_ack': 'True', 'tcp_flags_fin': 'False', 'tcp_flags_rst': 'False', 'tcp_flags_psh': 'False', 'tcp_flags_urg': 'False', 'tcp_retransmission': '', 'tcp_window_size': '68', 'ttl_hop_limit': '64', 'fragmentation': 'No'}
{'timestamp': 1771771416.2018464, 'protocols': 'eth:ethertype:ip:tcp:tls', 'src_ip': '34.54.84.110', 'dst_ip': '192.168.1.12', 'src_port': '443', 'dst_port': '48770', 'packet_size': '2542', 'payload_len': '2476', 'info': 'Application Data, Application Data', 'tcp_seq': '7408', 'tcp_flags_syn': 'False', 'tcp_flags_ack': 'True', 'tcp_flags_fin': 'False', 'tcp_flags_rst': 'False', 'tcp_flags_psh': 'True', 'tcp_flags_urg': 'False', 'tcp_retransmission': '', 'tcp_window_size': '1039', 'ttl_hop_limit': '122', 'fragmentation': 'No'}
