{"timestamp": 1771340951.390986, "protocols": "eth:ethertype:ip:tcp:data", "src_ip": "127.0.0.1", "dst_ip": "127.0.0.1", "src_port": "35184", "dst_port": "43265", "packet_size": "89", "payload_len": "23", "info": "35184 \u2192 43265 [PSH, ACK] Seq=1 Ack=1 Win=64 Len=23 TSval=3450473091 TSecr=3450471010", "tcp_seq": "1", "tcp_flags_syn": "False", "tcp_flags_ack": "True", "tcp_flags_fin": "False", "tcp_flags_rst": "False", "tcp_flags_psh": "True", "tcp_flags_urg": "False", "tcp_retransmission": "", "tcp_window_size": "64", "ttl_hop_limit": "64", "fragmentation": "No"}
{"timestamp": 1771340951.3909986, "protocols": "eth:ethertype:ip:tcp", "src_ip": "127.0.0.1", "dst_ip": "127.0.0.1", "src_port": "43265", "dst_port": "35184", "packet_size": "66", "payload_len": "0", "info": "43265 \u2192 35184 [ACK] Seq=1 Ack=24 Win=373 Len=0 TSval=3450473091 TSecr=3450473091", "tcp_seq": "1", "tcp_flags_syn": "False", "tcp_flags_ack": "True", "tcp_flags_fin": "False", "tcp_flags_rst": "False", "tcp_flags_psh": "False", "tcp_flags_urg": "False", "tcp_retransmission": "", "tcp_window_size": "373", "ttl_hop_limit": "64", "fragmentation": "No"}
{"timestamp": 1771340951.3910341, "protocols": "eth:ethertype:ip:tcp:data", "src_ip": "127.0.0.1", "dst_ip": "127.0.0.1", "src_port": "35184", "dst_port": "43265", "packet_size": "446", "payload_len": "380", "info": "35184 \u2192 43265 [PSH, ACK] Seq=24 Ack=1 Win=64 Len=380 TSval=3450473092 TSecr=3450473091", "tcp_seq": "24", "tcp_flags_syn": "False", "tcp_flags_ack": "True", "tcp_flags_fin": "False", "tcp_flags_rst": "False", "tcp_flags_psh": "True", "tcp_flags_urg": "False", "tcp_retransmission": "", "tcp_window_size": "64", "ttl_hop_limit": "64", "fragmentation": "No"}
{"timestamp": 1771340951.3910396, "protocols": "eth:ethertype:ip:tcp", "src_ip": "127.0.0.1", "dst_ip": "127.0.0.1", "src_port": "43265", "dst_port": "35184", "packet_size": "66", "payload_len": "0", "info": "43265 \u2192 35184 [ACK] Seq=1 Ack=404 Win=373 Len=0 TSval=3450473092 TSecr=3450473092", "tcp_seq": "1", "tcp_flags_syn": "False", "tcp_flags_ack": "True", "tcp_flags_fin": "False", "tcp_flags_rst": "False", "tcp_flags_psh": "False", "tcp_flags_urg": "False", "tcp_retransmission": "", "tcp_window_size": "373", "ttl_hop_limit": "64", "fragmentation": "No"}
{"timestamp": 1771340951.8081882, "protocols": "eth:ethertype:ip:tcp:data", "src_ip": "127.0.0.1", "dst_ip": "127.0.0.1", "src_port": "35184", "dst_port": "43265", "packet_size": "89", "payload_len": "23", "info": "35184 \u2192 43265 [PSH, ACK] Seq=404 Ack=1 Win=64 Len=23 TSval=3450473509 TSecr=3450473092", "tcp_seq": "404", "tcp_flags_syn": "False", "tcp_flags_ack": "True", "tcp_flags_fin": "False", "tcp_flags_rst": "False", "tcp_flags_psh": "True", "tcp_flags_urg": "False", "tcp_retransmission": "", "tcp_window_size": "64", "ttl_hop_limit": "64", "fragmentation": "No"}
{"timestamp": 1771340951.8082218, "protocols": "eth:ethertype:ip:tcp", "src_ip": "127.0.0.1", "dst_ip": "127.0.0.1", "src_port": "43265", "dst_port": "35184", "packet_size": "66", "payload_len": "0", "info": "43265 \u2192 35184 [ACK] Seq=1 Ack=427 Win=373 Len=0 TSval=3450473509 TSecr=3450473509", "tcp_seq": "1", "tcp_flags_syn": "False", "tcp_flags_ack": "True", "tcp_flags_fin": "False", "tcp_flags_rst": "False", "tcp_flags_psh": "False", "tcp_flags_urg": "False", "tcp_retransmission": "", "tcp_window_size": "373", "ttl_hop_limit": "64", "fragmentation": "No"}
{"timestamp": 1771340951.808318, "protocols": "eth:ethertype:ip:tcp:data", "src_ip": "127.0.0.1", "dst_ip": "127.0.0.1", "src_port": "35184", "dst_port": "43265", "packet_size": "295", "payload_len": "229", "info": "35184 \u2192 43265 [PSH, ACK] Seq=427 Ack=1 Win=64 Len=229 TSval=3450473509 TSecr=3450473509", "tcp_seq": "427", "tcp_flags_syn": "False", "tcp_flags_ack": "True", "tcp_flags_fin": "False", "tcp_flags_rst": "False", "tcp_flags_psh": "True", "tcp_flags_urg": "False", "tcp_retransmission": "", "tcp_window_size": "64", "ttl_hop_limit": "64", "fragmentation": "No"}
{"timestamp": 1771340951.8083296, "protocols": "eth:ethertype:ip:tcp", "src_ip": "127.0.0.1", "dst_ip": "127.0.0.1", "src_port": "43265", "dst_port": "35184", "packet_size": "66", "payload_len": "0", "info": "43265 \u2192 35184 [ACK] Seq=1 Ack=656 Win=373 Len=0 TSval=3450473509 TSecr=3450473509", "tcp_seq": "1", "tcp_flags_syn": "False", "tcp_flags_ack": "True", "tcp_flags_fin": "False", "tcp_flags_rst": "False", "tcp_flags_psh": "False", "tcp_flags_urg": "False", "tcp_retransmission": "", "tcp_window_size": "373", "ttl_hop_limit": "64", "fragmentation": "No"}
{"timestamp": 1771340951.9982135, "protocols": "eth:ethertype:ip:tcp:http", "src_ip": "127.0.0.1", "dst_ip": "127.0.0.1", "src_port": "55396", "dst_port": "38765", "packet_size": "452", "payload_len": "386", "info": "POST /exa.extension_server_pb.ExtensionServerService/GetChromeDevtoolsMcpUrl HTTP/1.1", "tcp_seq": "1", "tcp_flags_syn": "False", "tcp_flags_ack": "True", "tcp_flags_fin": "False", "tcp_flags_rst": "False", "tcp_flags_psh": "True", "tcp_flags_urg": "False", "tcp_retransmission": "", "tcp_window_size": "64", "ttl_hop_limit": "64", "fragmentation": "No"}
{"timestamp": 1771340951.9999683, "protocols": "eth:ethertype:ip:tcp:http", "src_ip": "127.0.0.1", "dst_ip": "127.0.0.1", "src_port": "38765", "dst_port": "55396", "packet_size": "221", "payload_len": "155", "info": "HTTP/1.1 200 OK", "tcp_seq": "1", "tcp_flags_syn": "False", "tcp_flags_ack": "True", "tcp_flags_fin": "False", "tcp_flags_rst": "False", "tcp_flags_psh": "True", "tcp_flags_urg": "False", "tcp_retransmission": "", "tcp_window_size": "128", "ttl_hop_limit": "64", "fragmentation": "No"}
{"timestamp": 1771340951.9999774, "protocols": "eth:ethertype:ip:tcp", "src_ip": "127.0.0.1", "dst_ip": "127.0.0.1", "src_port": "55396", "dst_port": "38765", "packet_size": "66", "payload_len": "0", "info": "55396 \u2192 38765 [ACK] Seq=387 Ack=156 Win=64 Len=0 TSval=3450473700 TSecr=3450473700", "tcp_seq": "387", "tcp_flags_syn": "False", "tcp_flags_ack": "True", "tcp_flags_fin": "False", "tcp_flags_rst": "False", "tcp_flags_psh": "False", "tcp_flags_urg": "False", "tcp_retransmission": "", "tcp_window_size": "64", "ttl_hop_limit": "64", "fragmentation": "No"}
{"timestamp": 1771340952.0179462, "protocols": "eth:ethertype:ip:tcp:tls", "src_ip": "127.0.0.1", "dst_ip": "127.0.0.1", "src_port": "33272", "dst_port": "39359", "packet_size": "561", "payload_len": "495", "info": "Application Data", "tcp_seq": "1", "tcp_flags_syn": "False", "tcp_flags_ack": "True", "tcp_flags_fin": "False", "tcp_flags_rst": "False", "tcp_flags_psh": "True", "tcp_flags_urg": "False", "tcp_retransmission": "", "tcp_window_size": "418", "ttl_hop_limit": "64", "fragmentation": "No"}
{"timestamp": 1771340952.0179663, "protocols": "eth:ethertype:ip:tcp", "src_ip": "127.0.0.1", "dst_ip": "127.0.0.1", "src_port": "39359", "dst_port": "33272", "packet_size": "66", "payload_len": "0", "info": "39359 \u2192 33272 [ACK] Seq=1 Ack=496 Win=5333 Len=0 TSval=3450473718 TSecr=3450473718", "tcp_seq": "1", "tcp_flags_syn": "False", "tcp_flags_ack": "True", "tcp_flags_fin": "False", "tcp_flags_rst": "False", "tcp_flags_psh": "False", "tcp_flags_urg": "False", "tcp_retransmission": "", "tcp_window_size": "5333", "ttl_hop_limit": "64", "fragmentation": "No"}
{"timestamp": 1771340952.0181055, "protocols": "eth:ethertype:ip:tcp:tls", "src_ip": "127.0.0.1", "dst_ip": "127.0.0.1", "src_port": "33272", "dst_port": "39359", "packet_size": "97", "payload_len": "31", "info": "Application Data", "tcp_seq": "496", "tcp_flags_syn": "False", "tcp_flags_ack": "True", "tcp_flags_fin": "False", "tcp_flags_rst": "False", "tcp_flags_psh": "True", "tcp_flags_urg": "False", "tcp_retransmission": "", "tcp_window_size": "418", "ttl_hop_limit": "64", "fragmentation": "No"}
{"timestamp": 1771340952.018112, "protocols": "eth:ethertype:ip:tcp", "src_ip": "127.0.0.1", "dst_ip": "127.0.0.1", "src_port": "39359", "dst_port": "33272", "packet_size": "66", "payload_len": "0", "info": "39359 \u2192 33272 [ACK] Seq=1 Ack=527 Win=5333 Len=0 TSval=3450473719 TSecr=3450473719", "tcp_seq": "1", "tcp_flags_syn": "False", "tcp_flags_ack": "True", "tcp_flags_fin": "False", "tcp_flags_rst": "False", "tcp_flags_psh": "False", "tcp_flags_urg": "False", "tcp_retransmission": "", "tcp_window_size": "5333", "ttl_hop_limit": "64", "fragmentation": "No"}
{"timestamp": 1771340952.0182722, "protocols": "eth:ethertype:ip:tcp:tls", "src_ip": "127.0.0.1", "dst_ip": "127.0.0.1", "src_port": "39359", "dst_port": "33272", "packet_size": "127", "payload_len": "61", "info": "Application Data", "tcp_seq": "1", "tcp_flags_syn": "False", "tcp_flags_ack": "True", "tcp_flags_fin": "False", "tcp_flags_rst": "False", "tcp_flags_psh": "True", "tcp_flags_urg": "False", "tcp_retransmission": "", "tcp_window_size": "5333", "ttl_hop_limit": "64", "fragmentation": "No"}
{"timestamp": 1771340952.0182903, "protocols": "eth:ethertype:ip:tcp:tls", "src_ip": "127.0.0.1", "dst_ip": "127.0.0.1", "src_port": "39359", "dst_port": "33272", "packet_size": "135", "payload_len": "69", "info": "Application Data", "tcp_seq": "62", "tcp_flags_syn": "False", "tcp_flags_ack": "True", "tcp_flags_fin": "False", "tcp_flags_rst": "False", "tcp_flags_psh": "True", "tcp_flags_urg": "False", "tcp_retransmission": "", "tcp_window_size": "5333", "ttl_hop_limit": "64", "fragmentation": "No"}
{"timestamp": 1771340952.018307, "protocols": "eth:ethertype:ip:tcp", "src_ip": "127.0.0.1", "dst_ip": "127.0.0.1", "src_port": "33272", "dst_port": "39359", "packet_size": "66", "payload_len": "0", "info": "33272 \u2192 39359 [ACK] Seq=527 Ack=131 Win=418 Len=0 TSval=3450473719 TSecr=3450473719", "tcp_seq": "527", "tcp_flags_syn": "False", "tcp_flags_ack": "True", "tcp_flags_fin": "False", "tcp_flags_rst": "False", "tcp_flags_psh": "False", "tcp_flags_urg": "False", "tcp_retransmission": "", "tcp_window_size": "418", "ttl_hop_limit": "64", "fragmentation": "No"}
{"timestamp": 1771340952.0327613, "protocols": "eth:ethertype:ipv6:tcp", "src_ip": "::1", "dst_ip": "::1", "src_port": "34452", "dst_port": "5173", "packet_size": "94", "payload_len": "0", "info": "34452 \u2192 5173 [SYN] Seq=0 Win=65476 Len=0 MSS=65476 SACK_PERM TSval=1339235837 TSecr=0 WS=1024", "tcp_seq": "0", "tcp_flags_syn": "True", "tcp_flags_ack": "False", "tcp_flags_fin": "False", "tcp_flags_rst": "False", "tcp_flags_psh": "False", "tcp_flags_urg": "False", "tcp_retransmission": "", "tcp_window_size": "65476", "ttl_hop_limit": "64", "fragmentation": "No"}
{"timestamp": 1771340952.0327697, "protocols": "eth:ethertype:ipv6:tcp", "src_ip": "::1", "dst_ip": "::1", "src_port": "5173", "dst_port": "34452", "packet_size": "74", "payload_len": "0", "info": "5173 \u2192 34452 [RST, ACK] Seq=1 Ack=1 Win=0 Len=0", "tcp_seq": "1", "tcp_flags_syn": "False", "tcp_flags_ack": "True", "tcp_flags_fin": "False", "tcp_flags_rst": "True", "tcp_flags_psh": "False", "tcp_flags_urg": "False", "tcp_retransmission": "", "tcp_window_size": "0", "ttl_hop_limit": "64", "fragmentation": "No"}
{"timestamp": 1771340952.0328403, "protocols": "eth:ethertype:ip:tcp", "src_ip": "127.0.0.1", "dst_ip": "127.0.0.1", "src_port": "51138", "dst_port": "5173", "packet_size": "74", "payload_len": "0", "info": "51138 \u2192 5173 [SYN] Seq=0 Win=65495 Len=0 MSS=65495 SACK_PERM TSval=3450473733 TSecr=0 WS=1024", "tcp_seq": "0", "tcp_flags_syn": "True", "tcp_flags_ack": "False", "tcp_flags_fin": "False", "tcp_flags_rst": "False", "tcp_flags_psh": "False", "tcp_flags_urg": "False", "tcp_retransmission": "", "tcp_window_size": "65495", "ttl_hop_limit": "64", "fragmentation": "No"}
{"timestamp": 1771340952.032848, "protocols": "eth:ethertype:ip:tcp", "src_ip": "127.0.0.1", "dst_ip": "127.0.0.1", "src_port": "5173", "dst_port": "51138", "packet_size": "54", "payload_len": "0", "info": "5173 \u2192 51138 [RST, ACK] Seq=1 Ack=1 Win=0 Len=0", "tcp_seq": "1", "tcp_flags_syn": "False", "tcp_flags_ack": "True", "tcp_flags_fin": "False", "tcp_flags_rst": "True", "tcp_flags_psh": "False", "tcp_flags_urg": "False", "tcp_retransmission": "", "tcp_window_size": "0", "ttl_hop_limit": "64", "fragmentation": "No"}
{"timestamp": 1771340952.0583856, "protocols": "eth:ethertype:ip:tcp:data", "src_ip": "127.0.0.1", "dst_ip": "127.0.0.1", "src_port": "35184", "dst_port": "43265", "packet_size": "89", "payload_len": "23", "info": "35184 \u2192 43265 [PSH, ACK] Seq=656 Ack=1 Win=64 Len=23 TSval=3450473759 TSecr=3450473509", "tcp_seq": "656", "tcp_flags_syn": "False", "tcp_flags_ack": "True", "tcp_flags_fin": "False", "tcp_flags_rst": "False", "tcp_flags_psh": "True", "tcp_flags_urg": "False", "tcp_retransmission": "", "tcp_window_size": "64", "ttl_hop_limit": "64", "fragmentation": "No"}
{"timestamp": 1771340952.0583978, "protocols": "eth:ethertype:ip:tcp", "src_ip": "127.0.0.1", "dst_ip": "127.0.0.1", "src_port": "43265", "dst_port": "35184", "packet_size": "66", "payload_len": "0", "info": "43265 \u2192 35184 [ACK] Seq=1 Ack=679 Win=373 Len=0 TSval=3450473759 TSecr=3450473759", "tcp_seq": "1", "tcp_flags_syn": "False", "tcp_flags_ack": "True", "tcp_flags_fin": "False", "tcp_flags_rst": "False", "tcp_flags_psh": "False", "tcp_flags_urg": "False", "tcp_retransmission": "", "tcp_window_size": "373", "ttl_hop_limit": "64", "fragmentation": "No"}
{"timestamp": 1771340952.058429, "protocols": "eth:ethertype:ip:tcp:data", "src_ip": "127.0.0.1", "dst_ip": "127.0.0.1", "src_port": "35184", "dst_port": "43265", "packet_size": "228", "payload_len": "162", "info": "35184 \u2192 43265 [PSH, ACK] Seq=679 Ack=1 Win=64 Len=162 TSval=3450473759 TSecr=3450473759", "tcp_seq": "679", "tcp_flags_syn": "False", "tcp_flags_ack": "True", "tcp_flags_fin": "False", "tcp_flags_rst": "False", "tcp_flags_psh": "True", "tcp_flags_urg": "False", "tcp_retransmission": "", "tcp_window_size": "64", "ttl_hop_limit": "64", "fragmentation": "No"}
{"timestamp": 1771340952.0584357, "protocols": "eth:ethertype:ip:tcp", "src_ip": "127.0.0.1", "dst_ip": "127.0.0.1", "src_port": "43265", "dst_port": "35184", "packet_size": "66", "payload_len": "0", "info": "43265 \u2192 35184 [ACK] Seq=1 Ack=841 Win=373 Len=0 TSval=3450473759 TSecr=3450473759", "tcp_seq": "1", "tcp_flags_syn": "False", "tcp_flags_ack": "True", "tcp_flags_fin": "False", "tcp_flags_rst": "False", "tcp_flags_psh": "False", "tcp_flags_urg": "False", "tcp_retransmission": "", "tcp_window_size": "373", "ttl_hop_limit": "64", "fragmentation": "No"}
{"timestamp": 1771340952.5703928, "protocols": "eth:ethertype:ip:tcp:data", "src_ip": "127.0.0.1", "dst_ip": "127.0.0.1", "src_port": "35184", "dst_port": "43265", "packet_size": "89", "payload_len": "23", "info": "35184 \u2192 43265 [PSH, ACK] Seq=841 Ack=1 Win=64 Len=23 TSval=3450474271 TSecr=3450473759", "tcp_seq": "841", "tcp_flags_syn": "False", "tcp_flags_ack": "True", "tcp_flags_fin": "False", "tcp_flags_rst": "False", "tcp_flags_psh": "True", "tcp_flags_urg": "False", "tcp_retransmission": "", "tcp_window_size": "64", "ttl_hop_limit": "64", "fragmentation": "No"}
{"timestamp": 1771340952.5704064, "protocols": "eth:ethertype:ip:tcp", "src_ip": "127.0.0.1", "dst_ip": "127.0.0.1", "src_port": "43265", "dst_port": "35184", "packet_size": "66", "payload_len": "0", "info": "43265 \u2192 35184 [ACK] Seq=1 Ack=864 Win=373 Len=0 TSval=3450474271 TSecr=3450474271", "tcp_seq": "1", "tcp_flags_syn": "False", "tcp_flags_ack": "True", "tcp_flags_fin": "False", "tcp_flags_rst": "False", "tcp_flags_psh": "False", "tcp_flags_urg": "False", "tcp_retransmission": "", "tcp_window_size": "373", "ttl_hop_limit": "64", "fragmentation": "No"}
{"timestamp": 1771340952.570434, "protocols": "eth:ethertype:ip:tcp:data", "src_ip": "127.0.0.1", "dst_ip": "127.0.0.1", "src_port": "35184", "dst_port": "43265", "packet_size": "228", "payload_len": "162", "info": "35184 \u2192 43265 [PSH, ACK] Seq=864 Ack=1 Win=64 Len=162 TSval=3450474271 TSecr=3450474271", "tcp_seq": "864", "tcp_flags_syn": "False", "tcp_flags_ack": "True", "tcp_flags_fin": "False", "tcp_flags_rst": "False", "tcp_flags_psh": "True", "tcp_flags_urg": "False", "tcp_retransmission": "", "tcp_window_size": "64", "ttl_hop_limit": "64", "fragmentation": "No"}
{"timestamp": 1771340952.570439, "protocols": "eth:ethertype:ip:tcp", "src_ip": "127.0.0.1", "dst_ip": "127.0.0.1", "src_port": "43265", "dst_port": "35184", "packet_size": "66", "payload_len": "0", "info": "43265 \u2192 35184 [ACK] Seq=1 Ack=1026 Win=373 Len=0 TSval=3450474271 TSecr=3450474271", "tcp_seq": "1", "tcp_flags_syn": "False", "tcp_flags_ack": "True", "tcp_flags_fin": "False", "tcp_flags_rst": "False", "tcp_flags_psh": "False", "tcp_flags_urg": "False", "tcp_retransmission": "", "tcp_window_size": "373", "ttl_hop_limit": "64", "fragmentation": "No"}
{"timestamp": 1771340952.7970603, "protocols": "eth:ethertype:ip:tcp", "src_ip": "127.0.0.1", "dst_ip": "127.0.0.1", "src_port": "51858", "dst_port": "38765", "packet_size": "66", "payload_len": "0", "info": "51858 \u2192 38765 [ACK] Seq=1 Ack=1 Win=64 Len=0 TSval=3450474498 TSecr=3450444290", "tcp_seq": "1", "tcp_flags_syn": "False", "tcp_flags_ack": "True", "tcp_flags_fin": "False", "tcp_flags_rst": "False", "tcp_flags_psh": "False", "tcp_flags_urg": "False", "tcp_retransmission": "", "tcp_window_size": "64", "ttl_hop_limit": "64", "fragmentation": "No"}
{"timestamp": 1771340952.797069, "protocols": "eth:ethertype:ip:tcp", "src_ip": "127.0.0.1", "dst_ip": "127.0.0.1", "src_port": "38765", "dst_port": "51858", "packet_size": "66", "payload_len": "0", "info": "[TCP ACKed unseen segment] 38765 \u2192 51858 [ACK] Seq=1 Ack=2 Win=64 Len=0 TSval=3450474498 TSecr=3445520651", "tcp_seq": "1", "tcp_flags_syn": "False", "tcp_flags_ack": "True", "tcp_flags_fin": "False", "tcp_flags_rst": "False", "tcp_flags_psh": "False", "tcp_flags_urg": "False", "tcp_retransmission": "", "tcp_window_size": "64", "ttl_hop_limit": "64", "fragmentation": "No"}
{"timestamp": 1771340952.826539, "protocols": "eth:ethertype:ip:tcp:data", "src_ip": "127.0.0.1", "dst_ip": "127.0.0.1", "src_port": "35184", "dst_port": "43265", "packet_size": "89", "payload_len": "23", "info": "35184 \u2192 43265 [PSH, ACK] Seq=1026 Ack=1 Win=64 Len=23 TSval=3450474527 TSecr=3450474271", "tcp_seq": "1026", "tcp_flags_syn": "False", "tcp_flags_ack": "True", "tcp_flags_fin": "False", "tcp_flags_rst": "False", "tcp_flags_psh": "True", "tcp_flags_urg": "False", "tcp_retransmission": "", "tcp_window_size": "64", "ttl_hop_limit": "64", "fragmentation": "No"}
{"timestamp": 1771340952.8265584, "protocols": "eth:ethertype:ip:tcp", "src_ip": "127.0.0.1", "dst_ip": "127.0.0.1", "src_port": "43265", "dst_port": "35184", "packet_size": "66", "payload_len": "0", "info": "43265 \u2192 35184 [ACK] Seq=1 Ack=1049 Win=373 Len=0 TSval=3450474527 TSecr=3450474527", "tcp_seq": "1", "tcp_flags_syn": "False", "tcp_flags_ack": "True", "tcp_flags_fin": "False", "tcp_flags_rst": "False", "tcp_flags_psh": "False", "tcp_flags_urg": "False", "tcp_retransmission": "", "tcp_window_size": "373", "ttl_hop_limit": "64", "fragmentation": "No"}
{"timestamp": 1771340952.8265946, "protocols": "eth:ethertype:ip:tcp:data", "src_ip": "127.0.0.1", "dst_ip": "127.0.0.1", "src_port": "35184", "dst_port": "43265", "packet_size": "228", "payload_len": "162", "info": "35184 \u2192 43265 [PSH, ACK] Seq=1049 Ack=1 Win=64 Len=162 TSval=3450474527 TSecr=3450474527", "tcp_seq": "1049", "tcp_flags_syn": "False", "tcp_flags_ack": "True", "tcp_flags_fin": "False", "tcp_flags_rst": "False", "tcp_flags_psh": "True", "tcp_flags_urg": "False", "tcp_retransmission": "", "tcp_window_size": "64", "ttl_hop_limit": "64", "fragmentation": "No"}
{"timestamp": 1771340952.8266008, "protocols": "eth:ethertype:ip:tcp", "src_ip": "127.0.0.1", "dst_ip": "127.0.0.1", "src_port": "43265", "dst_port": "35184", "packet_size": "66", "payload_len": "0", "info": "43265 \u2192 35184 [ACK] Seq=1 Ack=1211 Win=373 Len=0 TSval=3450474527 TSecr=3450474527", "tcp_seq": "1", "tcp_flags_syn": "False", "tcp_flags_ack": "True", "tcp_flags_fin": "False", "tcp_flags_rst": "False", "tcp_flags_psh": "False", "tcp_flags_urg": "False", "tcp_retransmission": "", "tcp_window_size": "373", "ttl_hop_limit": "64", "fragmentation": "No"}
{"timestamp": 1771340953.0003684, "protocols": "eth:ethertype:ip:tcp:http", "src_ip": "127.0.0.1", "dst_ip": "127.0.0.1", "src_port": "55396", "dst_port": "38765", "packet_size": "452", "payload_len": "386", "info": "POST /exa.extension_server_pb.ExtensionServerService/GetChromeDevtoolsMcpUrl HTTP/1.1", "tcp_seq": "387", "tcp_flags_syn": "False", "tcp_flags_ack": "True", "tcp_flags_fin": "False", "tcp_flags_rst": "False", "tcp_flags_psh": "True", "tcp_flags_urg": "False", "tcp_retransmission": "", "tcp_window_size": "64", "ttl_hop_limit": "64", "fragmentation": "No"}
{"timestamp": 1771340953.002905, "protocols": "eth:ethertype:ip:tcp:http", "src_ip": "127.0.0.1", "dst_ip": "127.0.0.1", "src_port": "38765", "dst_port": "55396", "packet_size": "221", "payload_len": "155", "info": "HTTP/1.1 200 OK", "tcp_seq": "156", "tcp_flags_syn": "False", "tcp_flags_ack": "True", "tcp_flags_fin": "False", "tcp_flags_rst": "False", "tcp_flags_psh": "True", "tcp_flags_urg": "False", "tcp_retransmission": "", "tcp_window_size": "128", "ttl_hop_limit": "64", "fragmentation": "No"}
{"timestamp": 1771340953.0029187, "protocols": "eth:ethertype:ip:tcp", "src_ip": "127.0.0.1", "dst_ip": "127.0.0.1", "src_port": "55396", "dst_port": "38765", "packet_size": "66", "payload_len": "0", "info": "55396 \u2192 38765 [ACK] Seq=773 Ack=311 Win=64 Len=0 TSval=3450474703 TSecr=3450474703", "tcp_seq": "773", "tcp_flags_syn": "False", "tcp_flags_ack": "True", "tcp_flags_fin": "False", "tcp_flags_rst": "False", "tcp_flags_psh": "False", "tcp_flags_urg": "False", "tcp_retransmission": "", "tcp_window_size": "64", "ttl_hop_limit": "64", "fragmentation": "No"}
{"timestamp": 1771340953.0204582, "protocols": "eth:ethertype:ip:tcp:tls", "src_ip": "127.0.0.1", "dst_ip": "127.0.0.1", "src_port": "33272", "dst_port": "39359", "packet_size": "561", "payload_len": "495", "info": "Application Data", "tcp_seq": "527", "tcp_flags_syn": "False", "tcp_flags_ack": "True", "tcp_flags_fin": "False", "tcp_flags_rst": "False", "tcp_flags_psh": "True", "tcp_flags_urg": "False", "tcp_retransmission": "", "tcp_window_size": "418", "ttl_hop_limit": "64", "fragmentation": "No"}
{"timestamp": 1771340953.020622, "protocols": "eth:ethertype:ip:tcp:tls", "src_ip": "127.0.0.1", "dst_ip": "127.0.0.1", "src_port": "33272", "dst_port": "39359", "packet_size": "97", "payload_len": "31", "info": "Application Data", "tcp_seq": "1022", "tcp_flags_syn": "False", "tcp_flags_ack": "True", "tcp_flags_fin": "False", "tcp_flags_rst": "False", "tcp_flags_psh": "True", "tcp_flags_urg": "False", "tcp_retransmission": "", "tcp_window_size": "418", "ttl_hop_limit": "64", "fragmentation": "No"}
{"timestamp": 1771340953.0207155, "protocols": "eth:ethertype:ip:tcp", "src_ip": "127.0.0.1", "dst_ip": "127.0.0.1", "src_port": "39359", "dst_port": "33272", "packet_size": "66", "payload_len": "0", "info": "39359 \u2192 33272 [ACK] Seq=131 Ack=1053 Win=5333 Len=0 TSval=3450474721 TSecr=3450474721", "tcp_seq": "131", "tcp_flags_syn": "False", "tcp_flags_ack": "True", "tcp_flags_fin": "False", "tcp_flags_rst": "False", "tcp_flags_psh": "False", "tcp_flags_urg": "False", "tcp_retransmission": "", "tcp_window_size": "5333", "ttl_hop_limit": "64", "fragmentation": "No"}
{"timestamp": 1771340953.0209763, "protocols": "eth:ethertype:ip:tcp:tls", "src_ip": "127.0.0.1", "dst_ip": "127.0.0.1", "src_port": "39359", "dst_port": "33272", "packet_size": "127", "payload_len": "61", "info": "Application Data", "tcp_seq": "131", "tcp_flags_syn": "False", "tcp_flags_ack": "True", "tcp_flags_fin": "False", "tcp_flags_rst": "False", "tcp_flags_psh": "True", "tcp_flags_urg": "False", "tcp_retransmission": "", "tcp_window_size": "5333", "ttl_hop_limit": "64", "fragmentation": "No"}
{"timestamp": 1771340953.021009, "protocols": "eth:ethertype:ip:tcp:tls", "src_ip": "127.0.0.1", "dst_ip": "127.0.0.1", "src_port": "39359", "dst_port": "33272", "packet_size": "135", "payload_len": "69", "info": "Application Data", "tcp_seq": "192", "tcp_flags_syn": "False", "tcp_flags_ack": "True", "tcp_flags_fin": "False", "tcp_flags_rst": "False", "tcp_flags_psh": "True", "tcp_flags_urg": "False", "tcp_retransmission": "", "tcp_window_size": "5333", "ttl_hop_limit": "64", "fragmentation": "No"}
{"timestamp": 1771340953.021108, "protocols": "eth:ethertype:ip:tcp", "src_ip": "127.0.0.1", "dst_ip": "127.0.0.1", "src_port": "33272", "dst_port": "39359", "packet_size": "66", "payload_len": "0", "info": "33272 \u2192 39359 [ACK] Seq=1053 Ack=261 Win=418 Len=0 TSval=3450474722 TSecr=3450474721", "tcp_seq": "1053", "tcp_flags_syn": "False", "tcp_flags_ack": "True", "tcp_flags_fin": "False", "tcp_flags_rst": "False", "tcp_flags_psh": "False", "tcp_flags_urg": "False", "tcp_retransmission": "", "tcp_window_size": "418", "ttl_hop_limit": "64", "fragmentation": "No"}
{"timestamp": 1771340953.0351605, "protocols": "eth:ethertype:ipv6:tcp", "src_ip": "::1", "dst_ip": "::1", "src_port": "38248", "dst_port": "5173", "packet_size": "94", "payload_len": "0", "info": "38248 \u2192 5173 [SYN] Seq=0 Win=65476 Len=0 MSS=65476 SACK_PERM TSval=1339236840 TSecr=0 WS=1024", "tcp_seq": "0", "tcp_flags_syn": "True", "tcp_flags_ack": "False", "tcp_flags_fin": "False", "tcp_flags_rst": "False", "tcp_flags_psh": "False", "tcp_flags_urg": "False", "tcp_retransmission": "", "tcp_window_size": "65476", "ttl_hop_limit": "64", "fragmentation": "No"}
{"timestamp": 1771340953.035169, "protocols": "eth:ethertype:ipv6:tcp", "src_ip": "::1", "dst_ip": "::1", "src_port": "5173", "dst_port": "38248", "packet_size": "74", "payload_len": "0", "info": "5173 \u2192 38248 [RST, ACK] Seq=1 Ack=1 Win=0 Len=0", "tcp_seq": "1", "tcp_flags_syn": "False", "tcp_flags_ack": "True", "tcp_flags_fin": "False", "tcp_flags_rst": "True", "tcp_flags_psh": "False", "tcp_flags_urg": "False", "tcp_retransmission": "", "tcp_window_size": "0", "ttl_hop_limit": "64", "fragmentation": "No"}
{"timestamp": 1771340953.035239, "protocols": "eth:ethertype:ip:tcp", "src_ip": "127.0.0.1", "dst_ip": "127.0.0.1", "src_port": "38056", "dst_port": "5173", "packet_size": "74", "payload_len": "0", "info": "38056 \u2192 5173 [SYN] Seq=0 Win=65495 Len=0 MSS=65495 SACK_PERM TSval=3450474736 TSecr=0 WS=1024", "tcp_seq": "0", "tcp_flags_syn": "True", "tcp_flags_ack": "False", "tcp_flags_fin": "False", "tcp_flags_rst": "False", "tcp_flags_psh": "False", "tcp_flags_urg": "False", "tcp_retransmission": "", "tcp_window_size": "65495", "ttl_hop_limit": "64", "fragmentation": "No"}
{"timestamp": 1771340953.0352473, "protocols": "eth:ethertype:ip:tcp", "src_ip": "127.0.0.1", "dst_ip": "127.0.0.1", "src_port": "5173", "dst_port": "38056", "packet_size": "54", "payload_len": "0", "info": "5173 \u2192 38056 [RST, ACK] Seq=1 Ack=1 Win=0 Len=0", "tcp_seq": "1", "tcp_flags_syn": "False", "tcp_flags_ack": "True", "tcp_flags_fin": "False", "tcp_flags_rst": "True", "tcp_flags_psh": "False", "tcp_flags_urg": "False", "tcp_retransmission": "", "tcp_window_size": "0", "ttl_hop_limit": "64", "fragmentation": "No"}
{"timestamp": 1771340953.339425, "protocols": "eth:ethertype:ip:tcp:data", "src_ip": "127.0.0.1", "dst_ip": "127.0.0.1", "src_port": "35184", "dst_port": "43265", "packet_size": "89", "payload_len": "23", "info": "35184 \u2192 43265 [PSH, ACK] Seq=1211 Ack=1 Win=64 Len=23 TSval=3450475040 TSecr=3450474527", "tcp_seq": "1211", "tcp_flags_syn": "False", "tcp_flags_ack": "True", "tcp_flags_fin": "False", "tcp_flags_rst": "False", "tcp_flags_psh": "True", "tcp_flags_urg": "False", "tcp_retransmission": "", "tcp_window_size": "64", "ttl_hop_limit": "64", "fragmentation": "No"}
{"timestamp": 1771340953.3394477, "protocols": "eth:ethertype:ip:tcp", "src_ip": "127.0.0.1", "dst_ip": "127.0.0.1", "src_port": "43265", "dst_port": "35184", "packet_size": "66", "payload_len": "0", "info": "43265 \u2192 35184 [ACK] Seq=1 Ack=1234 Win=373 Len=0 TSval=3450475040 TSecr=3450475040", "tcp_seq": "1", "tcp_flags_syn": "False", "tcp_flags_ack": "True", "tcp_flags_fin": "False", "tcp_flags_rst": "False", "tcp_flags_psh": "False", "tcp_flags_urg": "False", "tcp_retransmission": "", "tcp_window_size": "373", "ttl_hop_limit": "64", "fragmentation": "No"}
{"timestamp": 1771340953.3394992, "protocols": "eth:ethertype:ip:tcp:data", "src_ip": "127.0.0.1", "dst_ip": "127.0.0.1", "src_port": "35184", "dst_port": "43265", "packet_size": "228", "payload_len": "162", "info": "35184 \u2192 43265 [PSH, ACK] Seq=1234 Ack=1 Win=64 Len=162 TSval=3450475040 TSecr=3450475040", "tcp_seq": "1234", "tcp_flags_syn": "False", "tcp_flags_ack": "True", "tcp_flags_fin": "False", "tcp_flags_rst": "False", "tcp_flags_psh": "True", "tcp_flags_urg": "False", "tcp_retransmission": "", "tcp_window_size": "64", "ttl_hop_limit": "64", "fragmentation": "No"}
{"timestamp": 1771340953.3395162, "protocols": "eth:ethertype:ip:tcp", "src_ip": "127.0.0.1", "dst_ip": "127.0.0.1", "src_port": "43265", "dst_port": "35184", "packet_size": "66", "payload_len": "0", "info": "43265 \u2192 35184 [ACK] Seq=1 Ack=1396 Win=373 Len=0 TSval=3450475040 TSecr=3450475040", "tcp_seq": "1", "tcp_flags_syn": "False", "tcp_flags_ack": "True", "tcp_flags_fin": "False", "tcp_flags_rst": "False", "tcp_flags_psh": "False", "tcp_flags_urg": "False", "tcp_retransmission": "", "tcp_window_size": "373", "ttl_hop_limit": "64", "fragmentation": "No"}
{"timestamp": 1771340953.592804, "protocols": "eth:ethertype:ip:tcp:data", "src_ip": "127.0.0.1", "dst_ip": "127.0.0.1", "src_port": "35184", "dst_port": "43265", "packet_size": "89", "payload_len": "23", "info": "35184 \u2192 43265 [PSH, ACK] Seq=1396 Ack=1 Win=64 Len=23 TSval=3450475293 TSecr=3450475040", "tcp_seq": "1396", "tcp_flags_syn": "False", "tcp_flags_ack": "True", "tcp_flags_fin": "False", "tcp_flags_rst": "False", "tcp_flags_psh": "True", "tcp_flags_urg": "False", "tcp_retransmission": "", "tcp_window_size": "64", "ttl_hop_limit": "64", "fragmentation": "No"}
{"timestamp": 1771340953.5928195, "protocols": "eth:ethertype:ip:tcp", "src_ip": "127.0.0.1", "dst_ip": "127.0.0.1", "src_port": "43265", "dst_port": "35184", "packet_size": "66", "payload_len": "0", "info": "43265 \u2192 35184 [ACK] Seq=1 Ack=1419 Win=373 Len=0 TSval=3450475293 TSecr=3450475293", "tcp_seq": "1", "tcp_flags_syn": "False", "tcp_flags_ack": "True", "tcp_flags_fin": "False", "tcp_flags_rst": "False", "tcp_flags_psh": "False", "tcp_flags_urg": "False", "tcp_retransmission": "", "tcp_window_size": "373", "ttl_hop_limit": "64", "fragmentation": "No"}
{"timestamp": 1771340953.5928519, "protocols": "eth:ethertype:ip:tcp:data", "src_ip": "127.0.0.1", "dst_ip": "127.0.0.1", "src_port": "35184", "dst_port": "43265", "packet_size": "228", "payload_len": "162", "info": "35184 \u2192 43265 [PSH, ACK] Seq=1419 Ack=1 Win=64 Len=162 TSval=3450475293 TSecr=3450475293", "tcp_seq": "1419", "tcp_flags_syn": "False", "tcp_flags_ack": "True", "tcp_flags_fin": "False", "tcp_flags_rst": "False", "tcp_flags_psh": "True", "tcp_flags_urg": "False", "tcp_retransmission": "", "tcp_window_size": "64", "ttl_hop_limit": "64", "fragmentation": "No"}
{"timestamp": 1771340953.592861, "protocols": "eth:ethertype:ip:tcp", "src_ip": "127.0.0.1", "dst_ip": "127.0.0.1", "src_port": "43265", "dst_port": "35184", "packet_size": "66", "payload_len": "0", "info": "43265 \u2192 35184 [ACK] Seq=1 Ack=1581 Win=373 Len=0 TSval=3450475293 TSecr=3450475293", "tcp_seq": "1", "tcp_flags_syn": "False", "tcp_flags_ack": "True", "tcp_flags_fin": "False", "tcp_flags_rst": "False", "tcp_flags_psh": "False", "tcp_flags_urg": "False", "tcp_retransmission": "", "tcp_window_size": "373", "ttl_hop_limit": "64", "fragmentation": "No"}
{"timestamp": 1771340953.750282, "protocols": "eth:ethertype:ip:tcp:tls", "src_ip": "127.0.0.1", "dst_ip": "127.0.0.1", "src_port": "33272", "dst_port": "39359", "packet_size": "65549", "payload_len": "65483", "info": "Application Data, Application Data, Application Data", "tcp_seq": "1053", "tcp_flags_syn": "False", "tcp_flags_ack": "True", "tcp_flags_fin": "False", "tcp_flags_rst": "False", "tcp_flags_psh": "False", "tcp_flags_urg": "False", "tcp_retransmission": "", "tcp_window_size": "418", "ttl_hop_limit": "64", "fragmentation": "No"}
{"timestamp": 1771340953.7503092, "protocols": "eth:ethertype:ip:tcp:tls:tls", "src_ip": "127.0.0.1", "dst_ip": "127.0.0.1", "src_port": "33272", "dst_port": "39359", "packet_size": "42899", "payload_len": "42833", "info": "Application Data, Application Data, Application Data, Application Data", "tcp_seq": "66536", "tcp_flags_syn": "False", "tcp_flags_ack": "True", "tcp_flags_fin": "False", "tcp_flags_rst": "False", "tcp_flags_psh": "True", "tcp_flags_urg": "False", "tcp_retransmission": "", "tcp_window_size": "418", "ttl_hop_limit": "64", "fragmentation": "No"}
{"timestamp": 1771340953.7503374, "protocols": "eth:ethertype:ip:tcp", "src_ip": "127.0.0.1", "dst_ip": "127.0.0.1", "src_port": "39359", "dst_port": "33272", "packet_size": "66", "payload_len": "0", "info": "39359 \u2192 33272 [ACK] Seq=261 Ack=109369 Win=5228 Len=0 TSval=3450475451 TSecr=3450475451", "tcp_seq": "261", "tcp_flags_syn": "False", "tcp_flags_ack": "True", "tcp_flags_fin": "False", "tcp_flags_rst": "False", "tcp_flags_psh": "False", "tcp_flags_urg": "False", "tcp_retransmission": "", "tcp_window_size": "5228", "ttl_hop_limit": "64", "fragmentation": "No"}
{"timestamp": 1771340953.7506325, "protocols": "eth:ethertype:ip:tcp:tls", "src_ip": "127.0.0.1", "dst_ip": "127.0.0.1", "src_port": "39359", "dst_port": "33272", "packet_size": "101", "payload_len": "35", "info": "Application Data", "tcp_seq": "261", "tcp_flags_syn": "False", "tcp_flags_ack": "True", "tcp_flags_fin": "False", "tcp_flags_rst": "False", "tcp_flags_psh": "True", "tcp_flags_urg": "False", "tcp_retransmission": "", "tcp_window_size": "5333", "ttl_hop_limit": "64", "fragmentation": "No"}
{"timestamp": 1771340953.7506516, "protocols": "eth:ethertype:ip:tcp:tls", "src_ip": "127.0.0.1", "dst_ip": "127.0.0.1", "src_port": "39359", "dst_port": "33272", "packet_size": "101", "payload_len": "35", "info": "Application Data", "tcp_seq": "296", "tcp_flags_syn": "False", "tcp_flags_ack": "True", "tcp_flags_fin": "False", "tcp_flags_rst": "False", "tcp_flags_psh": "True", "tcp_flags_urg": "False", "tcp_retransmission": "", "tcp_window_size": "5333", "ttl_hop_limit": "64", "fragmentation": "No"}
{"timestamp": 1771340953.7506707, "protocols": "eth:ethertype:ip:tcp:tls", "src_ip": "127.0.0.1", "dst_ip": "127.0.0.1", "src_port": "33272", "dst_port": "39359", "packet_size": "97", "payload_len": "31", "info": "Application Data", "tcp_seq": "109369", "tcp_flags_syn": "False", "tcp_flags_ack": "True", "tcp_flags_fin": "False", "tcp_flags_rst": "False", "tcp_flags_psh": "True", "tcp_flags_urg": "False", "tcp_retransmission": "", "tcp_window_size": "418", "ttl_hop_limit": "64", "fragmentation": "No"}
{"timestamp": 1771340953.750694, "protocols": "eth:ethertype:ip:tcp:tls", "src_ip": "127.0.0.1", "dst_ip": "127.0.0.1", "src_port": "39359", "dst_port": "33272", "packet_size": "101", "payload_len": "35", "info": "Application Data", "tcp_seq": "331", "tcp_flags_syn": "False", "tcp_flags_ack": "True", "tcp_flags_fin": "False", "tcp_flags_rst": "False", "tcp_flags_psh": "True", "tcp_flags_urg": "False", "tcp_retransmission": "", "tcp_window_size": "5333", "ttl_hop_limit": "64", "fragmentation": "No"}
{"timestamp": 1771340953.7507098, "protocols": "eth:ethertype:ip:tcp:tls", "src_ip": "127.0.0.1", "dst_ip": "127.0.0.1", "src_port": "39359", "dst_port": "33272", "packet_size": "101", "payload_len": "35", "info": "Application Data", "tcp_seq": "366", "tcp_flags_syn": "False", "tcp_flags_ack": "True", "tcp_flags_fin": "False", "tcp_flags_rst": "False", "tcp_flags_psh": "True", "tcp_flags_urg": "False", "tcp_retransmission": "", "tcp_window_size": "5333", "ttl_hop_limit": "64", "fragmentation": "No"}
{"timestamp": 1771340953.750775, "protocols": "eth:ethertype:ip:tcp", "src_ip": "127.0.0.1", "dst_ip": "127.0.0.1", "src_port": "33272", "dst_port": "39359", "packet_size": "66", "payload_len": "0", "info": "33272 \u2192 39359 [ACK] Seq=109400 Ack=401 Win=418 Len=0 TSval=3450475451 TSecr=3450475451", "tcp_seq": "109400", "tcp_flags_syn": "False", "tcp_flags_ack": "True", "tcp_flags_fin": "False", "tcp_flags_rst": "False", "tcp_flags_psh": "False", "tcp_flags_urg": "False", "tcp_retransmission": "", "tcp_window_size": "418", "ttl_hop_limit": "64", "fragmentation": "No"}
{"timestamp": 1771340953.7588274, "protocols": "eth:ethertype:ip:tcp:tls", "src_ip": "127.0.0.1", "dst_ip": "127.0.0.1", "src_port": "39359", "dst_port": "33272", "packet_size": "104", "payload_len": "38", "info": "Application Data", "tcp_seq": "401", "tcp_flags_syn": "False", "tcp_flags_ack": "True", "tcp_flags_fin": "False", "tcp_flags_rst": "False", "tcp_flags_psh": "True", "tcp_flags_urg": "False", "tcp_retransmission": "", "tcp_window_size": "5333", "ttl_hop_limit": "64", "fragmentation": "No"}
{"timestamp": 1771340953.7694743, "protocols": "eth:ethertype:ip:tcp:tls", "src_ip": "127.0.0.1", "dst_ip": "127.0.0.1", "src_port": "39359", "dst_port": "33272", "packet_size": "120", "payload_len": "54", "info": "Application Data", "tcp_seq": "439", "tcp_flags_syn": "False", "tcp_flags_ack": "True", "tcp_flags_fin": "False", "tcp_flags_rst": "False", "tcp_flags_psh": "True", "tcp_flags_urg": "False", "tcp_retransmission": "", "tcp_window_size": "5333", "ttl_hop_limit": "64", "fragmentation": "No"}
{"timestamp": 1771340953.769546, "protocols": "eth:ethertype:ip:tcp", "src_ip": "127.0.0.1", "dst_ip": "127.0.0.1", "src_port": "33272", "dst_port": "39359", "packet_size": "66", "payload_len": "0", "info": "33272 \u2192 39359 [ACK] Seq=109400 Ack=493 Win=418 Len=0 TSval=3450475470 TSecr=3450475459", "tcp_seq": "109400", "tcp_flags_syn": "False", "tcp_flags_ack": "True", "tcp_flags_fin": "False", "tcp_flags_rst": "False", "tcp_flags_psh": "False", "tcp_flags_urg": "False", "tcp_retransmission": "", "tcp_window_size": "418", "ttl_hop_limit": "64", "fragmentation": "No"}
{"timestamp": 1771340953.8446076, "protocols": "eth:ethertype:ip:tcp:tls", "src_ip": "127.0.0.1", "dst_ip": "127.0.0.1", "src_port": "33272", "dst_port": "39359", "packet_size": "47576", "payload_len": "47510", "info": "Application Data, Application Data, Application Data", "tcp_seq": "109400", "tcp_flags_syn": "False", "tcp_flags_ack": "True", "tcp_flags_fin": "False", "tcp_flags_rst": "False", "tcp_flags_psh": "True", "tcp_flags_urg": "False", "tcp_retransmission": "", "tcp_window_size": "418", "ttl_hop_limit": "64", "fragmentation": "No"}
{"timestamp": 1771340953.8448017, "protocols": "eth:ethertype:ip:tcp:tls", "src_ip": "127.0.0.1", "dst_ip": "127.0.0.1", "src_port": "33272", "dst_port": "39359", "packet_size": "106", "payload_len": "40", "info": "Application Data", "tcp_seq": "156910", "tcp_flags_syn": "False", "tcp_flags_ack": "True", "tcp_flags_fin": "False", "tcp_flags_rst": "False", "tcp_flags_psh": "True", "tcp_flags_urg": "False", "tcp_retransmission": "", "tcp_window_size": "418", "ttl_hop_limit": "64", "fragmentation": "No"}
{"timestamp": 1771340953.8448267, "protocols": "eth:ethertype:ip:tcp", "src_ip": "127.0.0.1", "dst_ip": "127.0.0.1", "src_port": "39359", "dst_port": "33272", "packet_size": "66", "payload_len": "0", "info": "39359 \u2192 33272 [ACK] Seq=493 Ack=156950 Win=5333 Len=0 TSval=3450475545 TSecr=3450475545", "tcp_seq": "493", "tcp_flags_syn": "False", "tcp_flags_ack": "True", "tcp_flags_fin": "False", "tcp_flags_rst": "False", "tcp_flags_psh": "False", "tcp_flags_urg": "False", "tcp_retransmission": "", "tcp_window_size": "5333", "ttl_hop_limit": "64", "fragmentation": "No"}
