{"timestamp": 1771341055.9855146, "protocols": "eth:ethertype:ipv6:tcp", "src_ip": "::1", "dst_ip": "::1", "src_port": "58178", "dst_port": "5173", "packet_size": "94", "payload_len": "0", "info": "58178 \u2192 5173 [SYN] Seq=0 Win=65476 Len=0 MSS=65476 SACK_PERM TSval=1339339790 TSecr=0 WS=1024", "tcp_seq": "0", "tcp_flags_syn": "True", "tcp_flags_ack": "False", "tcp_flags_fin": "False", "tcp_flags_rst": "False", "tcp_flags_psh": "False", "tcp_flags_urg": "False", "tcp_retransmission": "", "tcp_window_size": "65476", "ttl_hop_limit": "64", "fragmentation": "No"}
{"timestamp": 1771341055.9855218, "protocols": "eth:ethertype:ipv6:tcp", "src_ip": "::1", "dst_ip": "::1", "src_port": "5173", "dst_port": "58178", "packet_size": "74", "payload_len": "0", "info": "5173 \u2192 58178 [RST, ACK] Seq=1 Ack=1 Win=0 Len=0", "tcp_seq": "1", "tcp_flags_syn": "False", "tcp_flags_ack": "True", "tcp_flags_fin": "False", "tcp_flags_rst": "True", "tcp_flags_psh": "False", "tcp_flags_urg": "False", "tcp_retransmission": "", "tcp_window_size": "0", "ttl_hop_limit": "64", "fragmentation": "No"}
{"timestamp": 1771341055.985576, "protocols": "eth:ethertype:ip:tcp", "src_ip": "127.0.0.1", "dst_ip": "127.0.0.1", "src_port": "57650", "dst_port": "5173", "packet_size": "74", "payload_len": "0", "info": "57650 \u2192 5173 [SYN] Seq=0 Win=65495 Len=0 MSS=65495 SACK_PERM TSval=3450577686 TSecr=0 WS=1024", "tcp_seq": "0", "tcp_flags_syn": "True", "tcp_flags_ack": "False", "tcp_flags_fin": "False", "tcp_flags_rst": "False", "tcp_flags_psh": "False", "tcp_flags_urg": "False", "tcp_retransmission": "", "tcp_window_size": "65495", "ttl_hop_limit": "64", "fragmentation": "No"}
{"timestamp": 1771341055.985583, "protocols": "eth:ethertype:ip:tcp", "src_ip": "127.0.0.1", "dst_ip": "127.0.0.1", "src_port": "5173", "dst_port": "57650", "packet_size": "54", "payload_len": "0", "info": "5173 \u2192 57650 [RST, ACK] Seq=1 Ack=1 Win=0 Len=0", "tcp_seq": "1", "tcp_flags_syn": "False", "tcp_flags_ack": "True", "tcp_flags_fin": "False", "tcp_flags_rst": "True", "tcp_flags_psh": "False", "tcp_flags_urg": "False", "tcp_retransmission": "", "tcp_window_size": "0", "ttl_hop_limit": "64", "fragmentation": "No"}
{"timestamp": 1771341056.0073154, "protocols": "eth:ethertype:ip:tcp:data", "src_ip": "127.0.0.1", "dst_ip": "127.0.0.1", "src_port": "35184", "dst_port": "43265", "packet_size": "89", "payload_len": "23", "info": "35184 \u2192 43265 [PSH, ACK] Seq=1 Ack=1 Win=64 Len=23 TSval=3450577708 TSecr=3450575626", "tcp_seq": "1", "tcp_flags_syn": "False", "tcp_flags_ack": "True", "tcp_flags_fin": "False", "tcp_flags_rst": "False", "tcp_flags_psh": "True", "tcp_flags_urg": "False", "tcp_retransmission": "", "tcp_window_size": "64", "ttl_hop_limit": "64", "fragmentation": "No"}
{"timestamp": 1771341056.0073278, "protocols": "eth:ethertype:ip:tcp", "src_ip": "127.0.0.1", "dst_ip": "127.0.0.1", "src_port": "43265", "dst_port": "35184", "packet_size": "66", "payload_len": "0", "info": "43265 \u2192 35184 [ACK] Seq=1 Ack=24 Win=373 Len=0 TSval=3450577708 TSecr=3450577708", "tcp_seq": "1", "tcp_flags_syn": "False", "tcp_flags_ack": "True", "tcp_flags_fin": "False", "tcp_flags_rst": "False", "tcp_flags_psh": "False", "tcp_flags_urg": "False", "tcp_retransmission": "", "tcp_window_size": "373", "ttl_hop_limit": "64", "fragmentation": "No"}
{"timestamp": 1771341056.0073535, "protocols": "eth:ethertype:ip:tcp:data", "src_ip": "127.0.0.1", "dst_ip": "127.0.0.1", "src_port": "35184", "dst_port": "43265", "packet_size": "446", "payload_len": "380", "info": "35184 \u2192 43265 [PSH, ACK] Seq=24 Ack=1 Win=64 Len=380 TSval=3450577708 TSecr=3450577708", "tcp_seq": "24", "tcp_flags_syn": "False", "tcp_flags_ack": "True", "tcp_flags_fin": "False", "tcp_flags_rst": "False", "tcp_flags_psh": "True", "tcp_flags_urg": "False", "tcp_retransmission": "", "tcp_window_size": "64", "ttl_hop_limit": "64", "fragmentation": "No"}
{"timestamp": 1771341056.0073578, "protocols": "eth:ethertype:ip:tcp", "src_ip": "127.0.0.1", "dst_ip": "127.0.0.1", "src_port": "43265", "dst_port": "35184", "packet_size": "66", "payload_len": "0", "info": "43265 \u2192 35184 [ACK] Seq=1 Ack=404 Win=373 Len=0 TSval=3450577708 TSecr=3450577708", "tcp_seq": "1", "tcp_flags_syn": "False", "tcp_flags_ack": "True", "tcp_flags_fin": "False", "tcp_flags_rst": "False", "tcp_flags_psh": "False", "tcp_flags_urg": "False", "tcp_retransmission": "", "tcp_window_size": "373", "ttl_hop_limit": "64", "fragmentation": "No"}
{"timestamp": 1771341056.0386791, "protocols": "eth:ethertype:ip:tcp:tls", "src_ip": "127.0.0.1", "dst_ip": "127.0.0.1", "src_port": "33272", "dst_port": "39359", "packet_size": "561", "payload_len": "495", "info": "Application Data", "tcp_seq": "1", "tcp_flags_syn": "False", "tcp_flags_ack": "True", "tcp_flags_fin": "False", "tcp_flags_rst": "False", "tcp_flags_psh": "True", "tcp_flags_urg": "False", "tcp_retransmission": "", "tcp_window_size": "418", "ttl_hop_limit": "64", "fragmentation": "No"}
{"timestamp": 1771341056.0387955, "protocols": "eth:ethertype:ip:tcp:tls", "src_ip": "127.0.0.1", "dst_ip": "127.0.0.1", "src_port": "33272", "dst_port": "39359", "packet_size": "97", "payload_len": "31", "info": "Application Data", "tcp_seq": "496", "tcp_flags_syn": "False", "tcp_flags_ack": "True", "tcp_flags_fin": "False", "tcp_flags_rst": "False", "tcp_flags_psh": "True", "tcp_flags_urg": "False", "tcp_retransmission": "", "tcp_window_size": "418", "ttl_hop_limit": "64", "fragmentation": "No"}
{"timestamp": 1771341056.0388196, "protocols": "eth:ethertype:ip:tcp", "src_ip": "127.0.0.1", "dst_ip": "127.0.0.1", "src_port": "39359", "dst_port": "33272", "packet_size": "66", "payload_len": "0", "info": "39359 \u2192 33272 [ACK] Seq=1 Ack=527 Win=5333 Len=0 TSval=3450577739 TSecr=3450577739", "tcp_seq": "1", "tcp_flags_syn": "False", "tcp_flags_ack": "True", "tcp_flags_fin": "False", "tcp_flags_rst": "False", "tcp_flags_psh": "False", "tcp_flags_urg": "False", "tcp_retransmission": "", "tcp_window_size": "5333", "ttl_hop_limit": "64", "fragmentation": "No"}
{"timestamp": 1771341056.0390592, "protocols": "eth:ethertype:ip:tcp:tls", "src_ip": "127.0.0.1", "dst_ip": "127.0.0.1", "src_port": "39359", "dst_port": "33272", "packet_size": "127", "payload_len": "61", "info": "Application Data", "tcp_seq": "1", "tcp_flags_syn": "False", "tcp_flags_ack": "True", "tcp_flags_fin": "False", "tcp_flags_rst": "False", "tcp_flags_psh": "True", "tcp_flags_urg": "False", "tcp_retransmission": "", "tcp_window_size": "5333", "ttl_hop_limit": "64", "fragmentation": "No"}
{"timestamp": 1771341056.0390854, "protocols": "eth:ethertype:ip:tcp:tls", "src_ip": "127.0.0.1", "dst_ip": "127.0.0.1", "src_port": "39359", "dst_port": "33272", "packet_size": "135", "payload_len": "69", "info": "Application Data", "tcp_seq": "62", "tcp_flags_syn": "False", "tcp_flags_ack": "True", "tcp_flags_fin": "False", "tcp_flags_rst": "False", "tcp_flags_psh": "True", "tcp_flags_urg": "False", "tcp_retransmission": "", "tcp_window_size": "5333", "ttl_hop_limit": "64", "fragmentation": "No"}
{"timestamp": 1771341056.039234, "protocols": "eth:ethertype:ip:tcp", "src_ip": "127.0.0.1", "dst_ip": "127.0.0.1", "src_port": "33272", "dst_port": "39359", "packet_size": "66", "payload_len": "0", "info": "33272 \u2192 39359 [ACK] Seq=527 Ack=131 Win=418 Len=0 TSval=3450577740 TSecr=3450577740", "tcp_seq": "527", "tcp_flags_syn": "False", "tcp_flags_ack": "True", "tcp_flags_fin": "False", "tcp_flags_rst": "False", "tcp_flags_psh": "False", "tcp_flags_urg": "False", "tcp_retransmission": "", "tcp_window_size": "418", "ttl_hop_limit": "64", "fragmentation": "No"}
{"timestamp": 1771341056.2664704, "protocols": "eth:ethertype:ip:tcp:tls", "src_ip": "127.0.0.1", "dst_ip": "127.0.0.1", "src_port": "33272", "dst_port": "39359", "packet_size": "65549", "payload_len": "65483", "info": "Application Data, Application Data, Application Data", "tcp_seq": "527", "tcp_flags_syn": "False", "tcp_flags_ack": "True", "tcp_flags_fin": "False", "tcp_flags_rst": "False", "tcp_flags_psh": "False", "tcp_flags_urg": "False", "tcp_retransmission": "", "tcp_window_size": "418", "ttl_hop_limit": "64", "fragmentation": "No"}
{"timestamp": 1771341056.266514, "protocols": "eth:ethertype:ip:tcp:tls:tls", "src_ip": "127.0.0.1", "dst_ip": "127.0.0.1", "src_port": "33272", "dst_port": "39359", "packet_size": "15551", "payload_len": "15485", "info": "Application Data, Application Data", "tcp_seq": "66010", "tcp_flags_syn": "False", "tcp_flags_ack": "True", "tcp_flags_fin": "False", "tcp_flags_rst": "False", "tcp_flags_psh": "True", "tcp_flags_urg": "False", "tcp_retransmission": "", "tcp_window_size": "418", "ttl_hop_limit": "64", "fragmentation": "No"}
{"timestamp": 1771341056.266537, "protocols": "eth:ethertype:ip:tcp", "src_ip": "127.0.0.1", "dst_ip": "127.0.0.1", "src_port": "39359", "dst_port": "33272", "packet_size": "66", "payload_len": "0", "info": "39359 \u2192 33272 [ACK] Seq=131 Ack=81495 Win=5255 Len=0 TSval=3450577967 TSecr=3450577967", "tcp_seq": "131", "tcp_flags_syn": "False", "tcp_flags_ack": "True", "tcp_flags_fin": "False", "tcp_flags_rst": "False", "tcp_flags_psh": "False", "tcp_flags_urg": "False", "tcp_retransmission": "", "tcp_window_size": "5255", "ttl_hop_limit": "64", "fragmentation": "No"}
{"timestamp": 1771341056.266693, "protocols": "eth:ethertype:ip:tcp:tls", "src_ip": "127.0.0.1", "dst_ip": "127.0.0.1", "src_port": "33272", "dst_port": "39359", "packet_size": "97", "payload_len": "31", "info": "Application Data", "tcp_seq": "81495", "tcp_flags_syn": "False", "tcp_flags_ack": "True", "tcp_flags_fin": "False", "tcp_flags_rst": "False", "tcp_flags_psh": "True", "tcp_flags_urg": "False", "tcp_retransmission": "", "tcp_window_size": "418", "ttl_hop_limit": "64", "fragmentation": "No"}
{"timestamp": 1771341056.2667375, "protocols": "eth:ethertype:ip:tcp:tls", "src_ip": "127.0.0.1", "dst_ip": "127.0.0.1", "src_port": "39359", "dst_port": "33272", "packet_size": "101", "payload_len": "35", "info": "Application Data", "tcp_seq": "131", "tcp_flags_syn": "False", "tcp_flags_ack": "True", "tcp_flags_fin": "False", "tcp_flags_rst": "False", "tcp_flags_psh": "True", "tcp_flags_urg": "False", "tcp_retransmission": "", "tcp_window_size": "5318", "ttl_hop_limit": "64", "fragmentation": "No"}
{"timestamp": 1771341056.266795, "protocols": "eth:ethertype:ip:tcp:tls", "src_ip": "127.0.0.1", "dst_ip": "127.0.0.1", "src_port": "39359", "dst_port": "33272", "packet_size": "127", "payload_len": "61", "info": "Application Data", "tcp_seq": "166", "tcp_flags_syn": "False", "tcp_flags_ack": "True", "tcp_flags_fin": "False", "tcp_flags_rst": "False", "tcp_flags_psh": "True", "tcp_flags_urg": "False", "tcp_retransmission": "", "tcp_window_size": "5333", "ttl_hop_limit": "64", "fragmentation": "No"}
{"timestamp": 1771341056.2668748, "protocols": "eth:ethertype:ip:tcp:tls", "src_ip": "127.0.0.1", "dst_ip": "127.0.0.1", "src_port": "39359", "dst_port": "33272", "packet_size": "101", "payload_len": "35", "info": "Application Data", "tcp_seq": "227", "tcp_flags_syn": "False", "tcp_flags_ack": "True", "tcp_flags_fin": "False", "tcp_flags_rst": "False", "tcp_flags_psh": "True", "tcp_flags_urg": "False", "tcp_retransmission": "", "tcp_window_size": "5333", "ttl_hop_limit": "64", "fragmentation": "No"}
{"timestamp": 1771341056.2669158, "protocols": "eth:ethertype:ip:tcp", "src_ip": "127.0.0.1", "dst_ip": "127.0.0.1", "src_port": "33272", "dst_port": "39359", "packet_size": "66", "payload_len": "0", "info": "33272 \u2192 39359 [ACK] Seq=81526 Ack=262 Win=418 Len=0 TSval=3450577967 TSecr=3450577967", "tcp_seq": "81526", "tcp_flags_syn": "False", "tcp_flags_ack": "True", "tcp_flags_fin": "False", "tcp_flags_rst": "False", "tcp_flags_psh": "False", "tcp_flags_urg": "False", "tcp_retransmission": "", "tcp_window_size": "418", "ttl_hop_limit": "64", "fragmentation": "No"}
{"timestamp": 1771341056.2681704, "protocols": "eth:ethertype:ip:tcp:tls", "src_ip": "127.0.0.1", "dst_ip": "127.0.0.1", "src_port": "39359", "dst_port": "33272", "packet_size": "104", "payload_len": "38", "info": "Application Data", "tcp_seq": "262", "tcp_flags_syn": "False", "tcp_flags_ack": "True", "tcp_flags_fin": "False", "tcp_flags_rst": "False", "tcp_flags_psh": "True", "tcp_flags_urg": "False", "tcp_retransmission": "", "tcp_window_size": "5333", "ttl_hop_limit": "64", "fragmentation": "No"}
{"timestamp": 1771341056.2681935, "protocols": "eth:ethertype:ip:tcp:tls", "src_ip": "127.0.0.1", "dst_ip": "127.0.0.1", "src_port": "39359", "dst_port": "33272", "packet_size": "120", "payload_len": "54", "info": "Application Data", "tcp_seq": "300", "tcp_flags_syn": "False", "tcp_flags_ack": "True", "tcp_flags_fin": "False", "tcp_flags_rst": "False", "tcp_flags_psh": "True", "tcp_flags_urg": "False", "tcp_retransmission": "", "tcp_window_size": "5333", "ttl_hop_limit": "64", "fragmentation": "No"}
{"timestamp": 1771341056.2682388, "protocols": "eth:ethertype:ip:tcp", "src_ip": "127.0.0.1", "dst_ip": "127.0.0.1", "src_port": "33272", "dst_port": "39359", "packet_size": "66", "payload_len": "0", "info": "33272 \u2192 39359 [ACK] Seq=81526 Ack=354 Win=418 Len=0 TSval=3450577969 TSecr=3450577969", "tcp_seq": "81526", "tcp_flags_syn": "False", "tcp_flags_ack": "True", "tcp_flags_fin": "False", "tcp_flags_rst": "False", "tcp_flags_psh": "False", "tcp_flags_urg": "False", "tcp_retransmission": "", "tcp_window_size": "418", "ttl_hop_limit": "64", "fragmentation": "No"}
{"timestamp": 1771341056.4000077, "protocols": "eth:ethertype:ip:tcp:http", "src_ip": "127.0.0.1", "dst_ip": "127.0.0.1", "src_port": "55396", "dst_port": "38765", "packet_size": "452", "payload_len": "386", "info": "POST /exa.extension_server_pb.ExtensionServerService/GetChromeDevtoolsMcpUrl HTTP/1.1", "tcp_seq": "1", "tcp_flags_syn": "False", "tcp_flags_ack": "True", "tcp_flags_fin": "False", "tcp_flags_rst": "False", "tcp_flags_psh": "True", "tcp_flags_urg": "False", "tcp_retransmission": "", "tcp_window_size": "128", "ttl_hop_limit": "64", "fragmentation": "No"}
{"timestamp": 1771341056.4127948, "protocols": "eth:ethertype:ip:tcp:http", "src_ip": "127.0.0.1", "dst_ip": "127.0.0.1", "src_port": "38765", "dst_port": "55396", "packet_size": "221", "payload_len": "155", "info": "HTTP/1.1 200 OK", "tcp_seq": "1", "tcp_flags_syn": "False", "tcp_flags_ack": "True", "tcp_flags_fin": "False", "tcp_flags_rst": "False", "tcp_flags_psh": "True", "tcp_flags_urg": "False", "tcp_retransmission": "", "tcp_window_size": "128", "ttl_hop_limit": "64", "fragmentation": "No"}
{"timestamp": 1771341056.4128075, "protocols": "eth:ethertype:ip:tcp", "src_ip": "127.0.0.1", "dst_ip": "127.0.0.1", "src_port": "55396", "dst_port": "38765", "packet_size": "66", "payload_len": "0", "info": "55396 \u2192 38765 [ACK] Seq=387 Ack=156 Win=128 Len=0 TSval=3450578113 TSecr=3450578113", "tcp_seq": "387", "tcp_flags_syn": "False", "tcp_flags_ack": "True", "tcp_flags_fin": "False", "tcp_flags_rst": "False", "tcp_flags_psh": "False", "tcp_flags_urg": "False", "tcp_retransmission": "", "tcp_window_size": "128", "ttl_hop_limit": "64", "fragmentation": "No"}
{"timestamp": 1771341056.4456358, "protocols": "eth:ethertype:ip:tcp:data", "src_ip": "127.0.0.1", "dst_ip": "127.0.0.1", "src_port": "35184", "dst_port": "43265", "packet_size": "89", "payload_len": "23", "info": "35184 \u2192 43265 [PSH, ACK] Seq=404 Ack=1 Win=64 Len=23 TSval=3450578146 TSecr=3450577708", "tcp_seq": "404", "tcp_flags_syn": "False", "tcp_flags_ack": "True", "tcp_flags_fin": "False", "tcp_flags_rst": "False", "tcp_flags_psh": "True", "tcp_flags_urg": "False", "tcp_retransmission": "", "tcp_window_size": "64", "ttl_hop_limit": "64", "fragmentation": "No"}
{"timestamp": 1771341056.4456525, "protocols": "eth:ethertype:ip:tcp", "src_ip": "127.0.0.1", "dst_ip": "127.0.0.1", "src_port": "43265", "dst_port": "35184", "packet_size": "66", "payload_len": "0", "info": "43265 \u2192 35184 [ACK] Seq=1 Ack=427 Win=373 Len=0 TSval=3450578146 TSecr=3450578146", "tcp_seq": "1", "tcp_flags_syn": "False", "tcp_flags_ack": "True", "tcp_flags_fin": "False", "tcp_flags_rst": "False", "tcp_flags_psh": "False", "tcp_flags_urg": "False", "tcp_retransmission": "", "tcp_window_size": "373", "ttl_hop_limit": "64", "fragmentation": "No"}
{"timestamp": 1771341056.4457006, "protocols": "eth:ethertype:ip:tcp:data", "src_ip": "127.0.0.1", "dst_ip": "127.0.0.1", "src_port": "35184", "dst_port": "43265", "packet_size": "295", "payload_len": "229", "info": "35184 \u2192 43265 [PSH, ACK] Seq=427 Ack=1 Win=64 Len=229 TSval=3450578146 TSecr=3450578146", "tcp_seq": "427", "tcp_flags_syn": "False", "tcp_flags_ack": "True", "tcp_flags_fin": "False", "tcp_flags_rst": "False", "tcp_flags_psh": "True", "tcp_flags_urg": "False", "tcp_retransmission": "", "tcp_window_size": "64", "ttl_hop_limit": "64", "fragmentation": "No"}
{"timestamp": 1771341056.445711, "protocols": "eth:ethertype:ip:tcp", "src_ip": "127.0.0.1", "dst_ip": "127.0.0.1", "src_port": "43265", "dst_port": "35184", "packet_size": "66", "payload_len": "0", "info": "43265 \u2192 35184 [ACK] Seq=1 Ack=656 Win=373 Len=0 TSval=3450578146 TSecr=3450578146", "tcp_seq": "1", "tcp_flags_syn": "False", "tcp_flags_ack": "True", "tcp_flags_fin": "False", "tcp_flags_rst": "False", "tcp_flags_psh": "False", "tcp_flags_urg": "False", "tcp_retransmission": "", "tcp_window_size": "373", "ttl_hop_limit": "64", "fragmentation": "No"}
{"timestamp": 1771341056.6979623, "protocols": "eth:ethertype:ip:tcp:data", "src_ip": "127.0.0.1", "dst_ip": "127.0.0.1", "src_port": "35184", "dst_port": "43265", "packet_size": "89", "payload_len": "23", "info": "35184 \u2192 43265 [PSH, ACK] Seq=656 Ack=1 Win=64 Len=23 TSval=3450578398 TSecr=3450578146", "tcp_seq": "656", "tcp_flags_syn": "False", "tcp_flags_ack": "True", "tcp_flags_fin": "False", "tcp_flags_rst": "False", "tcp_flags_psh": "True", "tcp_flags_urg": "False", "tcp_retransmission": "", "tcp_window_size": "64", "ttl_hop_limit": "64", "fragmentation": "No"}
{"timestamp": 1771341056.6979814, "protocols": "eth:ethertype:ip:tcp", "src_ip": "127.0.0.1", "dst_ip": "127.0.0.1", "src_port": "43265", "dst_port": "35184", "packet_size": "66", "payload_len": "0", "info": "43265 \u2192 35184 [ACK] Seq=1 Ack=679 Win=373 Len=0 TSval=3450578398 TSecr=3450578398", "tcp_seq": "1", "tcp_flags_syn": "False", "tcp_flags_ack": "True", "tcp_flags_fin": "False", "tcp_flags_rst": "False", "tcp_flags_psh": "False", "tcp_flags_urg": "False", "tcp_retransmission": "", "tcp_window_size": "373", "ttl_hop_limit": "64", "fragmentation": "No"}
{"timestamp": 1771341056.6980336, "protocols": "eth:ethertype:ip:tcp:data", "src_ip": "127.0.0.1", "dst_ip": "127.0.0.1", "src_port": "35184", "dst_port": "43265", "packet_size": "228", "payload_len": "162", "info": "35184 \u2192 43265 [PSH, ACK] Seq=679 Ack=1 Win=64 Len=162 TSval=3450578398 TSecr=3450578398", "tcp_seq": "679", "tcp_flags_syn": "False", "tcp_flags_ack": "True", "tcp_flags_fin": "False", "tcp_flags_rst": "False", "tcp_flags_psh": "True", "tcp_flags_urg": "False", "tcp_retransmission": "", "tcp_window_size": "64", "ttl_hop_limit": "64", "fragmentation": "No"}
{"timestamp": 1771341056.6980438, "protocols": "eth:ethertype:ip:tcp", "src_ip": "127.0.0.1", "dst_ip": "127.0.0.1", "src_port": "43265", "dst_port": "35184", "packet_size": "66", "payload_len": "0", "info": "43265 \u2192 35184 [ACK] Seq=1 Ack=841 Win=373 Len=0 TSval=3450578399 TSecr=3450578398", "tcp_seq": "1", "tcp_flags_syn": "False", "tcp_flags_ack": "True", "tcp_flags_fin": "False", "tcp_flags_rst": "False", "tcp_flags_psh": "False", "tcp_flags_urg": "False", "tcp_retransmission": "", "tcp_window_size": "373", "ttl_hop_limit": "64", "fragmentation": "No"}
{"timestamp": 1771341056.9548295, "protocols": "eth:ethertype:ip:tcp:data", "src_ip": "127.0.0.1", "dst_ip": "127.0.0.1", "src_port": "35184", "dst_port": "43265", "packet_size": "89", "payload_len": "23", "info": "35184 \u2192 43265 [PSH, ACK] Seq=841 Ack=1 Win=64 Len=23 TSval=3450578655 TSecr=3450578399", "tcp_seq": "841", "tcp_flags_syn": "False", "tcp_flags_ack": "True", "tcp_flags_fin": "False", "tcp_flags_rst": "False", "tcp_flags_psh": "True", "tcp_flags_urg": "False", "tcp_retransmission": "", "tcp_window_size": "64", "ttl_hop_limit": "64", "fragmentation": "No"}
{"timestamp": 1771341056.9548426, "protocols": "eth:ethertype:ip:tcp", "src_ip": "127.0.0.1", "dst_ip": "127.0.0.1", "src_port": "43265", "dst_port": "35184", "packet_size": "66", "payload_len": "0", "info": "43265 \u2192 35184 [ACK] Seq=1 Ack=864 Win=373 Len=0 TSval=3450578655 TSecr=3450578655", "tcp_seq": "1", "tcp_flags_syn": "False", "tcp_flags_ack": "True", "tcp_flags_fin": "False", "tcp_flags_rst": "False", "tcp_flags_psh": "False", "tcp_flags_urg": "False", "tcp_retransmission": "", "tcp_window_size": "373", "ttl_hop_limit": "64", "fragmentation": "No"}
{"timestamp": 1771341056.9548693, "protocols": "eth:ethertype:ip:tcp:data", "src_ip": "127.0.0.1", "dst_ip": "127.0.0.1", "src_port": "35184", "dst_port": "43265", "packet_size": "228", "payload_len": "162", "info": "35184 \u2192 43265 [PSH, ACK] Seq=864 Ack=1 Win=64 Len=162 TSval=3450578655 TSecr=3450578655", "tcp_seq": "864", "tcp_flags_syn": "False", "tcp_flags_ack": "True", "tcp_flags_fin": "False", "tcp_flags_rst": "False", "tcp_flags_psh": "True", "tcp_flags_urg": "False", "tcp_retransmission": "", "tcp_window_size": "64", "ttl_hop_limit": "64", "fragmentation": "No"}
{"timestamp": 1771341056.954875, "protocols": "eth:ethertype:ip:tcp", "src_ip": "127.0.0.1", "dst_ip": "127.0.0.1", "src_port": "43265", "dst_port": "35184", "packet_size": "66", "payload_len": "0", "info": "43265 \u2192 35184 [ACK] Seq=1 Ack=1026 Win=373 Len=0 TSval=3450578655 TSecr=3450578655", "tcp_seq": "1", "tcp_flags_syn": "False", "tcp_flags_ack": "True", "tcp_flags_fin": "False", "tcp_flags_rst": "False", "tcp_flags_psh": "False", "tcp_flags_urg": "False", "tcp_retransmission": "", "tcp_window_size": "373", "ttl_hop_limit": "64", "fragmentation": "No"}
{"timestamp": 1771341056.9885826, "protocols": "eth:ethertype:ipv6:tcp", "src_ip": "::1", "dst_ip": "::1", "src_port": "58180", "dst_port": "5173", "packet_size": "94", "payload_len": "0", "info": "58180 \u2192 5173 [SYN] Seq=0 Win=65476 Len=0 MSS=65476 SACK_PERM TSval=1339340793 TSecr=0 WS=1024", "tcp_seq": "0", "tcp_flags_syn": "True", "tcp_flags_ack": "False", "tcp_flags_fin": "False", "tcp_flags_rst": "False", "tcp_flags_psh": "False", "tcp_flags_urg": "False", "tcp_retransmission": "", "tcp_window_size": "65476", "ttl_hop_limit": "64", "fragmentation": "No"}
{"timestamp": 1771341056.9885905, "protocols": "eth:ethertype:ipv6:tcp", "src_ip": "::1", "dst_ip": "::1", "src_port": "5173", "dst_port": "58180", "packet_size": "74", "payload_len": "0", "info": "5173 \u2192 58180 [RST, ACK] Seq=1 Ack=1 Win=0 Len=0", "tcp_seq": "1", "tcp_flags_syn": "False", "tcp_flags_ack": "True", "tcp_flags_fin": "False", "tcp_flags_rst": "True", "tcp_flags_psh": "False", "tcp_flags_urg": "False", "tcp_retransmission": "", "tcp_window_size": "0", "ttl_hop_limit": "64", "fragmentation": "No"}
{"timestamp": 1771341056.988669, "protocols": "eth:ethertype:ip:tcp", "src_ip": "127.0.0.1", "dst_ip": "127.0.0.1", "src_port": "57654", "dst_port": "5173", "packet_size": "74", "payload_len": "0", "info": "57654 \u2192 5173 [SYN] Seq=0 Win=65495 Len=0 MSS=65495 SACK_PERM TSval=3450578689 TSecr=0 WS=1024", "tcp_seq": "0", "tcp_flags_syn": "True", "tcp_flags_ack": "False", "tcp_flags_fin": "False", "tcp_flags_rst": "False", "tcp_flags_psh": "False", "tcp_flags_urg": "False", "tcp_retransmission": "", "tcp_window_size": "65495", "ttl_hop_limit": "64", "fragmentation": "No"}
{"timestamp": 1771341056.9886801, "protocols": "eth:ethertype:ip:tcp", "src_ip": "127.0.0.1", "dst_ip": "127.0.0.1", "src_port": "5173", "dst_port": "57654", "packet_size": "54", "payload_len": "0", "info": "5173 \u2192 57654 [RST, ACK] Seq=1 Ack=1 Win=0 Len=0", "tcp_seq": "1", "tcp_flags_syn": "False", "tcp_flags_ack": "True", "tcp_flags_fin": "False", "tcp_flags_rst": "True", "tcp_flags_psh": "False", "tcp_flags_urg": "False", "tcp_retransmission": "", "tcp_window_size": "0", "ttl_hop_limit": "64", "fragmentation": "No"}
{"timestamp": 1771341057.039258, "protocols": "eth:ethertype:ip:tcp:tls", "src_ip": "127.0.0.1", "dst_ip": "127.0.0.1", "src_port": "33272", "dst_port": "39359", "packet_size": "561", "payload_len": "495", "info": "Application Data", "tcp_seq": "81526", "tcp_flags_syn": "False", "tcp_flags_ack": "True", "tcp_flags_fin": "False", "tcp_flags_rst": "False", "tcp_flags_psh": "True", "tcp_flags_urg": "False", "tcp_retransmission": "", "tcp_window_size": "418", "ttl_hop_limit": "64", "fragmentation": "No"}
{"timestamp": 1771341057.039385, "protocols": "eth:ethertype:ip:tcp:tls", "src_ip": "127.0.0.1", "dst_ip": "127.0.0.1", "src_port": "33272", "dst_port": "39359", "packet_size": "97", "payload_len": "31", "info": "Application Data", "tcp_seq": "82021", "tcp_flags_syn": "False", "tcp_flags_ack": "True", "tcp_flags_fin": "False", "tcp_flags_rst": "False", "tcp_flags_psh": "True", "tcp_flags_urg": "False", "tcp_retransmission": "", "tcp_window_size": "418", "ttl_hop_limit": "64", "fragmentation": "No"}
{"timestamp": 1771341057.0394235, "protocols": "eth:ethertype:ip:tcp", "src_ip": "127.0.0.1", "dst_ip": "127.0.0.1", "src_port": "39359", "dst_port": "33272", "packet_size": "66", "payload_len": "0", "info": "39359 \u2192 33272 [ACK] Seq=354 Ack=82052 Win=5333 Len=0 TSval=3450578740 TSecr=3450578740", "tcp_seq": "354", "tcp_flags_syn": "False", "tcp_flags_ack": "True", "tcp_flags_fin": "False", "tcp_flags_rst": "False", "tcp_flags_psh": "False", "tcp_flags_urg": "False", "tcp_retransmission": "", "tcp_window_size": "5333", "ttl_hop_limit": "64", "fragmentation": "No"}
{"timestamp": 1771341057.0397358, "protocols": "eth:ethertype:ip:tcp:tls", "src_ip": "127.0.0.1", "dst_ip": "127.0.0.1", "src_port": "39359", "dst_port": "33272", "packet_size": "127", "payload_len": "61", "info": "Application Data", "tcp_seq": "354", "tcp_flags_syn": "False", "tcp_flags_ack": "True", "tcp_flags_fin": "False", "tcp_flags_rst": "False", "tcp_flags_psh": "True", "tcp_flags_urg": "False", "tcp_retransmission": "", "tcp_window_size": "5333", "ttl_hop_limit": "64", "fragmentation": "No"}
{"timestamp": 1771341057.0397701, "protocols": "eth:ethertype:ip:tcp:tls", "src_ip": "127.0.0.1", "dst_ip": "127.0.0.1", "src_port": "39359", "dst_port": "33272", "packet_size": "135", "payload_len": "69", "info": "Application Data", "tcp_seq": "415", "tcp_flags_syn": "False", "tcp_flags_ack": "True", "tcp_flags_fin": "False", "tcp_flags_rst": "False", "tcp_flags_psh": "True", "tcp_flags_urg": "False", "tcp_retransmission": "", "tcp_window_size": "5333", "ttl_hop_limit": "64", "fragmentation": "No"}
{"timestamp": 1771341057.0398788, "protocols": "eth:ethertype:ip:tcp", "src_ip": "127.0.0.1", "dst_ip": "127.0.0.1", "src_port": "33272", "dst_port": "39359", "packet_size": "66", "payload_len": "0", "info": "33272 \u2192 39359 [ACK] Seq=82052 Ack=484 Win=418 Len=0 TSval=3450578740 TSecr=3450578740", "tcp_seq": "82052", "tcp_flags_syn": "False", "tcp_flags_ack": "True", "tcp_flags_fin": "False", "tcp_flags_rst": "False", "tcp_flags_psh": "False", "tcp_flags_urg": "False", "tcp_retransmission": "", "tcp_window_size": "418", "ttl_hop_limit": "64", "fragmentation": "No"}
{"timestamp": 1771341057.210884, "protocols": "eth:ethertype:ip:tcp:data", "src_ip": "127.0.0.1", "dst_ip": "127.0.0.1", "src_port": "35184", "dst_port": "43265", "packet_size": "89", "payload_len": "23", "info": "35184 \u2192 43265 [PSH, ACK] Seq=1026 Ack=1 Win=64 Len=23 TSval=3450578911 TSecr=3450578655", "tcp_seq": "1026", "tcp_flags_syn": "False", "tcp_flags_ack": "True", "tcp_flags_fin": "False", "tcp_flags_rst": "False", "tcp_flags_psh": "True", "tcp_flags_urg": "False", "tcp_retransmission": "", "tcp_window_size": "64", "ttl_hop_limit": "64", "fragmentation": "No"}
{"timestamp": 1771341057.210907, "protocols": "eth:ethertype:ip:tcp", "src_ip": "127.0.0.1", "dst_ip": "127.0.0.1", "src_port": "43265", "dst_port": "35184", "packet_size": "66", "payload_len": "0", "info": "43265 \u2192 35184 [ACK] Seq=1 Ack=1049 Win=373 Len=0 TSval=3450578911 TSecr=3450578911", "tcp_seq": "1", "tcp_flags_syn": "False", "tcp_flags_ack": "True", "tcp_flags_fin": "False", "tcp_flags_rst": "False", "tcp_flags_psh": "False", "tcp_flags_urg": "False", "tcp_retransmission": "", "tcp_window_size": "373", "ttl_hop_limit": "64", "fragmentation": "No"}
{"timestamp": 1771341057.2109575, "protocols": "eth:ethertype:ip:tcp:data", "src_ip": "127.0.0.1", "dst_ip": "127.0.0.1", "src_port": "35184", "dst_port": "43265", "packet_size": "228", "payload_len": "162", "info": "35184 \u2192 43265 [PSH, ACK] Seq=1049 Ack=1 Win=64 Len=162 TSval=3450578911 TSecr=3450578911", "tcp_seq": "1049", "tcp_flags_syn": "False", "tcp_flags_ack": "True", "tcp_flags_fin": "False", "tcp_flags_rst": "False", "tcp_flags_psh": "True", "tcp_flags_urg": "False", "tcp_retransmission": "", "tcp_window_size": "64", "ttl_hop_limit": "64", "fragmentation": "No"}
{"timestamp": 1771341057.210968, "protocols": "eth:ethertype:ip:tcp", "src_ip": "127.0.0.1", "dst_ip": "127.0.0.1", "src_port": "43265", "dst_port": "35184", "packet_size": "66", "payload_len": "0", "info": "43265 \u2192 35184 [ACK] Seq=1 Ack=1211 Win=373 Len=0 TSval=3450578911 TSecr=3450578911", "tcp_seq": "1", "tcp_flags_syn": "False", "tcp_flags_ack": "True", "tcp_flags_fin": "False", "tcp_flags_rst": "False", "tcp_flags_psh": "False", "tcp_flags_urg": "False", "tcp_retransmission": "", "tcp_window_size": "373", "ttl_hop_limit": "64", "fragmentation": "No"}
{"timestamp": 1771341057.413965, "protocols": "eth:ethertype:ip:tcp:http", "src_ip": "127.0.0.1", "dst_ip": "127.0.0.1", "src_port": "55396", "dst_port": "38765", "packet_size": "452", "payload_len": "386", "info": "POST /exa.extension_server_pb.ExtensionServerService/GetChromeDevtoolsMcpUrl HTTP/1.1", "tcp_seq": "387", "tcp_flags_syn": "False", "tcp_flags_ack": "True", "tcp_flags_fin": "False", "tcp_flags_rst": "False", "tcp_flags_psh": "True", "tcp_flags_urg": "False", "tcp_retransmission": "", "tcp_window_size": "128", "ttl_hop_limit": "64", "fragmentation": "No"}
{"timestamp": 1771341057.4188044, "protocols": "eth:ethertype:ip:tcp:http", "src_ip": "127.0.0.1", "dst_ip": "127.0.0.1", "src_port": "38765", "dst_port": "55396", "packet_size": "221", "payload_len": "155", "info": "HTTP/1.1 200 OK", "tcp_seq": "156", "tcp_flags_syn": "False", "tcp_flags_ack": "True", "tcp_flags_fin": "False", "tcp_flags_rst": "False", "tcp_flags_psh": "True", "tcp_flags_urg": "False", "tcp_retransmission": "", "tcp_window_size": "128", "ttl_hop_limit": "64", "fragmentation": "No"}
{"timestamp": 1771341057.4188187, "protocols": "eth:ethertype:ip:tcp", "src_ip": "127.0.0.1", "dst_ip": "127.0.0.1", "src_port": "55396", "dst_port": "38765", "packet_size": "66", "payload_len": "0", "info": "55396 \u2192 38765 [ACK] Seq=773 Ack=311 Win=128 Len=0 TSval=3450579119 TSecr=3450579119", "tcp_seq": "773", "tcp_flags_syn": "False", "tcp_flags_ack": "True", "tcp_flags_fin": "False", "tcp_flags_rst": "False", "tcp_flags_psh": "False", "tcp_flags_urg": "False", "tcp_retransmission": "", "tcp_window_size": "128", "ttl_hop_limit": "64", "fragmentation": "No"}
{"timestamp": 1771341057.466246, "protocols": "eth:ethertype:ip:tcp:data", "src_ip": "127.0.0.1", "dst_ip": "127.0.0.1", "src_port": "35184", "dst_port": "43265", "packet_size": "89", "payload_len": "23", "info": "35184 \u2192 43265 [PSH, ACK] Seq=1211 Ack=1 Win=64 Len=23 TSval=3450579167 TSecr=3450578911", "tcp_seq": "1211", "tcp_flags_syn": "False", "tcp_flags_ack": "True", "tcp_flags_fin": "False", "tcp_flags_rst": "False", "tcp_flags_psh": "True", "tcp_flags_urg": "False", "tcp_retransmission": "", "tcp_window_size": "64", "ttl_hop_limit": "64", "fragmentation": "No"}
{"timestamp": 1771341057.4662602, "protocols": "eth:ethertype:ip:tcp", "src_ip": "127.0.0.1", "dst_ip": "127.0.0.1", "src_port": "43265", "dst_port": "35184", "packet_size": "66", "payload_len": "0", "info": "43265 \u2192 35184 [ACK] Seq=1 Ack=1234 Win=373 Len=0 TSval=3450579167 TSecr=3450579167", "tcp_seq": "1", "tcp_flags_syn": "False", "tcp_flags_ack": "True", "tcp_flags_fin": "False", "tcp_flags_rst": "False", "tcp_flags_psh": "False", "tcp_flags_urg": "False", "tcp_retransmission": "", "tcp_window_size": "373", "ttl_hop_limit": "64", "fragmentation": "No"}
{"timestamp": 1771341057.466291, "protocols": "eth:ethertype:ip:tcp:data", "src_ip": "127.0.0.1", "dst_ip": "127.0.0.1", "src_port": "35184", "dst_port": "43265", "packet_size": "228", "payload_len": "162", "info": "35184 \u2192 43265 [PSH, ACK] Seq=1234 Ack=1 Win=64 Len=162 TSval=3450579167 TSecr=3450579167", "tcp_seq": "1234", "tcp_flags_syn": "False", "tcp_flags_ack": "True", "tcp_flags_fin": "False", "tcp_flags_rst": "False", "tcp_flags_psh": "True", "tcp_flags_urg": "False", "tcp_retransmission": "", "tcp_window_size": "64", "ttl_hop_limit": "64", "fragmentation": "No"}
{"timestamp": 1771341057.466298, "protocols": "eth:ethertype:ip:tcp", "src_ip": "127.0.0.1", "dst_ip": "127.0.0.1", "src_port": "43265", "dst_port": "35184", "packet_size": "66", "payload_len": "0", "info": "43265 \u2192 35184 [ACK] Seq=1 Ack=1396 Win=373 Len=0 TSval=3450579167 TSecr=3450579167", "tcp_seq": "1", "tcp_flags_syn": "False", "tcp_flags_ack": "True", "tcp_flags_fin": "False", "tcp_flags_rst": "False", "tcp_flags_psh": "False", "tcp_flags_urg": "False", "tcp_retransmission": "", "tcp_window_size": "373", "ttl_hop_limit": "64", "fragmentation": "No"}
{"timestamp": 1771341057.7212458, "protocols": "eth:ethertype:ip:tcp:data", "src_ip": "127.0.0.1", "dst_ip": "127.0.0.1", "src_port": "35184", "dst_port": "43265", "packet_size": "89", "payload_len": "23", "info": "35184 \u2192 43265 [PSH, ACK] Seq=1396 Ack=1 Win=64 Len=23 TSval=3450579422 TSecr=3450579167", "tcp_seq": "1396", "tcp_flags_syn": "False", "tcp_flags_ack": "True", "tcp_flags_fin": "False", "tcp_flags_rst": "False", "tcp_flags_psh": "True", "tcp_flags_urg": "False", "tcp_retransmission": "", "tcp_window_size": "64", "ttl_hop_limit": "64", "fragmentation": "No"}
{"timestamp": 1771341057.7212632, "protocols": "eth:ethertype:ip:tcp", "src_ip": "127.0.0.1", "dst_ip": "127.0.0.1", "src_port": "43265", "dst_port": "35184", "packet_size": "66", "payload_len": "0", "info": "43265 \u2192 35184 [ACK] Seq=1 Ack=1419 Win=373 Len=0 TSval=3450579422 TSecr=3450579422", "tcp_seq": "1", "tcp_flags_syn": "False", "tcp_flags_ack": "True", "tcp_flags_fin": "False", "tcp_flags_rst": "False", "tcp_flags_psh": "False", "tcp_flags_urg": "False", "tcp_retransmission": "", "tcp_window_size": "373", "ttl_hop_limit": "64", "fragmentation": "No"}
{"timestamp": 1771341057.7212954, "protocols": "eth:ethertype:ip:tcp:data", "src_ip": "127.0.0.1", "dst_ip": "127.0.0.1", "src_port": "35184", "dst_port": "43265", "packet_size": "228", "payload_len": "162", "info": "35184 \u2192 43265 [PSH, ACK] Seq=1419 Ack=1 Win=64 Len=162 TSval=3450579422 TSecr=3450579422", "tcp_seq": "1419", "tcp_flags_syn": "False", "tcp_flags_ack": "True", "tcp_flags_fin": "False", "tcp_flags_rst": "False", "tcp_flags_psh": "True", "tcp_flags_urg": "False", "tcp_retransmission": "", "tcp_window_size": "64", "ttl_hop_limit": "64", "fragmentation": "No"}
{"timestamp": 1771341057.7213016, "protocols": "eth:ethertype:ip:tcp", "src_ip": "127.0.0.1", "dst_ip": "127.0.0.1", "src_port": "43265", "dst_port": "35184", "packet_size": "66", "payload_len": "0", "info": "43265 \u2192 35184 [ACK] Seq=1 Ack=1581 Win=373 Len=0 TSval=3450579422 TSecr=3450579422", "tcp_seq": "1", "tcp_flags_syn": "False", "tcp_flags_ack": "True", "tcp_flags_fin": "False", "tcp_flags_rst": "False", "tcp_flags_psh": "False", "tcp_flags_urg": "False", "tcp_retransmission": "", "tcp_window_size": "373", "ttl_hop_limit": "64", "fragmentation": "No"}
{"timestamp": 1771341057.9781666, "protocols": "eth:ethertype:ip:tcp:data", "src_ip": "127.0.0.1", "dst_ip": "127.0.0.1", "src_port": "35184", "dst_port": "43265", "packet_size": "89", "payload_len": "23", "info": "35184 \u2192 43265 [PSH, ACK] Seq=1581 Ack=1 Win=64 Len=23 TSval=3450579679 TSecr=3450579422", "tcp_seq": "1581", "tcp_flags_syn": "False", "tcp_flags_ack": "True", "tcp_flags_fin": "False", "tcp_flags_rst": "False", "tcp_flags_psh": "True", "tcp_flags_urg": "False", "tcp_retransmission": "", "tcp_window_size": "64", "ttl_hop_limit": "64", "fragmentation": "No"}
{"timestamp": 1771341057.978189, "protocols": "eth:ethertype:ip:tcp", "src_ip": "127.0.0.1", "dst_ip": "127.0.0.1", "src_port": "43265", "dst_port": "35184", "packet_size": "66", "payload_len": "0", "info": "43265 \u2192 35184 [ACK] Seq=1 Ack=1604 Win=373 Len=0 TSval=3450579679 TSecr=3450579679", "tcp_seq": "1", "tcp_flags_syn": "False", "tcp_flags_ack": "True", "tcp_flags_fin": "False", "tcp_flags_rst": "False", "tcp_flags_psh": "False", "tcp_flags_urg": "False", "tcp_retransmission": "", "tcp_window_size": "373", "ttl_hop_limit": "64", "fragmentation": "No"}
{"timestamp": 1771341057.9782393, "protocols": "eth:ethertype:ip:tcp:data", "src_ip": "127.0.0.1", "dst_ip": "127.0.0.1", "src_port": "35184", "dst_port": "43265", "packet_size": "228", "payload_len": "162", "info": "35184 \u2192 43265 [PSH, ACK] Seq=1604 Ack=1 Win=64 Len=162 TSval=3450579679 TSecr=3450579679", "tcp_seq": "1604", "tcp_flags_syn": "False", "tcp_flags_ack": "True", "tcp_flags_fin": "False", "tcp_flags_rst": "False", "tcp_flags_psh": "True", "tcp_flags_urg": "False", "tcp_retransmission": "", "tcp_window_size": "64", "ttl_hop_limit": "64", "fragmentation": "No"}
{"timestamp": 1771341057.9782467, "protocols": "eth:ethertype:ip:tcp", "src_ip": "127.0.0.1", "dst_ip": "127.0.0.1", "src_port": "43265", "dst_port": "35184", "packet_size": "66", "payload_len": "0", "info": "43265 \u2192 35184 [ACK] Seq=1 Ack=1766 Win=373 Len=0 TSval=3450579679 TSecr=3450579679", "tcp_seq": "1", "tcp_flags_syn": "False", "tcp_flags_ack": "True", "tcp_flags_fin": "False", "tcp_flags_rst": "False", "tcp_flags_psh": "False", "tcp_flags_urg": "False", "tcp_retransmission": "", "tcp_window_size": "373", "ttl_hop_limit": "64", "fragmentation": "No"}
{"timestamp": 1771341057.99097, "protocols": "eth:ethertype:ipv6:tcp", "src_ip": "::1", "dst_ip": "::1", "src_port": "58192", "dst_port": "5173", "packet_size": "94", "payload_len": "0", "info": "58192 \u2192 5173 [SYN] Seq=0 Win=65476 Len=0 MSS=65476 SACK_PERM TSval=1339341795 TSecr=0 WS=1024", "tcp_seq": "0", "tcp_flags_syn": "True", "tcp_flags_ack": "False", "tcp_flags_fin": "False", "tcp_flags_rst": "False", "tcp_flags_psh": "False", "tcp_flags_urg": "False", "tcp_retransmission": "", "tcp_window_size": "65476", "ttl_hop_limit": "64", "fragmentation": "No"}
{"timestamp": 1771341057.9909773, "protocols": "eth:ethertype:ipv6:tcp", "src_ip": "::1", "dst_ip": "::1", "src_port": "5173", "dst_port": "58192", "packet_size": "74", "payload_len": "0", "info": "5173 \u2192 58192 [RST, ACK] Seq=1 Ack=1 Win=0 Len=0", "tcp_seq": "1", "tcp_flags_syn": "False", "tcp_flags_ack": "True", "tcp_flags_fin": "False", "tcp_flags_rst": "True", "tcp_flags_psh": "False", "tcp_flags_urg": "False", "tcp_retransmission": "", "tcp_window_size": "0", "ttl_hop_limit": "64", "fragmentation": "No"}
{"timestamp": 1771341057.9910638, "protocols": "eth:ethertype:ip:tcp", "src_ip": "127.0.0.1", "dst_ip": "127.0.0.1", "src_port": "57662", "dst_port": "5173", "packet_size": "74", "payload_len": "0", "info": "57662 \u2192 5173 [SYN] Seq=0 Win=65495 Len=0 MSS=65495 SACK_PERM TSval=3450579692 TSecr=0 WS=1024", "tcp_seq": "0", "tcp_flags_syn": "True", "tcp_flags_ack": "False", "tcp_flags_fin": "False", "tcp_flags_rst": "False", "tcp_flags_psh": "False", "tcp_flags_urg": "False", "tcp_retransmission": "", "tcp_window_size": "65495", "ttl_hop_limit": "64", "fragmentation": "No"}
