{"timestamp": 1771756889.451531, "protocols": "eth:ethertype:ip:tcp", "src_ip": "192.168.1.12", "dst_ip": "192.168.1.20", "src_port": "58990", "dst_port": "1716", "packet_size": "66", "payload_len": "0", "info": "[TCP Keep-Alive] 58990 \u2192 1716 [ACK] Seq=147 Ack=1 Win=62 Len=0 TSval=278965324 TSecr=4216685810", "tcp_seq": "147", "tcp_flags_syn": "False", "tcp_flags_ack": "True", "tcp_flags_fin": "False", "tcp_flags_rst": "False", "tcp_flags_psh": "False", "tcp_flags_urg": "False", "tcp_retransmission": "", "tcp_window_size": "62", "ttl_hop_limit": "64", "fragmentation": "No"}
{"timestamp": 1771756889.4819171, "protocols": "eth:ethertype:ip:tcp", "src_ip": "192.168.1.20", "dst_ip": "192.168.1.12", "src_port": "1716", "dst_port": "58990", "packet_size": "66", "payload_len": "0", "info": "[TCP Keep-Alive ACK] 1716 \u2192 58990 [ACK] Seq=1 Ack=148 Win=107 Len=0 TSval=4216696021 TSecr=278944693", "tcp_seq": "1", "tcp_flags_syn": "False", "tcp_flags_ack": "True", "tcp_flags_fin": "False", "tcp_flags_rst": "False", "tcp_flags_psh": "False", "tcp_flags_urg": "False", "tcp_retransmission": "", "tcp_window_size": "107", "ttl_hop_limit": "64", "fragmentation": "No"}
{"timestamp": 1771756889.6693642, "protocols": "eth:ethertype:ip:tcp", "src_ip": "192.168.1.20", "dst_ip": "175.41.165.139", "src_port": "46435", "dst_port": "8000", "packet_size": "66", "payload_len": "0", "info": "46435 \u2192 8000 [ACK] Seq=1 Ack=1 Win=93 Len=0 TSval=4263973896 TSecr=160699194", "tcp_seq": "1", "tcp_flags_syn": "False", "tcp_flags_ack": "True", "tcp_flags_fin": "False", "tcp_flags_rst": "False", "tcp_flags_psh": "False", "tcp_flags_urg": "False", "tcp_retransmission": "", "tcp_window_size": "93", "ttl_hop_limit": "64", "fragmentation": "No"}
{"timestamp": 1771756889.6693974, "protocols": "eth:ethertype:ip:icmp:ip:tcp", "src_ip": "192.168.1.12", "dst_ip": "192.168.1.20", "src_port": "46435", "dst_port": "8000", "packet_size": "94", "payload_len": "0", "info": "Redirect             (Redirect for host)", "tcp_seq": "942266850", "tcp_flags_syn": "", "tcp_flags_ack": "", "tcp_flags_fin": "", "tcp_flags_rst": "", "tcp_flags_psh": "", "tcp_flags_urg": "", "tcp_retransmission": "", "tcp_window_size": "0", "ttl_hop_limit": "64,63", "fragmentation": "No"}
{"timestamp": 1771756889.6694057, "protocols": "eth:ethertype:ip:tcp", "src_ip": "192.168.1.20", "dst_ip": "175.41.165.139", "src_port": "46435", "dst_port": "8000", "packet_size": "66", "payload_len": "0", "info": "[TCP Dup ACK 775#1] 46435 \u2192 8000 [ACK] Seq=1 Ack=1 Win=93 Len=0 TSval=4263973896 TSecr=160699194", "tcp_seq": "1", "tcp_flags_syn": "False", "tcp_flags_ack": "True", "tcp_flags_fin": "False", "tcp_flags_rst": "False", "tcp_flags_psh": "False", "tcp_flags_urg": "False", "tcp_retransmission": "", "tcp_window_size": "93", "ttl_hop_limit": "63", "fragmentation": "No"}
{"timestamp": 1771756895.3388596, "protocols": "eth:ethertype:ip:data", "src_ip": "192.168.1.20", "dst_ip": "255.255.255.255", "src_port": "0", "dst_port": "0", "packet_size": "1514", "payload_len": "0", "info": "Fragmented IP protocol (proto=UDP 17, off=0, ID=bc73)", "tcp_seq": "0", "tcp_flags_syn": "", "tcp_flags_ack": "", "tcp_flags_fin": "", "tcp_flags_rst": "", "tcp_flags_psh": "", "tcp_flags_urg": "", "tcp_retransmission": "", "tcp_window_size": "0", "ttl_hop_limit": "64", "fragmentation": "No"}
{"timestamp": 1771756895.33886, "protocols": "eth:ethertype:ip:udp:data", "src_ip": "192.168.1.20", "dst_ip": "255.255.255.255", "src_port": "33346", "dst_port": "1716", "packet_size": "311", "payload_len": "1757", "info": "33346 \u2192 1716 Len=1749", "tcp_seq": "0", "tcp_flags_syn": "", "tcp_flags_ack": "", "tcp_flags_fin": "", "tcp_flags_rst": "", "tcp_flags_psh": "", "tcp_flags_urg": "", "tcp_retransmission": "", "tcp_window_size": "0", "ttl_hop_limit": "64", "fragmentation": "No"}
{"timestamp": 1771756895.340229, "protocols": "eth:ethertype:ip:tcp", "src_ip": "192.168.1.12", "dst_ip": "192.168.1.20", "src_port": "43814", "dst_port": "1716", "packet_size": "74", "payload_len": "0", "info": "43814 \u2192 1716 [SYN] Seq=0 Win=64240 Len=0 MSS=1460 SACK_PERM TSval=278971212 TSecr=0 WS=1024", "tcp_seq": "0", "tcp_flags_syn": "True", "tcp_flags_ack": "False", "tcp_flags_fin": "False", "tcp_flags_rst": "False", "tcp_flags_psh": "False", "tcp_flags_urg": "False", "tcp_retransmission": "", "tcp_window_size": "64240", "ttl_hop_limit": "64", "fragmentation": "No"}
{"timestamp": 1771756895.3456502, "protocols": "eth:ethertype:ip:udp:dns", "src_ip": "192.168.1.20", "dst_ip": "192.168.1.1", "src_port": "42239", "dst_port": "53", "packet_size": "74", "payload_len": "40", "info": "Standard query 0xb819 A www.google.com", "tcp_seq": "0", "tcp_flags_syn": "", "tcp_flags_ack": "", "tcp_flags_fin": "", "tcp_flags_rst": "", "tcp_flags_psh": "", "tcp_flags_urg": "", "tcp_retransmission": "", "tcp_window_size": "0", "ttl_hop_limit": "64", "fragmentation": "No"}
{"timestamp": 1771756895.3456726, "protocols": "eth:ethertype:ip:icmp:ip:udp", "src_ip": "192.168.1.12", "dst_ip": "192.168.1.20", "src_port": "42239", "dst_port": "53", "packet_size": "102", "payload_len": "40", "info": "Redirect             (Redirect for host)", "tcp_seq": "0", "tcp_flags_syn": "", "tcp_flags_ack": "", "tcp_flags_fin": "", "tcp_flags_rst": "", "tcp_flags_psh": "", "tcp_flags_urg": "", "tcp_retransmission": "", "tcp_window_size": "0", "ttl_hop_limit": "64,63", "fragmentation": "No"}
{"timestamp": 1771756895.3456786, "protocols": "eth:ethertype:ip:udp:dns", "src_ip": "192.168.1.20", "dst_ip": "192.168.1.1", "src_port": "42239", "dst_port": "53", "packet_size": "74", "payload_len": "40", "info": "Standard query 0xb819 A www.google.com", "tcp_seq": "0", "tcp_flags_syn": "", "tcp_flags_ack": "", "tcp_flags_fin": "", "tcp_flags_rst": "", "tcp_flags_psh": "", "tcp_flags_urg": "", "tcp_retransmission": "", "tcp_window_size": "0", "ttl_hop_limit": "63", "fragmentation": "No"}
{"timestamp": 1771756895.3496623, "protocols": "eth:ethertype:ip:tcp", "src_ip": "192.168.1.20", "dst_ip": "192.168.1.12", "src_port": "1716", "dst_port": "43814", "packet_size": "74", "payload_len": "0", "info": "1716 \u2192 43814 [SYN, ACK] Seq=0 Ack=1 Win=65535 Len=0 MSS=1460 SACK_PERM TSval=4216701896 TSecr=278971212 WS=1024", "tcp_seq": "0", "tcp_flags_syn": "True", "tcp_flags_ack": "True", "tcp_flags_fin": "False", "tcp_flags_rst": "False", "tcp_flags_psh": "False", "tcp_flags_urg": "False", "tcp_retransmission": "", "tcp_window_size": "65535", "ttl_hop_limit": "64", "fragmentation": "No"}
{"timestamp": 1771756895.349684, "protocols": "eth:ethertype:ip:tcp", "src_ip": "192.168.1.12", "dst_ip": "192.168.1.20", "src_port": "43814", "dst_port": "1716", "packet_size": "66", "payload_len": "0", "info": "43814 \u2192 1716 [ACK] Seq=1 Ack=1 Win=64512 Len=0 TSval=278971222 TSecr=4216701896", "tcp_seq": "1", "tcp_flags_syn": "False", "tcp_flags_ack": "True", "tcp_flags_fin": "False", "tcp_flags_rst": "False", "tcp_flags_psh": "False", "tcp_flags_urg": "False", "tcp_retransmission": "", "tcp_window_size": "63", "ttl_hop_limit": "64", "fragmentation": "No"}
{"timestamp": 1771756895.3500965, "protocols": "eth:ethertype:ip:tcp:data", "src_ip": "192.168.1.12", "dst_ip": "192.168.1.20", "src_port": "43814", "dst_port": "1716", "packet_size": "1514", "payload_len": "1448", "info": "43814 \u2192 1716 [ACK] Seq=1 Ack=1 Win=64512 Len=1448 TSval=278971222 TSecr=4216701896", "tcp_seq": "1", "tcp_flags_syn": "False", "tcp_flags_ack": "True", "tcp_flags_fin": "False", "tcp_flags_rst": "False", "tcp_flags_psh": "False", "tcp_flags_urg": "False", "tcp_retransmission": "", "tcp_window_size": "63", "ttl_hop_limit": "64", "fragmentation": "No"}
{"timestamp": 1771756895.3501034, "protocols": "eth:ethertype:ip:tcp:data", "src_ip": "192.168.1.12", "dst_ip": "192.168.1.20", "src_port": "43814", "dst_port": "1716", "packet_size": "388", "payload_len": "322", "info": "43814 \u2192 1716 [PSH, ACK] Seq=1449 Ack=1 Win=64512 Len=322 TSval=278971222 TSecr=4216701896", "tcp_seq": "1449", "tcp_flags_syn": "False", "tcp_flags_ack": "True", "tcp_flags_fin": "False", "tcp_flags_rst": "False", "tcp_flags_psh": "True", "tcp_flags_urg": "False", "tcp_retransmission": "", "tcp_window_size": "63", "ttl_hop_limit": "64", "fragmentation": "No"}
{"timestamp": 1771756895.3602262, "protocols": "eth:ethertype:ip:tcp", "src_ip": "192.168.1.20", "dst_ip": "192.168.1.12", "src_port": "1716", "dst_port": "43814", "packet_size": "66", "payload_len": "0", "info": "1716 \u2192 43814 [ACK] Seq=1 Ack=1449 Win=68608 Len=0 TSval=4216701906 TSecr=278971222", "tcp_seq": "1", "tcp_flags_syn": "False", "tcp_flags_ack": "True", "tcp_flags_fin": "False", "tcp_flags_rst": "False", "tcp_flags_psh": "False", "tcp_flags_urg": "False", "tcp_retransmission": "", "tcp_window_size": "67", "ttl_hop_limit": "64", "fragmentation": "No"}
{"timestamp": 1771756895.3602264, "protocols": "eth:ethertype:ip:tcp", "src_ip": "192.168.1.20", "dst_ip": "192.168.1.12", "src_port": "1716", "dst_port": "43814", "packet_size": "66", "payload_len": "0", "info": "1716 \u2192 43814 [ACK] Seq=1 Ack=1771 Win=71680 Len=0 TSval=4216701906 TSecr=278971222", "tcp_seq": "1", "tcp_flags_syn": "False", "tcp_flags_ack": "True", "tcp_flags_fin": "False", "tcp_flags_rst": "False", "tcp_flags_psh": "False", "tcp_flags_urg": "False", "tcp_retransmission": "", "tcp_window_size": "70", "ttl_hop_limit": "64", "fragmentation": "No"}
{"timestamp": 1771756895.3869536, "protocols": "eth:ethertype:ip:udp:dns", "src_ip": "192.168.1.1", "dst_ip": "192.168.1.20", "src_port": "53", "dst_port": "42239", "packet_size": "90", "payload_len": "56", "info": "Standard query response 0xb819 A www.google.com A 142.251.221.196", "tcp_seq": "0", "tcp_flags_syn": "", "tcp_flags_ack": "", "tcp_flags_fin": "", "tcp_flags_rst": "", "tcp_flags_psh": "", "tcp_flags_urg": "", "tcp_retransmission": "", "tcp_window_size": "0", "ttl_hop_limit": "64", "fragmentation": "No"}
{"timestamp": 1771756895.3869865, "protocols": "eth:ethertype:ip:udp:dns", "src_ip": "192.168.1.1", "dst_ip": "192.168.1.20", "src_port": "53", "dst_port": "42239", "packet_size": "90", "payload_len": "56", "info": "Standard query response 0xb819 A www.google.com A 142.251.221.196", "tcp_seq": "0", "tcp_flags_syn": "", "tcp_flags_ack": "", "tcp_flags_fin": "", "tcp_flags_rst": "", "tcp_flags_psh": "", "tcp_flags_urg": "", "tcp_retransmission": "", "tcp_window_size": "0", "ttl_hop_limit": "63", "fragmentation": "No"}
{"timestamp": 1771756895.433594, "protocols": "eth:ethertype:ip:tcp:tls", "src_ip": "192.168.1.20", "dst_ip": "192.168.1.12", "src_port": "1716", "dst_port": "43814", "packet_size": "204", "payload_len": "138", "info": "Client Hello", "tcp_seq": "1", "tcp_flags_syn": "False", "tcp_flags_ack": "True", "tcp_flags_fin": "False", "tcp_flags_rst": "False", "tcp_flags_psh": "True", "tcp_flags_urg": "False", "tcp_retransmission": "", "tcp_window_size": "70", "ttl_hop_limit": "64", "fragmentation": "No"}
{"timestamp": 1771756895.433615, "protocols": "eth:ethertype:ip:tcp", "src_ip": "192.168.1.12", "dst_ip": "192.168.1.20", "src_port": "43814", "dst_port": "1716", "packet_size": "66", "payload_len": "0", "info": "43814 \u2192 1716 [ACK] Seq=1771 Ack=139 Win=64512 Len=0 TSval=278971306 TSecr=4216701978", "tcp_seq": "1771", "tcp_flags_syn": "False", "tcp_flags_ack": "True", "tcp_flags_fin": "False", "tcp_flags_rst": "False", "tcp_flags_psh": "False", "tcp_flags_urg": "False", "tcp_retransmission": "", "tcp_window_size": "63", "ttl_hop_limit": "64", "fragmentation": "No"}
{"timestamp": 1771756895.4339235, "protocols": "eth:ethertype:ip:tcp:tls", "src_ip": "192.168.1.12", "dst_ip": "192.168.1.20", "src_port": "43814", "dst_port": "1716", "packet_size": "158", "payload_len": "92", "info": "Server Hello", "tcp_seq": "1771", "tcp_flags_syn": "False", "tcp_flags_ack": "True", "tcp_flags_fin": "False", "tcp_flags_rst": "False", "tcp_flags_psh": "True", "tcp_flags_urg": "False", "tcp_retransmission": "", "tcp_window_size": "63", "ttl_hop_limit": "64", "fragmentation": "No"}
{"timestamp": 1771756895.4339354, "protocols": "eth:ethertype:ip:tcp:tls:x509sat:x509sat:x509sat:x509sat:x509sat:x509sat:pkcs-1:x509ce:x509ce:x509ce", "src_ip": "192.168.1.12", "dst_ip": "192.168.1.20", "src_port": "43814", "dst_port": "1716", "packet_size": "598", "payload_len": "532", "info": "Certificate", "tcp_seq": "1863", "tcp_flags_syn": "False", "tcp_flags_ack": "True", "tcp_flags_fin": "False", "tcp_flags_rst": "False", "tcp_flags_psh": "True", "tcp_flags_urg": "False", "tcp_retransmission": "", "tcp_window_size": "63", "ttl_hop_limit": "64", "fragmentation": "No"}
{"timestamp": 1771756895.434876, "protocols": "eth:ethertype:ip:tcp:tls", "src_ip": "192.168.1.12", "dst_ip": "192.168.1.20", "src_port": "43814", "dst_port": "1716", "packet_size": "244", "payload_len": "178", "info": "Server Key Exchange, Certificate Request, Server Hello Done", "tcp_seq": "2395", "tcp_flags_syn": "False", "tcp_flags_ack": "True", "tcp_flags_fin": "False", "tcp_flags_rst": "False", "tcp_flags_psh": "True", "tcp_flags_urg": "False", "tcp_retransmission": "", "tcp_window_size": "63", "ttl_hop_limit": "64", "fragmentation": "No"}
{"timestamp": 1771756895.4573138, "protocols": "eth:ethertype:ip:tcp", "src_ip": "192.168.1.12", "dst_ip": "192.168.1.20", "src_port": "43814", "dst_port": "1716", "packet_size": "244", "payload_len": "178", "info": "[TCP Retransmission] 43814 \u2192 1716 [PSH, ACK] Seq=2395 Ack=139 Win=64512 Len=178 TSval=278971330 TSecr=4216701978", "tcp_seq": "2395", "tcp_flags_syn": "False", "tcp_flags_ack": "True", "tcp_flags_fin": "False", "tcp_flags_rst": "False", "tcp_flags_psh": "True", "tcp_flags_urg": "False", "tcp_retransmission": "1", "tcp_window_size": "63", "ttl_hop_limit": "64", "fragmentation": "No"}
{"timestamp": 1771756895.462485, "protocols": "eth:ethertype:ip:tcp", "src_ip": "192.168.1.20", "dst_ip": "192.168.1.12", "src_port": "1716", "dst_port": "43814", "packet_size": "66", "payload_len": "0", "info": "1716 \u2192 43814 [ACK] Seq=139 Ack=1863 Win=71680 Len=0 TSval=4216702006 TSecr=278971306", "tcp_seq": "139", "tcp_flags_syn": "False", "tcp_flags_ack": "True", "tcp_flags_fin": "False", "tcp_flags_rst": "False", "tcp_flags_psh": "False", "tcp_flags_urg": "False", "tcp_retransmission": "", "tcp_window_size": "70", "ttl_hop_limit": "64", "fragmentation": "No"}
{"timestamp": 1771756895.4624856, "protocols": "eth:ethertype:ip:tcp", "src_ip": "192.168.1.20", "dst_ip": "192.168.1.12", "src_port": "1716", "dst_port": "43814", "packet_size": "66", "payload_len": "0", "info": "1716 \u2192 43814 [ACK] Seq=139 Ack=2395 Win=74752 Len=0 TSval=4216702006 TSecr=278971306", "tcp_seq": "139", "tcp_flags_syn": "False", "tcp_flags_ack": "True", "tcp_flags_fin": "False", "tcp_flags_rst": "False", "tcp_flags_psh": "False", "tcp_flags_urg": "False", "tcp_retransmission": "", "tcp_window_size": "73", "ttl_hop_limit": "64", "fragmentation": "No"}
{"timestamp": 1771756895.4624856, "protocols": "eth:ethertype:ip:tcp", "src_ip": "192.168.1.20", "dst_ip": "192.168.1.12", "src_port": "1716", "dst_port": "43814", "packet_size": "66", "payload_len": "0", "info": "1716 \u2192 43814 [ACK] Seq=139 Ack=2573 Win=77824 Len=0 TSval=4216702006 TSecr=278971307", "tcp_seq": "139", "tcp_flags_syn": "False", "tcp_flags_ack": "True", "tcp_flags_fin": "False", "tcp_flags_rst": "False", "tcp_flags_psh": "False", "tcp_flags_urg": "False", "tcp_retransmission": "", "tcp_window_size": "76", "ttl_hop_limit": "64", "fragmentation": "No"}
{"timestamp": 1771756895.4624856, "protocols": "eth:ethertype:ip:tcp", "src_ip": "192.168.1.20", "dst_ip": "192.168.1.12", "src_port": "1716", "dst_port": "43814", "packet_size": "78", "payload_len": "0", "info": "[TCP Dup ACK 856#1] 1716 \u2192 43814 [ACK] Seq=139 Ack=2573 Win=77824 Len=0 TSval=4216702011 TSecr=278971330 SLE=2395 SRE=2573", "tcp_seq": "139", "tcp_flags_syn": "False", "tcp_flags_ack": "True", "tcp_flags_fin": "False", "tcp_flags_rst": "False", "tcp_flags_psh": "False", "tcp_flags_urg": "False", "tcp_retransmission": "", "tcp_window_size": "76", "ttl_hop_limit": "64", "fragmentation": "No"}
{"timestamp": 1771756895.465459, "protocols": "eth:ethertype:ip:tcp:tls:x509sat:x509sat:x509sat:x509sat:x509sat:x509sat:pkcs-1", "src_ip": "192.168.1.20", "dst_ip": "192.168.1.12", "src_port": "1716", "dst_port": "43814", "packet_size": "656", "payload_len": "590", "info": "Certificate, Client Key Exchange, Certificate Verify, Change Cipher Spec, Encrypted Handshake Message", "tcp_seq": "139", "tcp_flags_syn": "False", "tcp_flags_ack": "True", "tcp_flags_fin": "False", "tcp_flags_rst": "False", "tcp_flags_psh": "True", "tcp_flags_urg": "False", "tcp_retransmission": "", "tcp_window_size": "76", "ttl_hop_limit": "64", "fragmentation": "No"}
{"timestamp": 1771756895.4665275, "protocols": "eth:ethertype:ip:tcp:tls", "src_ip": "192.168.1.12", "dst_ip": "192.168.1.20", "src_port": "43814", "dst_port": "1716", "packet_size": "72", "payload_len": "6", "info": "Change Cipher Spec", "tcp_seq": "2573", "tcp_flags_syn": "False", "tcp_flags_ack": "True", "tcp_flags_fin": "False", "tcp_flags_rst": "False", "tcp_flags_psh": "True", "tcp_flags_urg": "False", "tcp_retransmission": "", "tcp_window_size": "63", "ttl_hop_limit": "64", "fragmentation": "No"}
{"timestamp": 1771756895.4665456, "protocols": "eth:ethertype:ip:tcp:tls", "src_ip": "192.168.1.12", "dst_ip": "192.168.1.20", "src_port": "43814", "dst_port": "1716", "packet_size": "111", "payload_len": "45", "info": "Encrypted Handshake Message", "tcp_seq": "2579", "tcp_flags_syn": "False", "tcp_flags_ack": "True", "tcp_flags_fin": "False", "tcp_flags_rst": "False", "tcp_flags_psh": "True", "tcp_flags_urg": "False", "tcp_retransmission": "", "tcp_window_size": "63", "ttl_hop_limit": "64", "fragmentation": "No"}
{"timestamp": 1771756895.467492, "protocols": "eth:ethertype:ip:tcp:tls", "src_ip": "192.168.1.12", "dst_ip": "192.168.1.20", "src_port": "43814", "dst_port": "1716", "packet_size": "1514", "payload_len": "1448", "info": "[TCP segment of a reassembled PDU]", "tcp_seq": "2624", "tcp_flags_syn": "False", "tcp_flags_ack": "True", "tcp_flags_fin": "False", "tcp_flags_rst": "False", "tcp_flags_psh": "False", "tcp_flags_urg": "False", "tcp_retransmission": "", "tcp_window_size": "63", "ttl_hop_limit": "64", "fragmentation": "No"}
{"timestamp": 1771756895.4674969, "protocols": "eth:ethertype:ip:tcp:tls", "src_ip": "192.168.1.12", "dst_ip": "192.168.1.20", "src_port": "43814", "dst_port": "1716", "packet_size": "417", "payload_len": "351", "info": "Application Data", "tcp_seq": "4072", "tcp_flags_syn": "False", "tcp_flags_ack": "True", "tcp_flags_fin": "False", "tcp_flags_rst": "False", "tcp_flags_psh": "True", "tcp_flags_urg": "False", "tcp_retransmission": "", "tcp_window_size": "63", "ttl_hop_limit": "64", "fragmentation": "No"}
{"timestamp": 1771756895.4740472, "protocols": "eth:ethertype:ip:tcp", "src_ip": "192.168.1.20", "dst_ip": "192.168.1.12", "src_port": "1716", "dst_port": "43814", "packet_size": "66", "payload_len": "0", "info": "1716 \u2192 43814 [ACK] Seq=729 Ack=4072 Win=80896 Len=0 TSval=4216702022 TSecr=278971339", "tcp_seq": "729", "tcp_flags_syn": "False", "tcp_flags_ack": "True", "tcp_flags_fin": "False", "tcp_flags_rst": "False", "tcp_flags_psh": "False", "tcp_flags_urg": "False", "tcp_retransmission": "", "tcp_window_size": "79", "ttl_hop_limit": "64", "fragmentation": "No"}
{"timestamp": 1771756895.4809406, "protocols": "eth:ethertype:ip:tcp:tls", "src_ip": "192.168.1.20", "dst_ip": "192.168.1.12", "src_port": "1716", "dst_port": "43814", "packet_size": "1829", "payload_len": "1763", "info": "Application Data", "tcp_seq": "729", "tcp_flags_syn": "False", "tcp_flags_ack": "True", "tcp_flags_fin": "False", "tcp_flags_rst": "False", "tcp_flags_psh": "True", "tcp_flags_urg": "False", "tcp_retransmission": "", "tcp_window_size": "81", "ttl_hop_limit": "64", "fragmentation": "No"}
{"timestamp": 1771756895.481008, "protocols": "eth:ethertype:ip:tcp", "src_ip": "192.168.1.12", "dst_ip": "192.168.1.20", "src_port": "43814", "dst_port": "1716", "packet_size": "66", "payload_len": "0", "info": "43814 \u2192 1716 [ACK] Seq=4423 Ack=2492 Win=63488 Len=0 TSval=278971353 TSecr=4216702024", "tcp_seq": "4423", "tcp_flags_syn": "False", "tcp_flags_ack": "True", "tcp_flags_fin": "False", "tcp_flags_rst": "False", "tcp_flags_psh": "False", "tcp_flags_urg": "False", "tcp_retransmission": "", "tcp_window_size": "62", "ttl_hop_limit": "64", "fragmentation": "No"}
{"timestamp": 1771756895.4813776, "protocols": "eth:ethertype:ip:tcp:tls", "src_ip": "192.168.1.12", "dst_ip": "192.168.1.20", "src_port": "58990", "dst_port": "1716", "packet_size": "97", "payload_len": "31", "info": "Encrypted Alert", "tcp_seq": "148", "tcp_flags_syn": "False", "tcp_flags_ack": "True", "tcp_flags_fin": "False", "tcp_flags_rst": "False", "tcp_flags_psh": "True", "tcp_flags_urg": "False", "tcp_retransmission": "", "tcp_window_size": "62", "ttl_hop_limit": "64", "fragmentation": "No"}
{"timestamp": 1771756895.4813976, "protocols": "eth:ethertype:ip:tcp", "src_ip": "192.168.1.12", "dst_ip": "192.168.1.20", "src_port": "58990", "dst_port": "1716", "packet_size": "66", "payload_len": "0", "info": "58990 \u2192 1716 [FIN, ACK] Seq=179 Ack=1 Win=62 Len=0 TSval=278971354 TSecr=4216696021", "tcp_seq": "179", "tcp_flags_syn": "False", "tcp_flags_ack": "True", "tcp_flags_fin": "True", "tcp_flags_rst": "False", "tcp_flags_psh": "False", "tcp_flags_urg": "False", "tcp_retransmission": "", "tcp_window_size": "62", "ttl_hop_limit": "64", "fragmentation": "No"}
{"timestamp": 1771756895.483516, "protocols": "eth:ethertype:ip:tcp:tls", "src_ip": "192.168.1.20", "dst_ip": "192.168.1.12", "src_port": "1716", "dst_port": "58990", "packet_size": "97", "payload_len": "31", "info": "Encrypted Alert", "tcp_seq": "1", "tcp_flags_syn": "False", "tcp_flags_ack": "True", "tcp_flags_fin": "False", "tcp_flags_rst": "False", "tcp_flags_psh": "True", "tcp_flags_urg": "False", "tcp_retransmission": "", "tcp_window_size": "107", "ttl_hop_limit": "64", "fragmentation": "No"}
{"timestamp": 1771756895.4835162, "protocols": "eth:ethertype:ip:tcp", "src_ip": "192.168.1.20", "dst_ip": "192.168.1.12", "src_port": "1716", "dst_port": "58990", "packet_size": "66", "payload_len": "0", "info": "1716 \u2192 58990 [FIN, ACK] Seq=32 Ack=148 Win=107 Len=0 TSval=4216702030 TSecr=278944693", "tcp_seq": "32", "tcp_flags_syn": "False", "tcp_flags_ack": "True", "tcp_flags_fin": "True", "tcp_flags_rst": "False", "tcp_flags_psh": "False", "tcp_flags_urg": "False", "tcp_retransmission": "", "tcp_window_size": "107", "ttl_hop_limit": "64", "fragmentation": "No"}
{"timestamp": 1771756895.4835398, "protocols": "eth:ethertype:ip:tcp", "src_ip": "192.168.1.12", "dst_ip": "192.168.1.20", "src_port": "58990", "dst_port": "1716", "packet_size": "54", "payload_len": "0", "info": "58990 \u2192 1716 [RST] Seq=148 Win=0 Len=0", "tcp_seq": "148", "tcp_flags_syn": "False", "tcp_flags_ack": "False", "tcp_flags_fin": "False", "tcp_flags_rst": "True", "tcp_flags_psh": "False", "tcp_flags_urg": "False", "tcp_retransmission": "", "tcp_window_size": "0", "ttl_hop_limit": "64", "fragmentation": "No"}
{"timestamp": 1771756895.4835472, "protocols": "eth:ethertype:ip:tcp", "src_ip": "192.168.1.12", "dst_ip": "192.168.1.20", "src_port": "58990", "dst_port": "1716", "packet_size": "54", "payload_len": "0", "info": "58990 \u2192 1716 [RST] Seq=148 Win=0 Len=0", "tcp_seq": "148", "tcp_flags_syn": "False", "tcp_flags_ack": "False", "tcp_flags_fin": "False", "tcp_flags_rst": "True", "tcp_flags_psh": "False", "tcp_flags_urg": "False", "tcp_retransmission": "", "tcp_window_size": "0", "ttl_hop_limit": "64", "fragmentation": "No"}
{"timestamp": 1771756895.4880157, "protocols": "eth:ethertype:ip:tcp", "src_ip": "192.168.1.20", "dst_ip": "192.168.1.12", "src_port": "1716", "dst_port": "58990", "packet_size": "54", "payload_len": "0", "info": "1716 \u2192 58990 [RST] Seq=1 Win=0 Len=0", "tcp_seq": "1", "tcp_flags_syn": "False", "tcp_flags_ack": "False", "tcp_flags_fin": "False", "tcp_flags_rst": "True", "tcp_flags_psh": "False", "tcp_flags_urg": "False", "tcp_retransmission": "", "tcp_window_size": "0", "ttl_hop_limit": "64", "fragmentation": "No"}
{"timestamp": 1771756895.488016, "protocols": "eth:ethertype:ip:tcp", "src_ip": "192.168.1.20", "dst_ip": "192.168.1.12", "src_port": "1716", "dst_port": "58990", "packet_size": "54", "payload_len": "0", "info": "1716 \u2192 58990 [RST] Seq=1 Win=0 Len=0", "tcp_seq": "1", "tcp_flags_syn": "False", "tcp_flags_ack": "False", "tcp_flags_fin": "False", "tcp_flags_rst": "True", "tcp_flags_psh": "False", "tcp_flags_urg": "False", "tcp_retransmission": "", "tcp_window_size": "0", "ttl_hop_limit": "64", "fragmentation": "No"}
{"timestamp": 1771756895.6253433, "protocols": "eth:ethertype:ip:tcp", "src_ip": "142.250.182.67", "dst_ip": "192.168.1.20", "src_port": "443", "dst_port": "40636", "packet_size": "66", "payload_len": "0", "info": "443 \u2192 40636 [FIN, ACK] Seq=1 Ack=1 Win=1050 Len=0 TSval=1800103798 TSecr=738567029", "tcp_seq": "1", "tcp_flags_syn": "False", "tcp_flags_ack": "True", "tcp_flags_fin": "True", "tcp_flags_rst": "False", "tcp_flags_psh": "False", "tcp_flags_urg": "False", "tcp_retransmission": "", "tcp_window_size": "1050", "ttl_hop_limit": "123", "fragmentation": "No"}
{"timestamp": 1771756895.6253655, "protocols": "eth:ethertype:ip:tcp", "src_ip": "142.250.182.67", "dst_ip": "192.168.1.20", "src_port": "443", "dst_port": "40636", "packet_size": "66", "payload_len": "0", "info": "[TCP Retransmission] 443 \u2192 40636 [FIN, ACK] Seq=1 Ack=1 Win=1050 Len=0 TSval=1800103798 TSecr=738567029", "tcp_seq": "1", "tcp_flags_syn": "False", "tcp_flags_ack": "True", "tcp_flags_fin": "True", "tcp_flags_rst": "False", "tcp_flags_psh": "False", "tcp_flags_urg": "False", "tcp_retransmission": "1", "tcp_window_size": "1050", "ttl_hop_limit": "122", "fragmentation": "No"}
{"timestamp": 1771756895.6530523, "protocols": "eth:ethertype:ip:tcp", "src_ip": "192.168.1.20", "dst_ip": "142.250.182.67", "src_port": "40636", "dst_port": "443", "packet_size": "66", "payload_len": "0", "info": "40636 \u2192 443 [FIN, ACK] Seq=1 Ack=2 Win=74 Len=0 TSval=738793886 TSecr=1800103798", "tcp_seq": "1", "tcp_flags_syn": "False", "tcp_flags_ack": "True", "tcp_flags_fin": "True", "tcp_flags_rst": "False", "tcp_flags_psh": "False", "tcp_flags_urg": "False", "tcp_retransmission": "", "tcp_window_size": "74", "ttl_hop_limit": "64", "fragmentation": "No"}
{"timestamp": 1771756895.653094, "protocols": "eth:ethertype:ip:icmp:ip:tcp", "src_ip": "192.168.1.12", "dst_ip": "192.168.1.20", "src_port": "40636", "dst_port": "443", "packet_size": "94", "payload_len": "0", "info": "Redirect             (Redirect for host)", "tcp_seq": "602269254", "tcp_flags_syn": "", "tcp_flags_ack": "", "tcp_flags_fin": "", "tcp_flags_rst": "", "tcp_flags_psh": "", "tcp_flags_urg": "", "tcp_retransmission": "", "tcp_window_size": "0", "ttl_hop_limit": "64,63", "fragmentation": "No"}
{"timestamp": 1771756895.6531081, "protocols": "eth:ethertype:ip:tcp", "src_ip": "192.168.1.20", "dst_ip": "142.250.182.67", "src_port": "40636", "dst_port": "443", "packet_size": "66", "payload_len": "0", "info": "[TCP Retransmission] 40636 \u2192 443 [FIN, ACK] Seq=1 Ack=2 Win=74 Len=0 TSval=738793886 TSecr=1800103798", "tcp_seq": "1", "tcp_flags_syn": "False", "tcp_flags_ack": "True", "tcp_flags_fin": "True", "tcp_flags_rst": "False", "tcp_flags_psh": "False", "tcp_flags_urg": "False", "tcp_retransmission": "1", "tcp_window_size": "74", "ttl_hop_limit": "63", "fragmentation": "No"}
{"timestamp": 1771756895.7234156, "protocols": "eth:ethertype:ip:tcp", "src_ip": "142.250.182.67", "dst_ip": "192.168.1.20", "src_port": "443", "dst_port": "40636", "packet_size": "66", "payload_len": "0", "info": "443 \u2192 40636 [ACK] Seq=2 Ack=2 Win=1050 Len=0 TSval=1800103897 TSecr=738793886", "tcp_seq": "2", "tcp_flags_syn": "False", "tcp_flags_ack": "True", "tcp_flags_fin": "False", "tcp_flags_rst": "False", "tcp_flags_psh": "False", "tcp_flags_urg": "False", "tcp_retransmission": "", "tcp_window_size": "1050", "ttl_hop_limit": "123", "fragmentation": "No"}
{"timestamp": 1771756895.7234378, "protocols": "eth:ethertype:ip:tcp", "src_ip": "142.250.182.67", "dst_ip": "192.168.1.20", "src_port": "443", "dst_port": "40636", "packet_size": "66", "payload_len": "0", "info": "[TCP Dup ACK 879#1] 443 \u2192 40636 [ACK] Seq=2 Ack=2 Win=1050 Len=0 TSval=1800103897 TSecr=738793886", "tcp_seq": "2", "tcp_flags_syn": "False", "tcp_flags_ack": "True", "tcp_flags_fin": "False", "tcp_flags_rst": "False", "tcp_flags_psh": "False", "tcp_flags_urg": "False", "tcp_retransmission": "", "tcp_window_size": "1050", "ttl_hop_limit": "122", "fragmentation": "No"}
{"timestamp": 1771756895.9413373, "protocols": "eth:ethertype:ip:udp:mdns", "src_ip": "192.168.1.20", "dst_ip": "224.0.0.251", "src_port": "5353", "dst_port": "5353", "packet_size": "136", "payload_len": "102", "info": "Standard query 0x0000 ANY I05VSEL8n14AAA._FC9F5ED42C8A._tcp.local, \"QM\" question SRV 0 0 53601 Android_NSGI9WGO.local", "tcp_seq": "0", "tcp_flags_syn": "", "tcp_flags_ack": "", "tcp_flags_fin": "", "tcp_flags_rst": "", "tcp_flags_psh": "", "tcp_flags_urg": "", "tcp_retransmission": "", "tcp_window_size": "0", "ttl_hop_limit": "255", "fragmentation": "No"}
{"timestamp": 1771756896.1436865, "protocols": "eth:ethertype:ip:udp:mdns", "src_ip": "192.168.1.20", "dst_ip": "224.0.0.251", "src_port": "5353", "dst_port": "5353", "packet_size": "136", "payload_len": "102", "info": "Standard query 0x0000 ANY I05VSEL8n14AAA._FC9F5ED42C8A._tcp.local, \"QM\" question SRV 0 0 53601 Android_NSGI9WGO.local", "tcp_seq": "0", "tcp_flags_syn": "", "tcp_flags_ack": "", "tcp_flags_fin": "", "tcp_flags_rst": "", "tcp_flags_psh": "", "tcp_flags_urg": "", "tcp_retransmission": "", "tcp_window_size": "0", "ttl_hop_limit": "255", "fragmentation": "No"}
{"timestamp": 1771756896.3513567, "protocols": "eth:ethertype:ip:udp:mdns", "src_ip": "192.168.1.20", "dst_ip": "224.0.0.251", "src_port": "5353", "dst_port": "5353", "packet_size": "82", "payload_len": "48", "info": "Standard query 0x0002 PTR _kdeconnect._udp.local, \"QM\" question", "tcp_seq": "0", "tcp_flags_syn": "", "tcp_flags_ack": "", "tcp_flags_fin": "", "tcp_flags_rst": "", "tcp_flags_psh": "", "tcp_flags_urg": "", "tcp_retransmission": "", "tcp_window_size": "0", "ttl_hop_limit": "255", "fragmentation": "No"}
{"timestamp": 1771756896.4543567, "protocols": "eth:ethertype:ip:udp:mdns", "src_ip": "192.168.1.20", "dst_ip": "224.0.0.251", "src_port": "5353", "dst_port": "5353", "packet_size": "359", "payload_len": "325", "info": "Standard query response 0x0000 PTR dc99cb2642084385b39a733310f29f95._kdeconnect._udp.local SRV, cache flush 0 0 1716 Android_NSGI9WGO.local AAAA, cache flush 2401:4900:88cd:ee23:d049:a3ff:fe2c:9063 TXT, cache flush NSEC, cache flush Android_NSGI9WGO.local A, cache flush 192.168.1.20 AAAA, cache flush fe80::d049:a3ff:fe2c:9063 NSEC, cache flush dc99cb2642084385b39a733310f29f95._kdeconnect._udp.local", "tcp_seq": "0", "tcp_flags_syn": "", "tcp_flags_ack": "", "tcp_flags_fin": "", "tcp_flags_rst": "", "tcp_flags_psh": "", "tcp_flags_urg": "", "tcp_retransmission": "", "tcp_window_size": "0", "ttl_hop_limit": "255", "fragmentation": "No"}
{"timestamp": 1771756896.4543571, "protocols": "eth:ethertype:ip:udp:mdns", "src_ip": "192.168.1.20", "dst_ip": "224.0.0.251", "src_port": "5353", "dst_port": "5353", "packet_size": "136", "payload_len": "102", "info": "Standard query 0x0000 ANY I05VSEL8n14AAA._FC9F5ED42C8A._tcp.local, \"QM\" question SRV 0 0 53601 Android_NSGI9WGO.local", "tcp_seq": "0", "tcp_flags_syn": "", "tcp_flags_ack": "", "tcp_flags_fin": "", "tcp_flags_rst": "", "tcp_flags_psh": "", "tcp_flags_urg": "", "tcp_retransmission": "", "tcp_window_size": "0", "ttl_hop_limit": "255", "fragmentation": "No"}
{"timestamp": 1771756896.6593337, "protocols": "eth:ethertype:ip:udp:mdns", "src_ip": "192.168.1.20", "dst_ip": "224.0.0.251", "src_port": "5353", "dst_port": "5353", "packet_size": "610", "payload_len": "576", "info": "Standard query response 0x0000 PTR, cache flush Android_NSGI9WGO.local AAAA, cache flush fe80::d049:a3ff:fe2c:9063 PTR, cache flush Android_NSGI9WGO.local A, cache flush 192.168.1.20 PTR, cache flush Android_NSGI9WGO.local AAAA, cache flush 2401:4900:88cd:ee23:d049:a3ff:fe2c:9063 PTR I05VSEL8n14AAA._FC9F5ED42C8A._tcp.local SRV, cache flush 0 0 53601 Android_NSGI9WGO.local TXT, cache flush PTR _FC9F5ED42C8A._tcp.local NSEC, cache flush 3.6.0.9.C.2.E.F.F.F.3.A.9.4.0.D.0.0.0.0.0.0.0.0.0.0.0.0.0.8.E.F.ip6.arpa NSEC, cache flush Android_NSGI9WGO.local NSEC, cache flush 20.1.168.192.in-addr.arpa NSEC, cache flush 3.6.0.9.C.2.E.F.F.F.3.A.9.4.0.D.3.2.E.E.D.C.8.8.0.0.9.4.1.0.4.2.ip6.arpa NSEC, cache flush I05VSEL8n14AAA._FC9F5ED42C8A._tcp.local", "tcp_seq": "0", "tcp_flags_syn": "", "tcp_flags_ack": "", "tcp_flags_fin": "", "tcp_flags_rst": "", "tcp_flags_psh": "", "tcp_flags_urg": "", "tcp_retransmission": "", "tcp_window_size": "0", "ttl_hop_limit": "255", "fragmentation": "No"}
{"timestamp": 1771756897.3843546, "protocols": "eth:ethertype:ip:udp:mdns", "src_ip": "192.168.1.20", "dst_ip": "224.0.0.251", "src_port": "5353", "dst_port": "5353", "packet_size": "82", "payload_len": "48", "info": "Standard query 0x0003 PTR _kdeconnect._udp.local, \"QM\" question", "tcp_seq": "0", "tcp_flags_syn": "", "tcp_flags_ack": "", "tcp_flags_fin": "", "tcp_flags_rst": "", "tcp_flags_psh": "", "tcp_flags_urg": "", "tcp_retransmission": "", "tcp_window_size": "0", "ttl_hop_limit": "255", "fragmentation": "No"}
{"timestamp": 1771756897.692794, "protocols": "eth:ethertype:ip:udp:mdns", "src_ip": "192.168.1.20", "dst_ip": "224.0.0.251", "src_port": "5353", "dst_port": "5353", "packet_size": "610", "payload_len": "576", "info": "Standard query response 0x0000 PTR, cache flush Android_NSGI9WGO.local AAAA, cache flush fe80::d049:a3ff:fe2c:9063 PTR, cache flush Android_NSGI9WGO.local A, cache flush 192.168.1.20 PTR, cache flush Android_NSGI9WGO.local AAAA, cache flush 2401:4900:88cd:ee23:d049:a3ff:fe2c:9063 PTR I05VSEL8n14AAA._FC9F5ED42C8A._tcp.local SRV, cache flush 0 0 53601 Android_NSGI9WGO.local TXT, cache flush PTR _FC9F5ED42C8A._tcp.local NSEC, cache flush 3.6.0.9.C.2.E.F.F.F.3.A.9.4.0.D.0.0.0.0.0.0.0.0.0.0.0.0.0.8.E.F.ip6.arpa NSEC, cache flush Android_NSGI9WGO.local NSEC, cache flush 20.1.168.192.in-addr.arpa NSEC, cache flush 3.6.0.9.C.2.E.F.F.F.3.A.9.4.0.D.3.2.E.E.D.C.8.8.0.0.9.4.1.0.4.2.ip6.arpa NSEC, cache flush I05VSEL8n14AAA._FC9F5ED42C8A._tcp.local", "tcp_seq": "0", "tcp_flags_syn": "", "tcp_flags_ack": "", "tcp_flags_fin": "", "tcp_flags_rst": "", "tcp_flags_psh": "", "tcp_flags_urg": "", "tcp_retransmission": "", "tcp_window_size": "0", "ttl_hop_limit": "255", "fragmentation": "No"}
{"timestamp": 1771756899.743135, "protocols": "eth:ethertype:ip:udp:mdns", "src_ip": "192.168.1.20", "dst_ip": "224.0.0.251", "src_port": "5353", "dst_port": "5353", "packet_size": "610", "payload_len": "576", "info": "Standard query response 0x0000 PTR, cache flush Android_NSGI9WGO.local AAAA, cache flush fe80::d049:a3ff:fe2c:9063 PTR, cache flush Android_NSGI9WGO.local A, cache flush 192.168.1.20 PTR, cache flush Android_NSGI9WGO.local AAAA, cache flush 2401:4900:88cd:ee23:d049:a3ff:fe2c:9063 PTR I05VSEL8n14AAA._FC9F5ED42C8A._tcp.local SRV, cache flush 0 0 53601 Android_NSGI9WGO.local TXT, cache flush PTR _FC9F5ED42C8A._tcp.local NSEC, cache flush 3.6.0.9.C.2.E.F.F.F.3.A.9.4.0.D.0.0.0.0.0.0.0.0.0.0.0.0.0.8.E.F.ip6.arpa NSEC, cache flush Android_NSGI9WGO.local NSEC, cache flush 20.1.168.192.in-addr.arpa NSEC, cache flush 3.6.0.9.C.2.E.F.F.F.3.A.9.4.0.D.3.2.E.E.D.C.8.8.0.0.9.4.1.0.4.2.ip6.arpa NSEC, cache flush I05VSEL8n14AAA._FC9F5ED42C8A._tcp.local", "tcp_seq": "0", "tcp_flags_syn": "", "tcp_flags_ack": "", "tcp_flags_fin": "", "tcp_flags_rst": "", "tcp_flags_psh": "", "tcp_flags_urg": "", "tcp_retransmission": "", "tcp_window_size": "0", "ttl_hop_limit": "255", "fragmentation": "No"}
{"timestamp": 1771756903.7362852, "protocols": "eth:ethertype:ip:udp:mdns", "src_ip": "192.168.1.20", "dst_ip": "224.0.0.251", "src_port": "5353", "dst_port": "5353", "packet_size": "610", "payload_len": "576", "info": "Standard query response 0x0000 PTR, cache flush Android_NSGI9WGO.local AAAA, cache flush fe80::d049:a3ff:fe2c:9063 PTR, cache flush Android_NSGI9WGO.local A, cache flush 192.168.1.20 PTR, cache flush Android_NSGI9WGO.local AAAA, cache flush 2401:4900:88cd:ee23:d049:a3ff:fe2c:9063 PTR I05VSEL8n14AAA._FC9F5ED42C8A._tcp.local SRV, cache flush 0 0 53601 Android_NSGI9WGO.local TXT, cache flush PTR _FC9F5ED42C8A._tcp.local NSEC, cache flush 3.6.0.9.C.2.E.F.F.F.3.A.9.4.0.D.0.0.0.0.0.0.0.0.0.0.0.0.0.8.E.F.ip6.arpa NSEC, cache flush Android_NSGI9WGO.local NSEC, cache flush 20.1.168.192.in-addr.arpa NSEC, cache flush 3.6.0.9.C.2.E.F.F.F.3.A.9.4.0.D.3.2.E.E.D.C.8.8.0.0.9.4.1.0.4.2.ip6.arpa NSEC, cache flush I05VSEL8n14AAA._FC9F5ED42C8A._tcp.local", "tcp_seq": "0", "tcp_flags_syn": "", "tcp_flags_ack": "", "tcp_flags_fin": "", "tcp_flags_rst": "", "tcp_flags_psh": "", "tcp_flags_urg": "", "tcp_retransmission": "", "tcp_window_size": "0", "ttl_hop_limit": "255", "fragmentation": "No"}
{"timestamp": 1771756905.8353424, "protocols": "eth:ethertype:ip:tcp", "src_ip": "192.168.1.12", "dst_ip": "192.168.1.20", "src_port": "43814", "dst_port": "1716", "packet_size": "66", "payload_len": "0", "info": "[TCP Keep-Alive] 43814 \u2192 1716 [ACK] Seq=4422 Ack=2492 Win=63488 Len=0 TSval=278981708 TSecr=4216702024", "tcp_seq": "4422", "tcp_flags_syn": "False", "tcp_flags_ack": "True", "tcp_flags_fin": "False", "tcp_flags_rst": "False", "tcp_flags_psh": "False", "tcp_flags_urg": "False", "tcp_retransmission": "", "tcp_window_size": "62", "ttl_hop_limit": "64", "fragmentation": "No"}
{"timestamp": 1771756905.849879, "protocols": "eth:ethertype:ip:tcp", "src_ip": "192.168.1.20", "dst_ip": "192.168.1.12", "src_port": "1716", "dst_port": "43814", "packet_size": "66", "payload_len": "0", "info": "[TCP Keep-Alive ACK] 1716 \u2192 43814 [ACK] Seq=2492 Ack=4423 Win=82944 Len=0 TSval=4216712397 TSecr=278971353", "tcp_seq": "2492", "tcp_flags_syn": "False", "tcp_flags_ack": "True", "tcp_flags_fin": "False", "tcp_flags_rst": "False", "tcp_flags_psh": "False", "tcp_flags_urg": "False", "tcp_retransmission": "", "tcp_window_size": "81", "ttl_hop_limit": "64", "fragmentation": "No"}
{"timestamp": 1771756911.7235992, "protocols": "eth:ethertype:ip:udp:mdns", "src_ip": "192.168.1.20", "dst_ip": "224.0.0.251", "src_port": "5353", "dst_port": "5353", "packet_size": "610", "payload_len": "576", "info": "Standard query response 0x0000 PTR, cache flush Android_NSGI9WGO.local AAAA, cache flush fe80::d049:a3ff:fe2c:9063 PTR, cache flush Android_NSGI9WGO.local A, cache flush 192.168.1.20 PTR, cache flush Android_NSGI9WGO.local AAAA, cache flush 2401:4900:88cd:ee23:d049:a3ff:fe2c:9063 PTR I05VSEL8n14AAA._FC9F5ED42C8A._tcp.local SRV, cache flush 0 0 53601 Android_NSGI9WGO.local TXT, cache flush PTR _FC9F5ED42C8A._tcp.local NSEC, cache flush 3.6.0.9.C.2.E.F.F.F.3.A.9.4.0.D.0.0.0.0.0.0.0.0.0.0.0.0.0.8.E.F.ip6.arpa NSEC, cache flush Android_NSGI9WGO.local NSEC, cache flush 20.1.168.192.in-addr.arpa NSEC, cache flush 3.6.0.9.C.2.E.F.F.F.3.A.9.4.0.D.3.2.E.E.D.C.8.8.0.0.9.4.1.0.4.2.ip6.arpa NSEC, cache flush I05VSEL8n14AAA._FC9F5ED42C8A._tcp.local", "tcp_seq": "0", "tcp_flags_syn": "", "tcp_flags_ack": "", "tcp_flags_fin": "", "tcp_flags_rst": "", "tcp_flags_psh": "", "tcp_flags_urg": "", "tcp_retransmission": "", "tcp_window_size": "0", "ttl_hop_limit": "255", "fragmentation": "No"}
{"timestamp": 1771756913.9308927, "protocols": "eth:ethertype:ip:tcp:tls", "src_ip": "192.168.1.12", "dst_ip": "192.168.1.20", "src_port": "43814", "dst_port": "1716", "packet_size": "213", "payload_len": "147", "info": "Application Data", "tcp_seq": "4423", "tcp_flags_syn": "False", "tcp_flags_ack": "True", "tcp_flags_fin": "False", "tcp_flags_rst": "False", "tcp_flags_psh": "True", "tcp_flags_urg": "False", "tcp_retransmission": "", "tcp_window_size": "62", "ttl_hop_limit": "64", "fragmentation": "No"}
{"timestamp": 1771756914.0393286, "protocols": "eth:ethertype:ip:tcp", "src_ip": "192.168.1.20", "dst_ip": "192.168.1.12", "src_port": "1716", "dst_port": "43814", "packet_size": "66", "payload_len": "0", "info": "1716 \u2192 43814 [ACK] Seq=2492 Ack=4570 Win=86016 Len=0 TSval=4216720560 TSecr=278989803", "tcp_seq": "2492", "tcp_flags_syn": "False", "tcp_flags_ack": "True", "tcp_flags_fin": "False", "tcp_flags_rst": "False", "tcp_flags_psh": "False", "tcp_flags_urg": "False", "tcp_retransmission": "", "tcp_window_size": "84", "ttl_hop_limit": "64", "fragmentation": "No"}
{"timestamp": 1771756917.3542464, "protocols": "eth:ethertype:ip:udp:mdns", "src_ip": "192.168.1.20", "dst_ip": "224.0.0.251", "src_port": "5353", "dst_port": "5353", "packet_size": "82", "payload_len": "48", "info": "Standard query 0x0004 PTR _kdeconnect._udp.local, \"QM\" question", "tcp_seq": "0", "tcp_flags_syn": "", "tcp_flags_ack": "", "tcp_flags_fin": "", "tcp_flags_rst": "", "tcp_flags_psh": "", "tcp_flags_urg": "", "tcp_retransmission": "", "tcp_window_size": "0", "ttl_hop_limit": "255", "fragmentation": "No"}
{"timestamp": 1771756917.445261, "protocols": "eth:ethertype:ip:udp:mdns", "src_ip": "192.168.1.20", "dst_ip": "224.0.0.251", "src_port": "5353", "dst_port": "5353", "packet_size": "359", "payload_len": "325", "info": "Standard query response 0x0000 PTR dc99cb2642084385b39a733310f29f95._kdeconnect._udp.local SRV, cache flush 0 0 1716 Android_NSGI9WGO.local AAAA, cache flush 2401:4900:88cd:ee23:d049:a3ff:fe2c:9063 TXT, cache flush NSEC, cache flush Android_NSGI9WGO.local A, cache flush 192.168.1.20 AAAA, cache flush fe80::d049:a3ff:fe2c:9063 NSEC, cache flush dc99cb2642084385b39a733310f29f95._kdeconnect._udp.local", "tcp_seq": "0", "tcp_flags_syn": "", "tcp_flags_ack": "", "tcp_flags_fin": "", "tcp_flags_rst": "", "tcp_flags_psh": "", "tcp_flags_urg": "", "tcp_retransmission": "", "tcp_window_size": "0", "ttl_hop_limit": "255", "fragmentation": "No"}
{"timestamp": 1771756919.632082, "protocols": "eth:ethertype:ip:tcp", "src_ip": "175.41.165.139", "dst_ip": "192.168.1.20", "src_port": "8000", "dst_port": "46435", "packet_size": "54", "payload_len": "0", "info": "8000 \u2192 46435 [ACK] Seq=0 Ack=1 Win=86 Len=0", "tcp_seq": "0", "tcp_flags_syn": "False", "tcp_flags_ack": "True", "tcp_flags_fin": "False", "tcp_flags_rst": "False", "tcp_flags_psh": "False", "tcp_flags_urg": "False", "tcp_retransmission": "", "tcp_window_size": "86", "ttl_hop_limit": "253", "fragmentation": "No"}
{"timestamp": 1771756919.6320941, "protocols": "eth:ethertype:ip:tcp", "src_ip": "175.41.165.139", "dst_ip": "192.168.1.20", "src_port": "8000", "dst_port": "46435", "packet_size": "54", "payload_len": "0", "info": "[TCP Dup ACK 1049#1] 8000 \u2192 46435 [ACK] Seq=0 Ack=1 Win=86 Len=0", "tcp_seq": "0", "tcp_flags_syn": "False", "tcp_flags_ack": "True", "tcp_flags_fin": "False", "tcp_flags_rst": "False", "tcp_flags_psh": "False", "tcp_flags_urg": "False", "tcp_retransmission": "", "tcp_window_size": "86", "ttl_hop_limit": "252", "fragmentation": "No"}
{"timestamp": 1771756923.896749, "protocols": "eth:ethertype:ip:udp:mdns", "src_ip": "192.168.1.20", "dst_ip": "224.0.0.251", "src_port": "5353", "dst_port": "5353", "packet_size": "107", "payload_len": "73", "info": "Standard query response 0x0000 PTR I05VSEL8n14AAA._FC9F5ED42C8A._tcp.local", "tcp_seq": "0", "tcp_flags_syn": "", "tcp_flags_ack": "", "tcp_flags_fin": "", "tcp_flags_rst": "", "tcp_flags_psh": "", "tcp_flags_urg": "", "tcp_retransmission": "", "tcp_window_size": "0", "ttl_hop_limit": "255", "fragmentation": "No"}
{"timestamp": 1771756924.2674778, "protocols": "eth:ethertype:ip:tcp", "src_ip": "192.168.1.12", "dst_ip": "192.168.1.20", "src_port": "43814", "dst_port": "1716", "packet_size": "66", "payload_len": "0", "info": "[TCP Keep-Alive] 43814 \u2192 1716 [ACK] Seq=4569 Ack=2492 Win=63488 Len=0 TSval=279000140 TSecr=4216720560", "tcp_seq": "4569", "tcp_flags_syn": "False", "tcp_flags_ack": "True", "tcp_flags_fin": "False", "tcp_flags_rst": "False", "tcp_flags_psh": "False", "tcp_flags_urg": "False", "tcp_retransmission": "", "tcp_window_size": "62", "ttl_hop_limit": "64", "fragmentation": "No"}
{"timestamp": 1771756924.3063629, "protocols": "eth:ethertype:ip:tcp", "src_ip": "192.168.1.20", "dst_ip": "192.168.1.12", "src_port": "1716", "dst_port": "43814", "packet_size": "66", "payload_len": "0", "info": "[TCP Keep-Alive ACK] 1716 \u2192 43814 [ACK] Seq=2492 Ack=4570 Win=86016 Len=0 TSval=4216730838 TSecr=278989803", "tcp_seq": "2492", "tcp_flags_syn": "False", "tcp_flags_ack": "True", "tcp_flags_fin": "False", "tcp_flags_rst": "False", "tcp_flags_psh": "False", "tcp_flags_urg": "False", "tcp_retransmission": "", "tcp_window_size": "84", "ttl_hop_limit": "64", "fragmentation": "No"}
{"timestamp": 1771756925.9485154, "protocols": "eth:ethertype:ip:udp:mdns", "src_ip": "192.168.1.20", "dst_ip": "224.0.0.251", "src_port": "5353", "dst_port": "5353", "packet_size": "107", "payload_len": "73", "info": "Standard query response 0x0000 PTR I05VSEL8n14AAA._FC9F5ED42C8A._tcp.local", "tcp_seq": "0", "tcp_flags_syn": "", "tcp_flags_ack": "", "tcp_flags_fin": "", "tcp_flags_rst": "", "tcp_flags_psh": "", "tcp_flags_urg": "", "tcp_retransmission": "", "tcp_window_size": "0", "ttl_hop_limit": "255", "fragmentation": "No"}
{"timestamp": 1771756927.890879, "protocols": "eth:ethertype:ip:udp:mdns", "src_ip": "192.168.1.20", "dst_ip": "224.0.0.251", "src_port": "5353", "dst_port": "5353", "packet_size": "107", "payload_len": "73", "info": "Standard query response 0x0000 PTR I05VSEL8n14AAA._FC9F5ED42C8A._tcp.local", "tcp_seq": "0", "tcp_flags_syn": "", "tcp_flags_ack": "", "tcp_flags_fin": "", "tcp_flags_rst": "", "tcp_flags_psh": "", "tcp_flags_urg": "", "tcp_retransmission": "", "tcp_window_size": "0", "ttl_hop_limit": "255", "fragmentation": "No"}
{"timestamp": 1771756933.433371, "protocols": "eth:ethertype:ip:tcp", "src_ip": "13.89.179.13", "dst_ip": "192.168.1.20", "src_port": "443", "dst_port": "50314", "packet_size": "66", "payload_len": "0", "info": "443 \u2192 50314 [ACK] Seq=1 Ack=1 Win=16384 Len=0 TSval=123655710 TSecr=660846732", "tcp_seq": "1", "tcp_flags_syn": "False", "tcp_flags_ack": "True", "tcp_flags_fin": "False", "tcp_flags_rst": "False", "tcp_flags_psh": "False", "tcp_flags_urg": "False", "tcp_retransmission": "", "tcp_window_size": "16384", "ttl_hop_limit": "110", "fragmentation": "No"}
{"timestamp": 1771756933.4333866, "protocols": "eth:ethertype:ip:tcp", "src_ip": "13.89.179.13", "dst_ip": "192.168.1.20", "src_port": "443", "dst_port": "50314", "packet_size": "66", "payload_len": "0", "info": "[TCP Dup ACK 1464#1] 443 \u2192 50314 [ACK] Seq=1 Ack=1 Win=16384 Len=0 TSval=123655710 TSecr=660846732", "tcp_seq": "1", "tcp_flags_syn": "False", "tcp_flags_ack": "True", "tcp_flags_fin": "False", "tcp_flags_rst": "False", "tcp_flags_psh": "False", "tcp_flags_urg": "False", "tcp_retransmission": "", "tcp_window_size": "16384", "ttl_hop_limit": "109", "fragmentation": "No"}
{"timestamp": 1771756933.4849238, "protocols": "eth:ethertype:ip:tcp:tls", "src_ip": "13.89.179.13", "dst_ip": "192.168.1.20", "src_port": "443", "dst_port": "50314", "packet_size": "511", "payload_len": "445", "info": "Application Data", "tcp_seq": "1", "tcp_flags_syn": "False", "tcp_flags_ack": "True", "tcp_flags_fin": "False", "tcp_flags_rst": "False", "tcp_flags_psh": "True", "tcp_flags_urg": "False", "tcp_retransmission": "", "tcp_window_size": "16384", "ttl_hop_limit": "110", "fragmentation": "No"}
{"timestamp": 1771756933.4849384, "protocols": "eth:ethertype:ip:tcp", "src_ip": "13.89.179.13", "dst_ip": "192.168.1.20", "src_port": "443", "dst_port": "50314", "packet_size": "511", "payload_len": "445", "info": "[TCP Retransmission] 443 \u2192 50314 [PSH, ACK] Seq=1 Ack=1 Win=16384 Len=445 TSval=123655794 TSecr=660846732", "tcp_seq": "1", "tcp_flags_syn": "False", "tcp_flags_ack": "True", "tcp_flags_fin": "False", "tcp_flags_rst": "False", "tcp_flags_psh": "True", "tcp_flags_urg": "False", "tcp_retransmission": "1", "tcp_window_size": "16384", "ttl_hop_limit": "109", "fragmentation": "No"}
{"timestamp": 1771756934.5074015, "protocols": "eth:ethertype:ip:tcp", "src_ip": "192.168.1.12", "dst_ip": "192.168.1.20", "src_port": "43814", "dst_port": "1716", "packet_size": "66", "payload_len": "0", "info": "[TCP Keep-Alive] 43814 \u2192 1716 [ACK] Seq=4569 Ack=2492 Win=63488 Len=0 TSval=279010380 TSecr=4216730838", "tcp_seq": "4569", "tcp_flags_syn": "False", "tcp_flags_ack": "True", "tcp_flags_fin": "False", "tcp_flags_rst": "False", "tcp_flags_psh": "False", "tcp_flags_urg": "False", "tcp_retransmission": "", "tcp_window_size": "62", "ttl_hop_limit": "64", "fragmentation": "No"}
{"timestamp": 1771756934.6188402, "protocols": "eth:ethertype:ip:tcp", "src_ip": "192.168.1.20", "dst_ip": "192.168.1.12", "src_port": "1716", "dst_port": "43814", "packet_size": "66", "payload_len": "0", "info": "[TCP Keep-Alive ACK] 1716 \u2192 43814 [ACK] Seq=2492 Ack=4570 Win=86016 Len=0 TSval=4216741100 TSecr=278989803", "tcp_seq": "2492", "tcp_flags_syn": "False", "tcp_flags_ack": "True", "tcp_flags_fin": "False", "tcp_flags_rst": "False", "tcp_flags_psh": "False", "tcp_flags_urg": "False", "tcp_retransmission": "", "tcp_window_size": "84", "ttl_hop_limit": "64", "fragmentation": "No"}
{"timestamp": 1771756944.7476137, "protocols": "eth:ethertype:ip:tcp", "src_ip": "192.168.1.12", "dst_ip": "192.168.1.20", "src_port": "43814", "dst_port": "1716", "packet_size": "66", "payload_len": "0", "info": "[TCP Keep-Alive] 43814 \u2192 1716 [ACK] Seq=4569 Ack=2492 Win=63488 Len=0 TSval=279020620 TSecr=4216741100", "tcp_seq": "4569", "tcp_flags_syn": "False", "tcp_flags_ack": "True", "tcp_flags_fin": "False", "tcp_flags_rst": "False", "tcp_flags_psh": "False", "tcp_flags_urg": "False", "tcp_retransmission": "", "tcp_window_size": "62", "ttl_hop_limit": "64", "fragmentation": "No"}
{"timestamp": 1771756944.8188481, "protocols": "eth:ethertype:ip:tcp", "src_ip": "192.168.1.20", "dst_ip": "192.168.1.12", "src_port": "1716", "dst_port": "43814", "packet_size": "66", "payload_len": "0", "info": "[TCP Keep-Alive ACK] 1716 \u2192 43814 [ACK] Seq=2492 Ack=4570 Win=86016 Len=0 TSval=4216749658 TSecr=278989803", "tcp_seq": "2492", "tcp_flags_syn": "False", "tcp_flags_ack": "True", "tcp_flags_fin": "False", "tcp_flags_rst": "False", "tcp_flags_psh": "False", "tcp_flags_urg": "False", "tcp_retransmission": "", "tcp_window_size": "84", "ttl_hop_limit": "64", "fragmentation": "No"}
{"timestamp": 1771756947.6749415, "protocols": "eth:ethertype:ip:tcp", "src_ip": "64.233.170.188", "dst_ip": "192.168.1.20", "src_port": "5228", "dst_port": "49360", "packet_size": "54", "payload_len": "0", "info": "5228 \u2192 49360 [ACK] Seq=1 Ack=1 Win=1050 Len=0", "tcp_seq": "1", "tcp_flags_syn": "False", "tcp_flags_ack": "True", "tcp_flags_fin": "False", "tcp_flags_rst": "False", "tcp_flags_psh": "False", "tcp_flags_urg": "False", "tcp_retransmission": "", "tcp_window_size": "1050", "ttl_hop_limit": "253", "fragmentation": "No"}
{"timestamp": 1771756947.6749682, "protocols": "eth:ethertype:ip:tcp", "src_ip": "64.233.170.188", "dst_ip": "192.168.1.20", "src_port": "5228", "dst_port": "49360", "packet_size": "54", "payload_len": "0", "info": "[TCP Dup ACK 1573#1] 5228 \u2192 49360 [ACK] Seq=1 Ack=1 Win=1050 Len=0", "tcp_seq": "1", "tcp_flags_syn": "False", "tcp_flags_ack": "True", "tcp_flags_fin": "False", "tcp_flags_rst": "False", "tcp_flags_psh": "False", "tcp_flags_urg": "False", "tcp_retransmission": "", "tcp_window_size": "1050", "ttl_hop_limit": "252", "fragmentation": "No"}
{"timestamp": 1771756949.6555777, "protocols": "eth:ethertype:ip:tcp", "src_ip": "175.41.165.139", "dst_ip": "192.168.1.20", "src_port": "8000", "dst_port": "46435", "packet_size": "54", "payload_len": "0", "info": "[TCP Dup ACK 1049#2] 8000 \u2192 46435 [ACK] Seq=0 Ack=1 Win=86 Len=0", "tcp_seq": "0", "tcp_flags_syn": "False", "tcp_flags_ack": "True", "tcp_flags_fin": "False", "tcp_flags_rst": "False", "tcp_flags_psh": "False", "tcp_flags_urg": "False", "tcp_retransmission": "", "tcp_window_size": "86", "ttl_hop_limit": "253", "fragmentation": "No"}
{"timestamp": 1771756949.6556158, "protocols": "eth:ethertype:ip:tcp", "src_ip": "175.41.165.139", "dst_ip": "192.168.1.20", "src_port": "8000", "dst_port": "46435", "packet_size": "54", "payload_len": "0", "info": "[TCP Dup ACK 1049#3] 8000 \u2192 46435 [ACK] Seq=0 Ack=1 Win=86 Len=0", "tcp_seq": "0", "tcp_flags_syn": "False", "tcp_flags_ack": "True", "tcp_flags_fin": "False", "tcp_flags_rst": "False", "tcp_flags_psh": "False", "tcp_flags_urg": "False", "tcp_retransmission": "", "tcp_window_size": "86", "ttl_hop_limit": "252", "fragmentation": "No"}
{"timestamp": 1771756954.9875634, "protocols": "eth:ethertype:ip:tcp", "src_ip": "192.168.1.12", "dst_ip": "192.168.1.20", "src_port": "43814", "dst_port": "1716", "packet_size": "66", "payload_len": "0", "info": "[TCP Keep-Alive] 43814 \u2192 1716 [ACK] Seq=4569 Ack=2492 Win=63488 Len=0 TSval=279030860 TSecr=4216749658", "tcp_seq": "4569", "tcp_flags_syn": "False", "tcp_flags_ack": "True", "tcp_flags_fin": "False", "tcp_flags_rst": "False", "tcp_flags_psh": "False", "tcp_flags_urg": "False", "tcp_retransmission": "", "tcp_window_size": "62", "ttl_hop_limit": "64", "fragmentation": "No"}
{"timestamp": 1771756955.0625472, "protocols": "eth:ethertype:ip:tcp", "src_ip": "192.168.1.20", "dst_ip": "192.168.1.12", "src_port": "1716", "dst_port": "43814", "packet_size": "66", "payload_len": "0", "info": "[TCP Keep-Alive ACK] 1716 \u2192 43814 [ACK] Seq=2492 Ack=4570 Win=86016 Len=0 TSval=4216759898 TSecr=278989803", "tcp_seq": "2492", "tcp_flags_syn": "False", "tcp_flags_ack": "True", "tcp_flags_fin": "False", "tcp_flags_rst": "False", "tcp_flags_psh": "False", "tcp_flags_urg": "False", "tcp_retransmission": "", "tcp_window_size": "84", "ttl_hop_limit": "64", "fragmentation": "No"}
